URL,Restaurant Extracted,User Name,User Location,Friend Count,Review Count,Photo Count,Elite 17,Review Date,Review,Rating,Rating Extracted,Restaurant Extracted,Restaurant Extractedhttps://www.yelp.com/biz/christies-seafood-and-steaks-houston?start=0,christies-seafood-and-steaks-houston,Jeff C.,"Alexandria, VA",73,128,118,,10/10/17,"I just had to update my review. While the last one was excellent, I believe that now the restaurant is even better. Upon arrival, I was offered the choice of tables and was provided exceptional service by everyone, especially Amalia. The lunch menu offers a great selection of delicious choices at reasonable prices. I, of course, ordered the famous fried shrimp and took advantage of the crab ball special offered through Yelp. When I say everything was great, I mean everything. Although I would recommend substituting the French fries. While the onion rings are still excellent, a baked potato would be better than fries. If the fries were fresh cut and fried in only one fryer with peanut oil, who knows what compliments would flow? The current frozen ones simply do not match the caliber of the other items and have a muddled seafood after taste. Aside from this, I highly recommend the restaurant for outstanding seafood, superior service, and a very relaxing atmosphere. Treat yourself or someone special to a wonderful dining experience. What are you waiting for?Christie's and great seafood are bayou city staples. From the front door, you are greeted by friendly staff, a beautiful bar, and a combination of family and subtle mid-century elegance. The dining room is comfortable with reflections of various fishing conquests. As a diner of Christie's for decades I chose to celebrate my parent's 50 th anniversary and my wife's birthday with a quiet dinner at this special place. I was pleasantly surprised by the Yelp Check- in appetizer as well as their participation in the Taste of Houston promotion. Service was good, but not perfect. A tea glass should never go empty and stay empty for more than 10 minutes- especially when it is the great tea served here. But in true fashion, once this was corrected, it never occurred again. The salad with blue cheese dressing was underwhelming. The portion was small and the blue cheese dressing did not contain numerous large chunks of blue cheese as expected. The croutons, however, were fresh and plentiful. The seafood always tastes fresh. We love the fried shrimp. They did not disappoint. The shrimp are always large, succulent, well breaded, and fried to perfection. This is the main reason we have driven 25 miles to Christie's decade after decade. The ""tarter sauce"" is a creamy garlic condiment that defies description. It is delicious all by itself. Whether the fish, shrimp, or crab; we enjoyed them all. A small disappointment was the baked potato. It was different than those in past years. The potato had a soft skin and the fillings were already placed inside. In the past, the potato had a thicker skin and it was wrapped in foil. The fillings were served in a type of rotary stainless buffet as well. All in all, with improvements in a different potato and presentation coupled with more attentive service, Christie's will still maintain a special place in our hearts. This should definitely be a regular monthly or weekly dining experience for you and your family.","alt=""5.0 star rating""",5,christies-seafood-and-steaks-houston,christies-seafood-and-steahttps://www.yelp.com/biz/christies-seafood-and-steaks-houston?start=0,christies-seafood-and-steaks-houston,Jen S.,"Houston, TX",51,53,404,,6/8/17,"The Salmon Royale was amazing! Fresh, moist, blackened with just the right amount of flavor and finished with a cream sauce. Topped with mushrooms and shrimp - man this was AMAZING. And the lunch portion was accompanied with dirty rice and a salad all for only $16. Just fantastic. The service was professional and polite, although just a little slow. Only reason I rated 4 instead of 5 stars. I can't wait to come back and try more menu items. Great seafood on Westheimer.","alt=""4.0 star rating""",4,christies-seafood-and-steaks-houston,christies-seafood-and-steahttps://www.yelp.com/biz/christies-seafood-and-steaks-houston?start=0,christies-seafood-and-steaks-houston,Keith W.,"Austin, TX",1,69,12,,5/31/17,"My wife turned me on to Christie's. We come here as often as we can.They absolutely have the BEST fried shrimp I've ever eaten. I'm a picky eater who also knows how to cook. So when I give a compliment, it means something.My hats off to the chef and staff. It's always consistent and incredible.EVERY single dish that we've ordered over the last 25 years has been amazing!Maria and family deserve a plaque from the city of Houston. That's all :)))","alt=""5.0 star rating""",5,christies-seafood-and-steaks-houston,christies-seafood-and-steahttps://www.yelp.com/biz/christies-seafood-and-steaks-houston?start=0,christies-seafood-and-steaks-houston,Mark B.,"Houston, TX",413,302,2103,Elite ’17,1/15/17,"I have passed by this restaurant 1000's of times and have always been curious about it. They have been around since 1917 so they must be doing something right. It was a Sunday afternoon around 1:30, there were plenty of open tables. We must have just missed the church rush. I checked in on Yelp as soon as we were seated and I am glad I did because we received a free order of fried crab balls! I ordered the fried shrimp, it came with a garden salad, two onion rings, baked or au gratin potatoes. Everything tasted really fresh and delicious.","alt=""4.0 star rating""",4,christies-seafood-and-steaks-houston,christies-seafood-and-steahttps://www.yelp.com/biz/christies-seafood-and-steaks-houston?start=0,christies-seafood-and-steaks-houston,Matt S.,"Richmond, TX",45,284,1,Elite ’17,8/13/17,Had a great family dinner here. Wife and I with our parents. Had the gumbo which was good and tasted fresh. I decided to go stuffed crab and they were delicious. My wife had shrimp which was also fresh. I must say that they still do it good here at Christies.,"alt=""4.0 star rating""",4,christies-seafood-and-steaks-houston,christies-seafood-and-steahttps://www.yelp.com/biz/christies-seafood-and-steaks-houston?start=0,christies-seafood-and-steaks-houston,Megan B.,"Cypress, TX",91,12,2,,10/14/17,"I love the fact that a Houstian owns this restaurant which is why we had a date night here. The crab fingers, salad, shrimp and ranch was great. Wasn't a fan of the au grat potatoes. Very clean restaurant and fantastic staff. Our drinks were never empty.","alt=""4.0 star rating""",4,christies-seafood-and-steaks-houston,christies-seafood-and-steahttps://www.yelp.com/biz/christies-seafood-and-steaks-houston?start=0,christies-seafood-and-steaks-houston,Giuseppe T.,"Houston, TX",0,15,,,11/12/17,"This restaurant puzzles me, the food quality is apalling, inside looks like the 60s, but is still going. I went to see if a nice surprise would come out of it but it didnt, i guess die hard fans keep the business going.","alt=""1.0 star rating""",1,christies-seafood-and-steaks-houston,christies-seafood-and-steahttps://www.yelp.com/biz/christies-seafood-and-steaks-houston?start=0,christies-seafood-and-steaks-houston,Emily D.,"Galveston, TX",107,64,51,,5/2/17,"I decided on this place for my birthday dinner because I love the Roula & Ryan show and wanted to pay Roula's family (who owns the restaurant) homage. This is definitely a ""Houston classic"", one of those places you can rely on to continually deliver the same recipes time and again. I would recommend ordering something that they are ""known for"", such as their fried shrimp, which were delicious. The bread is great - hot and soft on the inside and crisp on the outside. The side of green beans was nothing to write home about, however. I was pleasantly surprised that they brought an ice cream sundae for my birthday dessert - many restaurants have stopped doing this nowadays.","alt=""4.0 star rating""",4,christies-seafood-and-steaks-houston,christies-seafood-and-steahttps://www.yelp.com/biz/christies-seafood-and-steaks-houston?start=0,christies-seafood-and-steaks-houston,Anhaar A.,"Westside, Houston, TX",0,2,,,9/1/17,"Best customer service! Great ambience. It was on a spur that we decided to try this restaurant. The Manager was very courteous and as we informed her that we have a special diet she immediately said they will accommodate our needs. We were served by Christina who was all smiles and ensured we had a good experience. We especially didn't want any alcohol in our meals and she advised us accordingly which ones to avoid. The food was good. Even my picky toddler ate the fried calamari and fried shrimps. We had salmon and the Shrimp Oyster Greek. Definitely will come again!","alt=""4.0 star rating""",4,christies-seafood-and-steaks-houston,christies-seafood-and-steahttps://www.yelp.com/biz/christies-seafood-and-steaks-houston?start=0,christies-seafood-and-steaks-houston,Bob B.,"San Antonio, TX",1,58,,,7/21/17,"Famous fried shrimp dinners are not as good (or as large and fresh) as the former Christies locations in San Antonio or Austin. I remember when a four or five piece shrimp dinner with wedge salad and a baked potato were more than filling and cost about $4.95 on Broadway across from Brackenridge Park in SA and Town Lake in Austin.The 1000 island salad dressing, tartar sauce and remoulade sauces aren't as good either. It's weird that the oldest location is also the worst and has stayed open the longest?Dinner prices are about triple what they were back in the 70s and 80s too so not much of a good value either. Lots of really old white people driving Buicks here too.","alt=""2.0 star rating""",2,christies-seafood-and-steaks-houston,christies-seafood-and-steahttps://www.yelp.com/biz/christies-seafood-and-steaks-houston?start=0,christies-seafood-and-steaks-houston,Michael B.,"Houston, TX",0,4,,,8/17/17,"I had the Old Fashioned Platter, btw, and it was awesome. Definitely more food than I could eat in one sitting.","alt=""5.0 star rating""",5,christies-seafood-and-steaks-houston,christies-seafood-and-steahttps://www.yelp.com/biz/christies-seafood-and-steaks-houston?start=0,christies-seafood-and-steaks-houston,Brooke C.,"Spring, TX",130,26,5,,6/19/17,"This place was awesome! I went for lunch and because someone at my table checked in, we got a free appetizer of their crab balls or something... They were really good. I ordered the salmon and got white rice with it and it as very good! They also bring bread to the table which was nice. The service was very good and I will definitely be going back!","alt=""5.0 star rating""",5,christies-seafood-and-steaks-houston,christies-seafood-and-steahttps://www.yelp.com/biz/christies-seafood-and-steaks-houston?start=0,christies-seafood-and-steaks-houston,Side W.,"Houston, TX",0,59,,,11/19/16,"3.5The GoodTheir famous shrimp - tasty!Ceasar salad - DeliciousFried cat fish - Very goodCustomer service - friendly and personableThe Bad & UglyGumbo - Don't do it.Bisque - Nothing like I've ever tasted. This is not a compliment.","alt=""3.0 star rating""",3,christies-seafood-and-steaks-houston,christies-seafood-and-steahttps://www.yelp.com/biz/christies-seafood-and-steaks-houston?start=0,christies-seafood-and-steaks-houston,Terri J.,"Friendswood, TX",1,11,11,,6/4/17,"We stopped in to try something new in the Galleria and absolutely LOVED the food and service. The history of this family run business was interesting as well! The restaurant decor needs a facelift, but the food was fantastic and the stuffed crab and oysters were the best I've ever had!","alt=""5.0 star rating""",5,christies-seafood-and-steaks-houston,christies-seafood-and-steahttps://www.yelp.com/biz/christies-seafood-and-steaks-houston?start=0,christies-seafood-and-steaks-houston,Mandi M.,"Nashville, IN",24,2,,,5/14/17,The food was average. The service was horrible. We waited over 30 minutes for waitress to take our order. Then we waited for our bill and had to go find the waitress who seemed to have forgotten she had customers.,"alt=""2.0 star rating""",2,christies-seafood-and-steaks-houston,christies-seafood-and-steahttps://www.yelp.com/biz/christies-seafood-and-steaks-houston?start=0,christies-seafood-and-steaks-houston,David B.,"Eden Prairie, MN",41,155,50,,11/5/16,"This restaurant dates back to 1917. Unbelievable seafood selection at very fair prices. Their fried shrimp was unbelievable and the seafood gumbo was the best I've ever tasted.Hope this restaurant last another 160 years. Outstanding! A must stop when in Houston.Near the Galleria.","alt=""5.0 star rating""",5,christies-seafood-and-steaks-houston,christies-seafood-and-steahttps://www.yelp.com/biz/christies-seafood-and-steaks-houston?start=0,christies-seafood-and-steaks-houston,Jenney L.,"Houston, TX",6,11,21,,8/21/16,"Visit: 08/20/2016 around 6pmPurpose: double birthday celebration and HRW1st course: 1917 RECIPE SEAFOOD GUMBO-The dish wasn't hot. It was barely even warm.-It wasn't very flavorful. We did add some salt, but something else was missing.-Also, some of my shrimps still had part of their shells attached.2nd course: 10 OZ CHARGRILLED STRIP SIRLOIN-This was by far my favorite. It was cooked just the way I wanted and very tasty.-The green beans on the side were too oily and looked kind of old and/or overcooked.3rd course: BANANA FOSTER PIE-I was thrown off when I received my dessert because it was actually a CAKE that tasted like banana foster.-For me, it was too sweet.My party did share food, so I got to taste some of the following as well:HOUSE SALAD-This was pretty standard. Nothing fancy.GULF PLATTER-Somewhat disappointing because I expected something... more.10 OZ CHARGRILLED STRIP SIRLOIN-My sister got the broccoli as her side and well... she basically got ONE mini tree... or a really large broccoli. It wasn't cut up at all.CHOCOLATE LAYER CAKE-Again, way too sweet for my tastes.SHRIMP IN LEMON GARLIC CREAM-Initially, I thought it was too heavy and thick, but with another taste, I must say it was quite good.OYSTERS (cooked, don't know what it's called but not 'Oysters Rockefeller')-First time having oysters, it was quite delicious, but there was slightly too much cheese on top.","alt=""2.0 star rating""",2,christies-seafood-and-steaks-houston,christies-seafood-and-steahttps://www.yelp.com/biz/christies-seafood-and-steaks-houston?start=0,christies-seafood-and-steaks-houston,Darlene J.,"Houston, TX",0,4,,,7/29/17,I ate there yesterday lunch. The food was outstanding. I had the fried shrimp plate with fries. It was almost more than I could eat...no room for dessert this time. That's too bad because their desserts are delicious!,"alt=""5.0 star rating""",5,christies-seafood-and-steaks-houston,christies-seafood-and-steahttps://www.yelp.com/biz/christies-seafood-and-steaks-houston?start=0,christies-seafood-and-steaks-houston,Jay Y.,"Houston, TX",638,985,1764,Elite ’17,2/8/15,"Christie's is a classic seafood restaurant that has been around in the Houston area since the early 1900s. Its menu boasts a proud roster of traditional American seafood dishes, including its signature fried shrimp. Despite of its distance from Galveston, the restaurant decor will make you feel as if you are dining by the Bay! The southern hospitality and the attentive service from the waiting staff will make you feel at home.Unfortunately, Christie's food was bland in flavor and unimpressive in presentation. Christie's signature fried shrimps were as large as its reputation and fresh judging by the texture, but sadly they were lacking in flavor. The onion rings were also strangely bland too. I thought it was disappointing that the cole slaw was the only thing that tastes like something.The bottom line is that Christie's, especially its fried shrimps, is an experience that should be had at least once if you are into the Houston dining scene because of its history, but do not expect anything surprising from the food here.*Go during weekday lunch or happy hour for cheaper pricings. You can secure an entree of six signature fried shrimps, which includes cole slaw and fries (Substitute it for onion rings if you like) for $13.95.---tl;dr version:1) Nice decor that tricks you into thinking you are close at Bay2) Southern hospitality = Pleasant dining experience3) Bland and disappointing seafood","alt=""3.0 star rating""",3,christies-seafood-and-steaks-houston,christies-seafood-and-steahttps://www.yelp.com/biz/christies-seafood-and-steaks-houston?start=0,christies-seafood-and-steaks-houston,Gracie E.,"Houston, TX",0,14,,,8/14/17,"My Fried Shrimp was really good, gave my lots of sauces. Need to go back & try other items.","alt=""4.0 star rating""",4,christies-seafood-and-steaks-houston,christies-seafood-and-steahttps://www.yelp.com/biz/christies-seafood-and-steaks-houston?start=20,christies-seafood-and-steaks-houston,Les A.,"Houston, TX",0,24,,,2/28/17,"In a City where there is such a high failure rate for restaurants there is a reason this one has been around since 1917. The food is simple, but well done and tastes great! Unpretentious, friendly service. Generous servings, fresh food at very reasonable prices. Another thing we liked was that the room is relatively quite. We could enjoy our meals and conversation without the LOUDNESS!! that seems typical of so many newer places.","alt=""5.0 star rating""",5,christies-seafood-and-steaks-houston,christies-seafood-and-steahttps://www.yelp.com/biz/christies-seafood-and-steaks-houston?start=20,christies-seafood-and-steaks-houston,amanda s.,"McKinney, TX",14,59,13,,9/26/15,"Thank god for Yelp! We're visiting from out of town and we're hoping to find a good seafood restaurant and we hit the jackpot! It looks a little suspicious from the road but you'll be pleasantly surprised once you get in the front door. The staff was very nice and welcoming from the moment we got there until we left. We arrived early so it wasn't too busy but it was packed by the time we were done. Our waiter Jose was fabulous, we could hear him giving the man next to us (who had lots of questions) the full rundown of the menu, specials and favorites. The food was fresh and delicious! We were so shocked when we got the bill less than $100 for both of us with drinks. Next time we're in Houston we will definitely be stopping by.","alt=""5.0 star rating""",5,christies-seafood-and-steaks-houston,christies-seafood-and-steahttps://www.yelp.com/biz/christies-seafood-and-steaks-houston?start=20,christies-seafood-and-steaks-houston,Kitrina D.,"Atlanta, GA",10,219,40,,1/2/17,"Staple seafood in the Houston area! I just tried Christie's for the first time, and it definitely wasn't a disappointment. The portions are huge, the service is very friendly, and the food itself was very good quality. I tried the original fish sandwich and tried a bite of the shrimp. Both were very good, but I would definitely recommend the fried shrimp over the fish sandwich. I would definitely go back'!","alt=""4.0 star rating""",4,christies-seafood-and-steaks-houston,christies-seafood-and-steahttps://www.yelp.com/biz/christies-seafood-and-steaks-houston?start=20,christies-seafood-and-steaks-houston,Melanie H.,"Houston, TX",239,451,600,Elite ’17,5/29/14,"I adore Christie's. I grew up eating out here with my grandparents and they knew a thing or two about fried shrimp! I too have eaten a lot of friend shrimp in my life and I truly think Christie's tastes the best and the freshest. Even though they're on Westheimer, not all that close to the Gulf...Besides the fried shrimp, the sides and bread are also pretty good. The service is always very professional and I love the 1960's feel of the restaurant. And Mr. Christie, before he died, was always very nice and friendly to my family.We've celebrated wedding anniversaries and birthdays here for years and I hope to keep coming back. :)","alt=""5.0 star rating""",5,christies-seafood-and-steaks-houston,christies-seafood-and-steahttps://www.yelp.com/biz/christies-seafood-and-steaks-houston?start=20,christies-seafood-and-steaks-houston,Maria M.,"Lawrenceburg, TN",4,66,125,,5/22/16,"Went here for Houston Restaurant week, which is a pretty good deal, got all the meals appetizer, entrees and dessert. Good service","alt=""4.0 star rating""",4,christies-seafood-and-steaks-houston,christies-seafood-and-steahttps://www.yelp.com/biz/christies-seafood-and-steaks-houston?start=20,christies-seafood-and-steaks-houston,Persia L.,"Richmond, TX",7,36,23,,2/26/16,"I ordered the Steak with Jumbo lump crabmeat ,.. The environment is laid back and calm. The waitress provided decent customer service.","alt=""3.0 star rating""",3,christies-seafood-and-steaks-houston,christies-seafood-and-steahttps://www.yelp.com/biz/christies-seafood-and-steaks-houston?start=20,christies-seafood-and-steaks-houston,Rachel R.,"Spring, TX",141,1,,,11/12/16,I have passed this restaurant for years and I Moved down the street recently and decided to give it a try. I am so happy I did! I have eaten here numerous times since and everything I have tried has been wonderful. I just found out they have a to go window. I will be using this for sure!,"alt=""5.0 star rating""",5,christies-seafood-and-steaks-houston,christies-seafood-and-steahttps://www.yelp.com/biz/christies-seafood-and-steaks-houston?start=20,christies-seafood-and-steaks-houston,Kimberly M.,"Houston, TX",3,5,,,9/30/16,"I love the crunch on their fried catfish. It is actually well seasoned. The service was great, the food was great, and I'd definitely go back. Thanks to yelp we got and order of complimentary crab balls. They were tasty as well.","alt=""4.0 star rating""",4,christies-seafood-and-steaks-houston,christies-seafood-and-steahttps://www.yelp.com/biz/christies-seafood-and-steaks-houston?start=20,christies-seafood-and-steaks-houston,Anna P.,"Greenville, SC",0,5,,,11/4/16,"Excellent multi bite shrimp, ribeye steak seasoned and cooked perfectly. The rolls are to die for!!","alt=""5.0 star rating""",5,christies-seafood-and-steaks-houston,christies-seafood-and-steahttps://www.yelp.com/biz/christies-seafood-and-steaks-houston?start=20,christies-seafood-and-steaks-houston,Marco E.,"Flower Mound, TX",0,5,,,4/14/17,Fried shrimp with a village salad is the way to go. I always get them with extra remoulade sauce. Worth the five hour drive.,"alt=""5.0 star rating""",5,christies-seafood-and-steaks-houston,christies-seafood-and-steahttps://www.yelp.com/biz/christies-seafood-and-steaks-houston?start=20,christies-seafood-and-steaks-houston,Carl R.,"West Oaks, Houston, TX",0,16,10,,2/3/15,"The decor was nice and what you'd expect from a seafood restaurant. I went when there wasn't much of a crowd so the waiter was accommodating and attentive. I ordered the 14oz sirloin strip with a baked potato and a cup of gumbo on the side. Everything was hot and tasted fresh. The steak charred nicely but was a bit bland in my opinion. Not a total loss seeing as how adding table salt and pepper easily fixed it, but I do like the seasoning charred into the meat. I don't normally order baked potatoes as sides as it tends to be a bit much, but the size of it was perfect especially considering the gumbo. Again, that too was a bit bland even with the sour cream, butter, cheese and chives. I'm a bacon bits fan so that may have been the letdown for me.The gumbo had the most flavor but it was something different about it. I kind of smelled and tasted like they put curry in it. If they did, it wasn't necessarily bad as it was different. Overall it was a pleasant dinner but my only gripe would be that for what you get, it's not worth the price, which from what I can see, rival that of a Pappadeaux.","alt=""4.0 star rating""",4,christies-seafood-and-steaks-houston,christies-seafood-and-steahttps://www.yelp.com/biz/christies-seafood-and-steaks-houston?start=20,christies-seafood-and-steaks-houston,Colin G.,"Houston, TX",48,1,,,8/6/16,"My favorite restaurant in Houston! What can I say? The Greek village salad with hot rolls and butter, fried calamari and the amazing rib eye with the fried shrimp is simply amazing. Did I mention the awesome wait staff? No wonder it's been around for so long . Definitely recommend","alt=""5.0 star rating""",5,christies-seafood-and-steaks-houston,christies-seafood-and-steahttps://www.yelp.com/biz/christies-seafood-and-steaks-houston?start=20,christies-seafood-and-steaks-houston,Tommy P.,"Houston, TX",99,8,,,6/23/16,Hey!!! Looks like a fishe tank in here! Great place but I think I may shart after so much shrimp scampi,"alt=""5.0 star rating""",5,christies-seafood-and-steaks-houston,christies-seafood-and-steahttps://www.yelp.com/biz/christies-seafood-and-steaks-houston?start=20,christies-seafood-and-steaks-houston,Sandy T.,"Houston, TX",24,3,,,2/6/16,"Tried Christie's with my family for the very first time today and was served raw fried shrimp. I mean really? I can get better fried seafood at Long John Silver's than this so call ""seafood restaurant"" for 1/4 of the price. The breadcrumbs outside were brown (cooked) but the batter was literally raw inside. I thought it tasted funny until my husband said something. As we were walking out, a lady (I think is the owner) said they're not aware of their cook serving raw fried shrimp. But if you look at the reviews someone had already complained about their shrimp meal back in October. My stomach does not feel good now, if this continues until the morning I will seek treatment for food poisoning and hold this restaurant responsible. 02/06/2015:It's ashamed that you're serving raw fried shrimp if you have been cooking it for 100 years. If you do take food safety seriously you will not be serving raw food when its supposed to be cooked.","alt=""1.0 star rating""",1,christies-seafood-and-steaks-houston,christies-seafood-and-stea