URL,Restaurant Extracted,User Name,User Location,Friend Count,Review Count,Photo Count,Elite 17,Review Date,Review,Rating,Rating Extracted,Restaurant Extracted,Restaurant Extractedhttps://www.yelp.com/biz/christies-seafood-and-steaks-houston?start=20,christies-seafood-and-steaks-houston,Lee D.,"Round Rock, TX",39,71,47,,9/10/15,"Well reading mixed reviews being as old as it is, it must be doing something right and it is! First called to check if parking can handle large cars and has wifi. Answer yes and yes! So already who's answering the phone knows. Had a lunch seafood plate, shrimp cooked prefect, dam good! Stuffed crab actually Had lots of crab in it and crispy outer skin and moist inside, catfish done right crispy outside and moist inside and not the fishy taste most catfish has! Yep it was good too, had all three sauces and so good, each one had its own taste! Tarter, Cocktail, and remoulade. And fresh tea not the watered down pitchers that sit there. Also Italian dressing on house salad very tasty with fresh veggies. Service was spot on not over done and kept up! Jose was great server, and Maria came by and spoke with me as well and was very sweet and explained menu as well. Thumbs up!!!!","alt=""5.0 star rating""",5,christies-seafood-and-steaks-houston,christies-seafood-and-steahttps://www.yelp.com/biz/christies-seafood-and-steaks-houston?start=20,christies-seafood-and-steaks-houston,Heather A.,"Westside, Houston, TX",0,2,,,1/28/17,"This was my first time trying this restaurant. The staff is amazing and very attentive. My glass never got below half and they anticipated all of my needs before I had to ask. My food was pretty good. I ordered the stuffed shrimp. I think I will be back again but I'll defIntel order something else. I didn't feel like the shrimp was worth $19. My ""Galveston Island Tea"" as they call it was well mixed and arrived quickly. Not a bad place and I'll definitely be back.","alt=""4.0 star rating""",4,christies-seafood-and-steaks-houston,christies-seafood-and-steahttps://www.yelp.com/biz/christies-seafood-and-steaks-houston?start=20,christies-seafood-and-steaks-houston,Dago R.,"McAllen, TX",2,5,3,,3/7/16,"Moved to Houston a few months ago and have enjoyed eating at different locations for variety. I decided to stop by Christies to see what it was about. I had a wonderful experience and great food. The place looks formal and I came in jeans... Almost thought there would be a dress code. I was greeted warmly and never made to feel out of place. The service was on spot as I had more than one person attending my needs. The manager even served my food. I can tell giving good service and quality food is a priority here. I had the seafood gumbo, fried shrimp, Caesar salad and key lime pie. All of it was amazing. I will return and recommend this restaurant to anyone.","alt=""5.0 star rating""",5,christies-seafood-and-steaks-houston,christies-seafood-and-steahttps://www.yelp.com/biz/christies-seafood-and-steaks-houston?start=20,christies-seafood-and-steaks-houston,Matt T.,"Houston, TX",76,11,1,,7/12/16,I have been to Christie's 6 or 7 times and have ordered one thing there - The Snapper Fillet. It is some of the best seafood I've ever had. Try it if you haven't! It's $29 which is a lot but it's filling and tasty.,"alt=""5.0 star rating""",5,christies-seafood-and-steaks-houston,christies-seafood-and-steahttps://www.yelp.com/biz/christies-seafood-and-steaks-houston?start=20,christies-seafood-and-steaks-houston,Mia W.,"Houston, TX",0,16,18,,9/7/15,"Went during Restaurant Week at lunchtime. We were able to enjoy a two course meal. Since it was a prix-fixe menu our options were limited but it was still an enjoyable meal. Would like to go back and order from their standard menu. Great service, very cozy inside.","alt=""3.0 star rating""",3,christies-seafood-and-steaks-houston,christies-seafood-and-steahttps://www.yelp.com/biz/christies-seafood-and-steaks-houston?start=20,christies-seafood-and-steaks-houston,Kelly Y.,"Houston, TX",7,23,2,,11/30/16,"Some of my favorite fried shrimp ever! The service is great, portions are huge and food is fresh and tasty. Plus there is a drive thru so it makes take out that much better. This is definitely my favorite neighborhood spot to get my fried shrimp fix!","alt=""5.0 star rating""",5,christies-seafood-and-steaks-houston,christies-seafood-and-steahttps://www.yelp.com/biz/christies-seafood-and-steaks-houston?start=40,christies-seafood-and-steaks-houston,Dallas H.,"Houston, TX",0,5,1,,7/5/16,Wonderful food and service... Quite setting.. almost like a private club... Not to mention the best fried shrimp ever.. A Great Houston Tradition...,"alt=""4.0 star rating""",4,christies-seafood-and-steaks-houston,christies-seafood-and-steahttps://www.yelp.com/biz/christies-seafood-and-steaks-houston?start=40,christies-seafood-and-steaks-houston,Max H.,"Bellaire, TX",18,40,3,,6/27/15,"I'm from San Antonio and as a child, my family use to go to Christie's on weekends. I'm not 100% positive the same owners of this Christie's and the now closed Christie's across from the museum in SA. are the same but i would not be surprised.Anyway, Christie's is definitely old-school. And they know what they are doing. Service is great. Fish is fresh. Try the crab balls, which are just smaller crab cakes. They have an awesome creamy texture. (I got them for FREE.!! Thanks to Yelp and the popup coupon on my iPhone app! ) I had the red snapper which was great. My side of green beans sauteed w bacon was refreshingly crisp not overdone . But as I looked around, I noticed most of the people were ordering jumbo fried shrimp. As the food envy built to a crescendo, I made a promise to myself that I would order those on my next trip.","alt=""4.0 star rating""",4,christies-seafood-and-steaks-houston,christies-seafood-and-steahttps://www.yelp.com/biz/christies-seafood-and-steaks-houston?start=40,christies-seafood-and-steaks-houston,Shannon W.,"Houston, TX",6,29,2,,4/10/16,"The service was good and the restaurant was clean and cute. However, were very disappointed with the food. We shared a fried seafood platter and while the portions were generous the quality was poor. It was very bland and seemed to us to be frozen rather than fresh seafood. We really wanted to like this restaurant from another era but couldn't.","alt=""2.0 star rating""",2,christies-seafood-and-steaks-houston,christies-seafood-and-steahttps://www.yelp.com/biz/christies-seafood-and-steaks-houston?start=40,christies-seafood-and-steaks-houston,Kendall G.,"Houston, TX",1,12,1,,7/17/15,"Like other reviewers have said, this is the best fried shrimp in Houston. We checked in and received a complimentary crab ball appetizer - it was really creamy, flavorful, and full of crab. We also had the fried calamari - it was average. The fish sandwich was large and very good, as well. Service was attentive but not overbearing. The atmosphere is fun - fish and old pictures of Houston on the walls. This is our new favorite spot for fried seafood.","alt=""4.0 star rating""",4,christies-seafood-and-steaks-houston,christies-seafood-and-steahttps://www.yelp.com/biz/christies-seafood-and-steaks-houston?start=40,christies-seafood-and-steaks-houston,Chanel J.,"Klein Crossing, TX",60,18,13,,11/22/13,"This was my first experience and will be my last. The service was mediocre not rude by far, but where is the seasoning. The flavors are underwhelming and the presentation left much to be desired. When we pulled into the parking lot it was very empty for a Friday evening, but decided to give it a try. As a native Houstonian I had not never heard of Christie's but we wanted to try a new place. Needless to say with these prices and taste, we should've turned out the half-empty parking lot and went to Pappadeaux!","alt=""2.0 star rating""",2,christies-seafood-and-steaks-houston,christies-seafood-and-steahttps://www.yelp.com/biz/christies-seafood-and-steaks-houston?start=40,christies-seafood-and-steaks-houston,Keith M.,"Houston, TX",9,8,2,,2/10/13,"What a disappointment...I am an avid Yelp user as I travel a lot and always use Yelp to find a good restaurant close by; however, this is the first time I've been let down.Recently moving into the uptown area, I noticed this place and all the cars out front. Decided to Yelp it and was impressed with reviews and history. Started tell my friends that we needed to make a visit here.Last night had friends over and made reservations. All looked well, the menu looks great but having read the reviews, many of us decided on the house favorite, fried shrimp. Received the free crab balls appetizer... yuck. If you like stuffing, you will love these.The shrimp came and the first thing my guest said was that these looked like they were Gordon's frozen shrimp. I think he was right. Just plain old box frozen shrimp. No way you can hand bread and fry shrimp and they look like all identical and the texture of shrimp were mushy. Yes, I need a doggy bag to bring many home because I wanted to post a picture of them so others won't make same mistake (if I can figure out how to do a pic upload!).$150 disappointment and embarrassment! At least the two bottles of wine and company was great.In retrospect, we should have tried other items and not all settled on the shrimp. Maybe the other menu items are worth it. Keith","alt=""1.0 star rating""",1,christies-seafood-and-steaks-houston,christies-seafood-and-steahttps://www.yelp.com/biz/christies-seafood-and-steaks-houston?start=40,christies-seafood-and-steaks-houston,Rebecca N.,"Houston, TX",17,35,,,6/5/14,"Christie's is what Houston is all about. My mother (from Iowa) told me once that she married my father because she knew she would get to live in Houston and eat fried shrimp. I've no doubt she meant at Christie's. (1940's) I remember as a child going to Christie's when it was in what is now the Houston Medical Center. (1960's) It was the only place that had white table cloths that my parents would take me and my four brothers. All these years later and I can swear that the service and the food remains as high quality as ever. (They've been at the Westheimer location just west of the Galleria since 1965). You can not buy tartar sauce as delicious as their tartar sauce. It is amazing. Pass me a spoon. Now they are serving salads that fit perfectly with the summer season. There is a lump crabmeat salad with avocado and mango with the perfect mix of fresh peppers, onion, and vinaigrette. Wow! This restaurant is the best!","alt=""5.0 star rating""",5,christies-seafood-and-steaks-houston,christies-seafood-and-steahttps://www.yelp.com/biz/christies-seafood-and-steaks-houston?start=40,christies-seafood-and-steaks-houston,Amber E.,"Houston, TX",110,25,1,,9/2/15,"My husband and I are not happy campers. The service was so slow in regards to attentiveness that we decided to order appetizers and leave for another restaurant. The shrimp cocktail was fresh, and the crab balls were good. Unfortunately, we will not return.","alt=""2.0 star rating""",2,christies-seafood-and-steaks-houston,christies-seafood-and-steahttps://www.yelp.com/biz/christies-seafood-and-steaks-houston?start=40,christies-seafood-and-steaks-houston,Moni V.,"Richmond, TX",0,17,22,,12/5/15,"-- My family and I would come here during my early childhood years. We stopped coming and decided to come back TWENTY years later. Now I'm 26, my brother is 35, and my parents are in their late 50's! The restaurant seems like it hasn't changed one bit and the food continues to be delicious! Definitely an older crowd type of place, but worth your time.","alt=""4.0 star rating""",4,christies-seafood-and-steaks-houston,christies-seafood-and-steahttps://www.yelp.com/biz/christies-seafood-and-steaks-houston?start=40,christies-seafood-and-steaks-houston,Carlos S.,"Houston, TX",21,2,8,,8/15/15,The overall service is ok. The restaurant was less than half full but still had to wait over to minutes for our food. I asked for red snapper but instead got catfish. It came with dirty rice but it was actually mexican rice. The food tasted ok but I did not get what I asked for. Will not be coming back.,"alt=""1.0 star rating""",1,christies-seafood-and-steaks-houston,christies-seafood-and-steahttps://www.yelp.com/biz/christies-seafood-and-steaks-houston?start=40,christies-seafood-and-steaks-houston,Thuy T.,"Houston, TX",0,3,,,9/6/14,"Decided to finally try Christie's after being avid Roula and Ryan show listeners. We came in pretty early on a Saturday - about 5:30pm and there was only one other table there. It was very dim and nautically decorated. Could use some updating.We ordered the Oysters Rockefeller to start. They were just okay; needed some more texture. The salads were typical, nothing to comment on. I ordered the Beluche and he had the Christie's Pride. Unfortunately neither of these dishes were much to be proud of. They were both terribly bland and required a lot of salt, pepper, lemon, and tobasco to make them tolerable. We both got asparagus as a side and thankfully they were fine. We decided to pass on dessert after our disappointing entrees. The service was alright, friendly enough. They have a bad habit of putting too much ice in your glass of water, in such a way that one sip immediately requires another refill. All in all, the food was bland and the value wasn't great. We don't plan on returning.","alt=""2.0 star rating""",2,christies-seafood-and-steaks-houston,christies-seafood-and-steahttps://www.yelp.com/biz/christies-seafood-and-steaks-houston?start=40,christies-seafood-and-steaks-houston,Hot M.,"Houston, TX",0,27,12,,8/29/14,"Awesome , authentic, feels like Florida seafood. We had three drinks , all were carefully crafted. Steak was ok however , everything else was a 10 . Service , check. Food, check. Parking, check. It was a great experience from beginning to end. Try the frozen margarita with grand marnier, your husband will thank me later.","alt=""5.0 star rating""",5,christies-seafood-and-steaks-houston,christies-seafood-and-steahttps://www.yelp.com/biz/christies-seafood-and-steaks-houston?start=40,christies-seafood-and-steaks-houston,Carolyn R.,"Houston, TX",0,2,,,6/5/16,"Okay I was planning a special day for my Girls and everyone wanted Seafood so we Google places to eat we are so in tune to Seafood, we grew up eating fresh seafood, so we decided on Christie Steak and Seafood. I'm sorry to report but the food was horrible they are known for their Fresh Shrimp and you can't make me believe for one moment it was fresh I was so disappointed everything seemed to be frozen. The Ribeye Steak was awful I really wanted to ask for a refund but was convinced by my kids not to complaint they said it would be embarrassing to them so against my better judgement I kept my mouth close","alt=""1.0 star rating""",1,christies-seafood-and-steaks-houston,christies-seafood-and-steahttps://www.yelp.com/biz/christies-seafood-and-steaks-houston?start=40,christies-seafood-and-steaks-houston,Vic C.,"Houston, TX",12,244,8,,1/1/14,"It was OK, but I wouldn't drive 30 minutes again. YMMV if you live in the neighborhood - I think I'd probably eat here frequently if I did.Service 3 1/2 - standard well-meaning but semi-professional. Wait, what do I mean ""standard"" - well-meaning semi-professional is actually very good *for* *around* *here*.Food pretty good. Salad 3 - bleu cheese dressing OK, greens nothing to write home about, cornbread outstanding - the gritty, not-too-sweet kind I like. Fried shrimp 4, stuffed shrimp 2 1/2 - I don't know what the stuffing was intended to be, but to me it tasted like bread crumbs inside of breading- what's the point of that? Onion rings 4 - not the style I like (I prefer tempura style to the flat coating), but good for what they were. Baked potato 5 - fluffy with a tender skin (I like to eat the skin) and super-loaded as I had requested. Hubby said the burger was good. It was also more than he could eat. I had one of his fries to see how they were - 4 1/2. Crispy on the out side and fluffy on the inside, hot and tasty. I should have shaken a tad of salt on them.Well. I'm drawing the conclusion from my own writing that the food must have made a positive impression on me - when do I do star ratings? Never.The decor was old-fashioned (as well as just old) and cute. I liked it. The booths were comfortable. According to houston.tx.gegov.com/med… it is pretty clean. The view is of lovely Westheimer, and the sound system music is supplemented by the lovely sound of sirens, but what are you gonna do......?The wine list prices were also pretty good.I did start out with a bad impression, though, and it's probably why I'm three instead of four stars. I was served the worst martini I've ever had in a restaurant, and I've had plenty of bad ones. (I order them fully aware that it's a 40/60 chance, at best, of getting an acceptable one, much less a good one. I know, I should just give up. I just can't get it through my head that, yes, people can mess up something that simple. A lot.) (BTW, I do mean an actual martini, not some yucky concoction served in a martini glass.)It was water, basically. I had ordered it stirred (mentioning as an aside that that meant I did not want it watered down, even elaborating that the time in contact with the ice should be limited.) Then I hear from the bar stirring. A pause. And stirring. A pause. And stirring. A pause. I'm saying to hubby (as this goes on and on), ""I hope that is not my poor martini."" It was.","alt=""3.0 star rating""",3,christies-seafood-and-steaks-houston,christies-seafood-and-steahttps://www.yelp.com/biz/christies-seafood-and-steaks-houston?start=40,christies-seafood-and-steaks-houston,Naomi A.,"Bay City, TX",28,29,22,,1/29/15,"To me, it was bland and boring. Just like the date who took me! Nothing special, interior was good at nostalgic, bad way out of date.","alt=""2.0 star rating""",2,christies-seafood-and-steaks-houston,christies-seafood-and-steahttps://www.yelp.com/biz/christies-seafood-and-steaks-houston?start=40,christies-seafood-and-steaks-houston,Karen C.,"Houston, TX",2,65,10,,7/14/15,"A Houston landmark! One of the best fried shrimp in town, if not the best! One of our celebration restaurants! I have tried a few items but love the fried shrimp, stuffed is Quite tasty!","alt=""5.0 star rating""",5,christies-seafood-and-steaks-houston,christies-seafood-and-steahttps://www.yelp.com/biz/christies-seafood-and-steaks-houston?start=40,christies-seafood-and-steaks-houston,Gokhan K.,"Houston, TX",5,4,8,,9/6/13,"I have been seeing Christie's Seafood for a long time which is on my way to drive home. Finally I gave it a shot and it was not the last one. I loved service, appetizers and the options they offer with the main course.Raw oysters were very fresh and tasty. Fried calamari was really good. I ordered chargrilled salmon and it came with greek salad and baked potato. You can also pick different sides instead of baked potato as french fries or vegetables. Prices are reasonable according to plates and service.There is a modification at the outside of restaurant. I think it will have a better outlook soon.","alt=""4.0 star rating""",4,christies-seafood-and-steaks-houston,christies-seafood-and-steahttps://www.yelp.com/biz/christies-seafood-and-steaks-houston?start=40,christies-seafood-and-steaks-houston,Jamey W.,"Arlington, TX",7,53,12,,1/22/15,Great hole in the wall seafood and steak house. It is deceiving from outside but take one step in and you won't be disappointed. The Athenian Tilapia was amazing and I will have to have it again.,"alt=""4.0 star rating""",4,christies-seafood-and-steaks-houston,christies-seafood-and-steahttps://www.yelp.com/biz/christies-seafood-and-steaks-houston?start=40,christies-seafood-and-steaks-houston,Angel H.,"Houston, TX",0,5,,,6/21/15,"Always our go to place for special occations when you are looking for a really great meal. We think they have some of the best fried shrimp in the city. Their sauces are home made as well as their dressings. I always have to get double blue cheese on my salad because it is so yummy. Sometimes when they are super busy (i.e. holidays) the service can be slow; but give them a break, it's a long busy day. If you need something, ask for it, and the waitstaff will happily accommodate.","alt=""4.0 star rating""",4,christies-seafood-and-steaks-houston,christies-seafood-and-steahttps://www.yelp.com/biz/christies-seafood-and-steaks-houston?start=40,christies-seafood-and-steaks-houston,Jessica L.,"Dallas, TX",5,17,1,,3/30/14,"Omg they brought a drink to me with mold! I thought this place was cute and would have come back, but the mold then the waiter said it might be whip cream wtf? I am attaching a pic, you tell me if it is whip cream.","alt=""1.0 star rating""",1,christies-seafood-and-steaks-houston,christies-seafood-and-steahttps://www.yelp.com/biz/christies-seafood-and-steaks-houston?start=60,christies-seafood-and-steaks-houston,Jessica B.,"Houston, TX",77,101,,Elite ’17,7/16/13,I literally threw up in the parking lot after eating here. Disgusting and overpriced.,"alt=""1.0 star rating""",1,christies-seafood-and-steaks-houston,christies-seafood-and-steahttps://www.yelp.com/biz/christies-seafood-and-steaks-houston?start=60,christies-seafood-and-steaks-houston,John M.,"Luling, TX",722,19,6,,9/22/14,"I am so disappointed....ambience is great, Hostess was friendly, & the waiter was attentive.....but the food was a disappointment. My seafood gumbo was adequate, but the rue left much to be desired. The fried shrimp was perfectly formed and patted like Mrs. Paul's frozen shrimp would look & taste. The cole slaw was bland. The French fries were probably the best part of the meal, & they weren't that great!","alt=""1.0 star rating""",1,christies-seafood-and-steaks-houston,christies-seafood-and-steahttps://www.yelp.com/biz/christies-seafood-and-steaks-houston?start=60,christies-seafood-and-steaks-houston,Maureen S.,"River Oaks, Houston, TX",1,47,32,,4/3/15,"We have been coming here for years. In fact, 5 generations of our family have been enjoying the fish sandwich and the fried shrimp almost from the inception of the restaurant. The plump, juicy fried shrimp are some of the best around. And, I love the fact that it still is owned by the family that originally started the restaurant.","alt=""4.0 star rating""",4,christies-seafood-and-steaks-houston,christies-seafood-and-steahttps://www.yelp.com/biz/christies-seafood-and-steaks-houston?start=60,christies-seafood-and-steaks-houston,Glen E.,"Conroe, TX",0,52,8,,2/17/16,"Haven't been here in 35 years... Thought i'd take the wife, and told her how great ""it used to be."" How very, true! I had the Seafood Platter, and she did as well. Catfish, was fishy, tasting. Onion Rings were prebreaded and under cooked... basically unedible. Shrimp, Crab, and Boiled Shrimp, were good! Breading was heavy, and too much cornbready. Rolls were hard. After driving 53 miles, and in traffic, quite the disappointment!!!","alt=""2.0 star rating""",2,christies-seafood-and-steaks-houston,christies-seafood-and-steahttps://www.yelp.com/biz/christies-seafood-and-steaks-houston?start=60,christies-seafood-and-steaks-houston,Jennifer W.,"Lincoln, NE",3,40,,,1/11/16,"My family's been coming here (and previous locations) since before I was born ... and I'm nearly 50! I don't live in Houston anymore, but every time I come home I have to go to Christie's for the fried shrimp. No one does it better.","alt=""5.0 star rating""",5,christies-seafood-and-steaks-houston,christies-seafood-and-steahttps://www.yelp.com/biz/christies-seafood-and-steaks-houston?start=60,christies-seafood-and-steaks-houston,Destiny O.,"Houston, TX",10,15,1,,4/6/15,"Went here for Easter dinner and was soooo impressed .....first our flavor margaritas were one of the BEST frozen margarita I ever had!!! Then the food!!!! SOOOOOOOOO GOOD!!!! I had stuffed & fried shrimp, as gratin potatoes, gumbo and dirty rice, Nothing was bad. Service was excellent! The timing of when each dish came out was perfect!!!! GREAT EXPERIENCE CANT WAIT TO GO BACK !!!","alt=""5.0 star rating""",5,christies-seafood-and-steaks-houston,christies-seafood-and-steahttps://www.yelp.com/biz/christies-seafood-and-steaks-houston?start=60,christies-seafood-and-steaks-houston,Tony W.,"Tucker, GA",39,107,1,,3/26/13,"Well, I sat at the bar on a slow night after attempting to dine across the street. The service was top notch. If you follow my reviews I eat out often due to business travel.Here is what I can say, I loved the service, I loved the oysters, I loved the company. I would return and will next time I am in Houston, anywhere in Houston.Me, I probably wouldn't order fried shrimp anywhere, but that's just me... I like my seafood fresh as can be and the oysters were excellent. Martinis were top shelf, better than across the street!","alt=""3.0 star rating""",3,christies-seafood-and-steaks-houston,christies-seafood-and-stea