URL,User Name,User Location,Friend Count,Review Count,Photo Count,Elite 17,Review Date,Review,Rating,Rating Extracted,Restaurant Extracted,Restaurant Extractedhttps://www.yelp.com/biz/doyles-restaurant-houston?start=0,Don M.,"Houston, TX",26,18,68,,6/20/17,"Great Home Style Italian dishes, from Salad, pizza , subs, hot pasta dishes. We came here, our first time, with friends. The minute we walked in the door, we wre met with wonderful Italian cooking smells. Not only that, we were also treated like ole time friends that came over to dinner! Laughter, smiles and great conversations going in everywhere! From the LaSagna, Spaghetti to the Ub sandwiches, consistent preperation and satisfaction of great test. ""chips and salsa, not here, but you do get relish tray with dressin, bread, etc. It is a must to try. Don't let the location confuse you! It's okay. By the way they have a great coordinated take out.","alt=""5.0 star rating""",5,doyles-restaurant-houston,doyles-restaurant-houstonhttps://www.yelp.com/biz/doyles-restaurant-houston?start=0,Michelle O.,"Spring, TX",4,68,376,Elite ’17,10/28/17,"Doyle's feels like an American home-cooking restaurant, which it is. It has wood accents and is decorated with past photos of the restaurant. I've tried the personal size pizza, the lasagna, the New World Sub(hot), the Shrimp Fettuccine Alfredo, the Heritage Chicken Salad, and the side salad. If it's your first time coming to Doyle's, I would recommend getting the lasagna. It comes in a casserole form, is piping hot, and is full of flavor. It kind of reminds me of Stouffer's Lasagna with thinner lasagne sheets. A coworker got the ravioli which looked similar as it comes in a casserole and is covered with piping hot cheese and tomato sauce too. The Heritage Chicken Salad with oil and vinegar was good as it had big slices of chicken. It's a filling light lunch. The Shrimp Fettuccine Alfredo comes with small shrimp and is a little bland. The New World sub tastes just like it describes. The side salad comes with lettuce, cucumber slices, tomato wedges, and a Melba-size crouton. It's a little more bland than the Heritage Chicken Salad. The pizza tastes like school lunch/ frozen-style since it's not heavily spiced on the crust or in the sauce. The servers are always nice, and they're prompt in handing out the garlic bread baskets (sub bread with heavy spread of garlic butter). I looked around at the tables and think I'll try the spaghetti and meatballs next time I go.","alt=""3.0 star rating""",3,doyles-restaurant-houston,doyles-restaurant-houstonhttps://www.yelp.com/biz/doyles-restaurant-houston?start=0,Danish B.,"Houston, TX",92,123,48,Elite ’17,10/13/16,"I love Doyle's. They make their salad dressings from scratch (the Dill ranch is my personal favorite), and on some nights they give you a crudite' when you sit down to eat dinner. Their Buttermilk pie is the best thing, ever, but they do not always have it there, since it is home made, and people buy it while it is in stock. I usually order the Spaghetti Works. There is a BUNCH of cheese on top of spaghetti with meat sauce and mushrooms mixed in, then topped with 2 huge meat balls. Additionally, I love the Rueben and the Grinder. People talk about their pizza, but I never order it because I usually crack and order the Spaghetti. I'll work through the menu, one day. If you're looking for comfort food, at a fairly reasonable price, this is your place. Please note they are not open late (closes at 8 PM), and they are not open on the weekends, anymore. This is a great lunch place, or early dinner, for the week nights only.","alt=""4.0 star rating""",4,doyles-restaurant-houston,doyles-restaurant-houstonhttps://www.yelp.com/biz/doyles-restaurant-houston?start=0,Stephen G.,"Houston, TX",279,22,,,10/9/17,Use to be one of my favorite spots but the quality has suffered over the years. They use tons of cheese instead of meat! Bread is still great and so is potato soup.,"alt=""3.0 star rating""",3,doyles-restaurant-houston,doyles-restaurant-houstonhttps://www.yelp.com/biz/doyles-restaurant-houston?start=0,Belly G.,"Houston, TX",608,816,4768,Elite ’17,4/20/16,"OMG, the people who work here are the nicest people ever!!!I've driven by Doyle's more time that I can count but I never really thought about coming in. But after reading a couple of trusted Yelpers' reviews, I decided to give it a shot. At first I thought about dining in, but once I got here and saw the take out order window, I decided to just order to go.Anyone who knows me knows that the first thing I do when I go to a new restaurant is to bust out my phone and start taking pictures. That's exactly what I did here. As I walked toward the take out window and point my phone at it to take a picture, the lady behind the counter smiled for the picture. I told her that this was my first time here and asked for a recommendation. She of course told me that everything was good. But I also mentioned that I wanted meat and another lady behind the counter recommended the Golden State Poor Boy sandwich.While I was waiting for the order to be ready, the ladies behind the counter invited me to come inside the restaurant to check out the blue ribbon awards the restaurant had received from the late Marvin Zindler. She also told me to check out the original menu from 1954 when the restaurant first opened and another menu from 1980 when the restaurant was 26 years old. Pretty neat!After a little bit of wait, my sandwich was ready to go. When I got back to the office, I opened the container and the sandwich was decent sized. Definitely filled me up. It didn't taste too bad either. But looking at at the menu and the pictures, I definitely want to try their lasagna, spaghetti, and pizza. Maybe the burgers too. I'm definitely coming back here in the future!","alt=""4.0 star rating""",4,doyles-restaurant-houston,doyles-restaurant-houstonhttps://www.yelp.com/biz/doyles-restaurant-houston?start=0,Jeremy T.,"Houston, TX",266,1381,1059,Elite ’17,12/19/16,"I dined here several years ago after hearing they were the oldest italian restaurant in the city. I figured they must be making something right, and have pretty good food. I ordered their lasagna and just found it to be average tasting. I guess I just had pretty high expectations for an old school italian restaurant in a city that isn't known for top notch italian.","alt=""3.0 star rating""",3,doyles-restaurant-houston,doyles-restaurant-houstonhttps://www.yelp.com/biz/doyles-restaurant-houston?start=0,Mike M.,"Houston, TX",369,1243,2132,Elite ’17,11/1/15,"Coming to Doyle's is like stepping back in time. Sometimes that can be bad but in this case it's good. You don't see many restaurants like this anymore. It's been here since the 1950's and it serves American Italian food. Yeah I know who wants to eat that? Well don't discount it until you have tried it. This restaurant has a big parking lot. There is a large outdoor pick up to go counter where many locals get their pizzas, sandwiches, pasta to go without having to go inside the restaurant. When you go inside you are transported back to the 1960's. It is a friendly place where you are greeted by a hostess and then seated. I have eaten here probably 5 or 6 times over the past 10 years. I will admit that when I think of eating Italian food I don't think of this place. For one its on 34th street and I rarely travel it. However when I do remember Doyle's I never had a bad thought about it. A few nights ago I was driving on 34th and drove past Doyle's going somewhere else. When I arrived at that restaurant I found out that they were out of food so I went back to Doyle's because it has been a few years since I last visited. Upon being seated I was brought a basked of buttery garlic bread and a small plate of veggies with ranch dressing. The veggies were baby carrots, cauliflower and celery and provided a different type of complimentary appetizer that was appreciated. I ordered the Spaghetti Works which is spaghetti, meat sauce, 2 meat balls, mushrooms and mozzarella cheese for $10.99.The food arrived about 10 minutes later and looked like a heart attack on a plate with all the melted cheese on top of everything else on the plate. It was yummy. A nice plate of food. As yelp,would say A-OK! Also my service was good.I give Doyle's a 3. It is one of those 3 score restaurants that I would not hesitate to return. This is a neighborhood restaurant that I believe they appreciate. Places like this and Barbecue Inn I hope will stick around for a long time.","alt=""3.0 star rating""",3,doyles-restaurant-houston,doyles-restaurant-houstonhttps://www.yelp.com/biz/doyles-restaurant-houston?start=0,Conor F.,"Houston, TX",0,3,,,6/10/17,"I've never been here or heard of it! I am very excited about this place but it is closed today. I will have to review the times where Doyle's IS open so I can finally get some food from Doyle's! Great food, great life I hope. I'm a big time cat fan. At work (not at The great Doyle's) they call me cat man.-C","alt=""5.0 star rating""",5,doyles-restaurant-houston,doyles-restaurant-houstonhttps://www.yelp.com/biz/doyles-restaurant-houston?start=0,Cynthia R.,"Houston, TX",8,5,,,4/8/17,The people here are the best and the food is great. I am disappointed though because they recently changed thier hours and are only open Monday through Friday now. I love thier chicken salad and my son loves thier meatball sub. Very simple but delicious food!,"alt=""5.0 star rating""",5,doyles-restaurant-houston,doyles-restaurant-houstonhttps://www.yelp.com/biz/doyles-restaurant-houston?start=0,Brenda G.,"Houston, TX",1,10,1,,5/16/17,"First time trying Doyle's today and loved everything we ordered: Chicken Cordon Bleu w/ cup of Potato Soup, both were delicious and fresh! My husband had the Meatzer Pizza - full of flavor & perfect crust! Fresh garlic bread was served throughout our lunch, complimentary and delish. Waitress was very nice and attentive. Will definitely be coming back...their menu is so family (kid) friendly, so there is something for everyone's liking. Also, don't be turned away by the outdated building & decor...this place was absolutely spotless!","alt=""5.0 star rating""",5,doyles-restaurant-houston,doyles-restaurant-houstonhttps://www.yelp.com/biz/doyles-restaurant-houston?start=0,Adriana G.,"Houston, TX",111,20,13,,3/3/17,"I work around the area, and I have gotten take out once or twice before but this time it was a very pleasant experience. I call in my order and after I was done was not told how long it would take so therefore I was literally hung up on, so I could ask them how long it would take.I get there in like 6 mins and I just went to pay so I wouldn't have to wait long. When I was greeted out side a very rude girl took care of me, I told her that I had a to go order and asked for my name.I paid and asked how much long it would take because knowing a chicken Parmesan would take a few more that 10 minutes let's me know it was not made fresh.The rude girl told me it's ready now and I was a little shocked that it was that fast. I paid; it was a little pricey for the area that we live/work in. $11 for a chicken Parmesan, I expected that at like a little more high end Italian restaurant. Anyhoo, grabbed my food and said Thanks (I think if I wouldn't have had said thank you they wouldn't have said thank you back) and went along my day and ate my food. Food was a little cold which is common when it's not fresh. But ate it anyway. I'll think about coming back.","alt=""2.0 star rating""",2,doyles-restaurant-houston,doyles-restaurant-houstonhttps://www.yelp.com/biz/doyles-restaurant-houston?start=0,Cookie D.,"Houston, TX",42,8,15,,4/10/17,"This place never fails me! The pizzas are terrific w/a paper thin crust; the sandwiches are hefty; the salads are crispy fresh and they make all their dressings! Mile high lasagna, and old-fashioned spaghetti dishes w/yummy garlic bread. Looking for swanky date night place, move on! Looking for cozy and comfortable neighborhood diner with ""just like mama's"" comfort food? Doyle's is the place for you! Did I mention the gumbo? YUM! And the service is always, always spot on! Be sure to leave room for pie!!","alt=""5.0 star rating""",5,doyles-restaurant-houston,doyles-restaurant-houstonhttps://www.yelp.com/biz/doyles-restaurant-houston?start=0,Carmen M.,"Houston, TX",12,3,,,2/26/17,This is one of my favorite places. The service is prompt & the food is piping hot. And the tea is delightful! Perfect for a date or family get-together! I recommend the spaghetti works and pizza. The garlic bread is fresh & plentiful. I can't get enough of this place.,"alt=""5.0 star rating""",5,doyles-restaurant-houston,doyles-restaurant-houstonhttps://www.yelp.com/biz/doyles-restaurant-houston?start=0,Mark B.,"Houston, TX",99,153,234,Elite ’17,6/7/16,"I had heard that they made good burgers. I went in today for a late lunch to try it out. The staff was friendly, and the burger and the garlic French toast appetizer were both good. I will definitely go back the next time I'm in the area.","alt=""4.0 star rating""",4,doyles-restaurant-houston,doyles-restaurant-houstonhttps://www.yelp.com/biz/doyles-restaurant-houston?start=0,Jon M.,"Houston, TX",1,6,1,,5/29/15,"Bread is the BOMB!!!! Ive been here 6 times and never had a bad meal. Pizza is great. Sandwiches are real good. Try the gobbler or the doyle club. You cant go wrong. Its worth the stop. Staff is super friendly and makes you feel like family... Restrooms are super clean. They have a take out window so you can order it and pickup and go.. So try it..","alt=""5.0 star rating""",5,doyles-restaurant-houston,doyles-restaurant-houstonhttps://www.yelp.com/biz/doyles-restaurant-houston?start=0,Colleen B.,"Houston, TX",10,8,9,,11/8/16,"Still so consistently good! Super nice people work here. Not fancy, but who cares. This is an all-American diner. Not pricey and you get more for your money. Glad this place has been an Oak Forest staple for decades!","alt=""4.0 star rating""",4,doyles-restaurant-houston,doyles-restaurant-houstonhttps://www.yelp.com/biz/doyles-restaurant-houston?start=0,Sandy R.,"Houston, TX",233,2,1,,11/9/16,Great food but poor service. Today was my Dad's birthday and I wanted to celebrate it with amazing food. The server was Hispanic so my parents felt comfortable enough to order in Spanish but she did not say a word and ignored them until I stepped in. She could have at least said something if she didn't understand. We were half way through our meal and she brought us the Check with out us asking for it. When we ran out of garlic bread she didn't offer and ignored us throughout the entire time. I had to catch her and ask for it. She didn't bring straws for our drinks until she brought the check. I wanted to order a cheesecake and I had to ask since she didn't come around anymore. I loved the food but the service needs to improve. My parents felt uncomfortable because of how she treated us.,"alt=""2.0 star rating""",2,doyles-restaurant-houston,doyles-restaurant-houstonhttps://www.yelp.com/biz/doyles-restaurant-houston?start=0,Gary H.,"Houston, TX",9,53,,,10/3/16,Run of the mill diner in the Oak Forest area. Pizza was pretty good although the garlic bread tasted more like the Texas Toast brand you can find in the store. Sweet tea wasn't really sweet and how tough is it to greet customers without being engaged with a smartphone! We arrived shortly before noon and the place was fairly busy so guess that's a good sign although our personal taste buds say it's 50/50 on whether we return.,"alt=""3.0 star rating""",3,doyles-restaurant-houston,doyles-restaurant-houstonhttps://www.yelp.com/biz/doyles-restaurant-houston?start=0,Brett J.,"Galleria/Uptown, Houston, TX",11,26,11,,8/15/15,"60/70s style so not modern (so minus 1 star) but still worth the trip for a quiet lunch or dinner and great service. Come check this place out before some developer bulldozes it for a strip center.","alt=""4.0 star rating""",4,doyles-restaurant-houston,doyles-restaurant-houstonhttps://www.yelp.com/biz/doyles-restaurant-houston?start=0,Pauline F.,"Houston, TX",0,62,18,,9/7/16,Wonderful as always ordered the spaghetti works plus the shrimp salad the consistency of the food here is exquisite with a side of apple pie you can never go wrong with any of their desserts great staff lots of smiles I always look forward to visiting at Doyle's,"alt=""5.0 star rating""",5,doyles-restaurant-houston,doyles-restaurant-houstonhttps://www.yelp.com/biz/doyles-restaurant-houston?start=20,Garrett B.,"Houston, TX",0,30,,,9/12/16,"You can't go wrong here!Been eating here for years, but never left a review.Italian food is simple homemade style.You get plenty, usually enough for a dogie bag for later.The same people have been here for as long as we have be coming here.Always good for a meal in the neighborhood!","alt=""4.0 star rating""",4,doyles-restaurant-houston,doyles-restaurant-houstonhttps://www.yelp.com/biz/doyles-restaurant-houston?start=20,Art M.,"Houston, TX",0,2,,,7/13/16,The most delicious lasagna I have had in a long time. Spaghetti works also amazing. Decor totally old-school but makes up for with customer service,"alt=""5.0 star rating""",5,doyles-restaurant-houston,doyles-restaurant-houstonhttps://www.yelp.com/biz/doyles-restaurant-houston?start=20,Ron P.,"Houston, TX",0,10,,,1/9/17,i had a chicken salad sandwich and it more onion in it than chicken... they should call it a ONION salad sandwich...Gross....my friend had the spaghetti and the sauce taste like they open a can of diced tomatoes and poured it over some pasta......very unhappy with the whole place,"alt=""1.0 star rating""",1,doyles-restaurant-houston,doyles-restaurant-houstonhttps://www.yelp.com/biz/doyles-restaurant-houston?start=20,Kara S.,"Northside, Houston, TX",69,48,6,,4/28/16,"We ordered take out from Doyle's last night. We had the fettuccine alfredo with chicken and the Works pizza with a thin crust. The fettuccine was very creamy, the pasta was done perfectly. It definitely tasted fresh. The pizza was amazing! The thin crust was actually crispy and stayed that way! Yum! Perfect pizza!","alt=""5.0 star rating""",5,doyles-restaurant-houston,doyles-restaurant-houstonhttps://www.yelp.com/biz/doyles-restaurant-houston?start=20,Crystal L.,"Houston, TX",0,3,,,4/8/16,Service was friendly and fast...like really fast our drinks were never empty. The food was great I had the chicken fettuccine alfredo it was creamy and had a good chicken to pasta ratio. I even had leftovers to take home. Yummm. We went during lunch hours.,"alt=""5.0 star rating""",5,doyles-restaurant-houston,doyles-restaurant-houstonhttps://www.yelp.com/biz/doyles-restaurant-houston?start=20,Brooke S.,"Houston, TX",158,313,74,Elite ’17,3/14/13,"A collegue of mine recommended this place for lunch as it's fairly close to the office. I felt like I was back at my Grandma's house as soon as I walked in the door. The decor is definitely dated - but very down home and comfortable. A sweet older hostess greeted us and seated us at our small table. After perusing the menu, I decided on the soup/salad combo. I had the tomato basil soup (delicious) and side salad. The portions were perfect. I will definitley try this place again as the food and service were great. Additionally, the time it took to get our food and get back to work was very efficient.","alt=""4.0 star rating""",4,doyles-restaurant-houston,doyles-restaurant-houstonhttps://www.yelp.com/biz/doyles-restaurant-houston?start=20,Rachelle F.,"Houston, TX",230,533,371,Elite ’17,1/23/14,"I wasn't very impressed with Doyle's. It is a small mom and pop style place that reminds me of an ice cream shop. I ordered a salad to go for $11 bucks and picked it up at a window facing the outside. I could see inside to the plastic red and white checkered table cloths. The staff was young and seemed inexperienced in food preparation and customer service. I was surprised to see that my salad came on a plastic plate with foil covering it, then set inside of a cake box. It just seemed oddly assembled. The salad was good, I enjoyed the garlic bread that came with it, but I wished the chicken was hotter - it was room temperature.","alt=""2.0 star rating""",2,doyles-restaurant-houston,doyles-restaurant-houstonhttps://www.yelp.com/biz/doyles-restaurant-houston?start=20,Austin C.,"Central, U.S. Virgin Islands",122,10,1,,12/7/15,"Great pizza, great salad, great subs, great lasagna, and great meatballs! All around fantastic home cooking!","alt=""5.0 star rating""",5,doyles-restaurant-houston,doyles-restaurant-houstonhttps://www.yelp.com/biz/doyles-restaurant-houston?start=20,David N.,"Houston, TX",4160,3722,2188,,7/14/14,"When I first moved into the area, I was looking for food for lunch. I kept driving by this place daily and just never stopping in, until finally, we got tired of turning left and decided to turn right and go into this place. It's minutes away from my office so it makes it an easy back up default.I love the garlic bread. That in itself can get you full. I had the chicken po boy, had good flavor, but I probably shouldn't had stuffed myself with all that garlic bread first. I also had the shrimp gumbo, it was decent.","alt=""3.0 star rating""",3,doyles-restaurant-houston,doyles-restaurant-houstonhttps://www.yelp.com/biz/doyles-restaurant-houston?start=20,Marsha P.,"Spring Branch, Houston, TX",0,7,19,,10/23/15,Great neighborhood restaurant. We had The Gobbler (turkey sandwich) and a small Chicken Alfredo Pizza. Both were excellent. Friendly waitstaff. Clean restaurant. Lots of variety on menu. Would highly recommend. Will visit again !,"alt=""5.0 star rating""",5,doyles-restaurant-houston,doyles-restaurant-houstonhttps://www.yelp.com/biz/doyles-restaurant-houston?start=20,Alison H.,"Houston, TX",0,4,,,4/13/15,"My family and I have been coming here for over 10 years. We love the food and the staff. The atmosphere doesn't offer much, but the food makes up for that. I usually get the greek island salad, the gobbler sandwich, soup & salad, spaghetti chicken, or one of their pizzas. Their garlic bread is seriously to die for. I can't speak for their burgers because that is a fairly new item on their menu that I haven't tried yet, but I know you will be satisfied with any of the other items I've mentioned. I usually order take out from here once a week if I don't dine in with a friend instead. I seriously love this place!","alt=""5.0 star rating""",5,doyles-restaurant-houston,doyles-restaurant-houstonhttps://www.yelp.com/biz/doyles-restaurant-houston?start=20,Sunni R.,"Houston, TX",77,15,1,,4/23/15,"Wow! This place has the BEST Italian cream cake I've ever had. The cheese manicotti with marinara sauce is also delicious. They have a To go pickup window outside the restaurant which is very convenient! I am two to go orders in, and now they've got a regular. Way to go Doyle's!","alt=""5.0 star rating""",5,doyles-restaurant-houston,doyles-restaurant-houstonhttps://www.yelp.com/biz/doyles-restaurant-houston?start=20,Kristina O.,"Houston, TX",277,581,155,,12/5/12,"I grew up eating here and refer to it as the ""pizza place"" Doyles has amazing thin crust pizza made by hand just the way they did in the beginning. I love that they use real ground hamburger meat and their sauce isn't over the top. Just nice and simple. I really love the chicken salad in an avocado with those good toasty, garlic butter crouton slices and fresh cut fruit. I usually get this with a side of their potato soup. Their ranch dressing is killer and they serve it in a gravy boat thing. Doyles has a great mom and pop feel and has been that way for as long as I remember. When ever I eat here I feel like I am at home. (awwwwww!)","alt=""4.0 star rating""",4,doyles-restaurant-houston,doyles-restaurant-houstonhttps://www.yelp.com/biz/doyles-restaurant-houston?start=20,Frances L.,"Houston, TX",96,292,134,Elite ’17,1/19/13,Friendly service in a quaint diner feel restaurant. The ranch chicken pizza thick crust was great and the bill with a side salad came out to be less than $20. Good value for a quick bite.,"alt=""4.0 star rating""",4,doyles-restaurant-houston,doyles-restaurant-houstonhttps://www.yelp.com/biz/doyles-restaurant-houston?start=20,Kat K.,"Lazy Brook/Timbergrove, Houston, TX",36,5,6,,1/27/14,"Everytime I've eaten here I've been disappointed. I've had their spaghetti and their meatza pizza. I make better spaghetti at my house and the pizza was so greasy I could barely eat it. Tonight my boyfriend suggested Doyle's for dinner, and I said no at first, but then decided to give them one last chance. We called in the order(chicken parm sandwiches/ potato and bacon soup/ side salad) around 730, and I picked it up shortly after. The sandwiches were on store bought sesame seed hamburger buns, the cheese was mealy and barely melted, the chicken tasted like it was frozen and heated up in the microwave. The garlic bread was stale and the soup was barely edible. The food was so bad that we didn't eat any of it ($25 down the drain) and had to order dinner from somewhere else. They put on the receipt that these are family recipes... If those were my family recipes, I'd throw them away.","alt=""1.0 star rating""",1,doyles-restaurant-houston,doyles-restaurant-houstonhttps://www.yelp.com/biz/doyles-restaurant-houston?start=20,Jessica C.,"Houston, TX",0,2,,,7/30/14,"First time here & the food was awesome! The garlic bread , was warm & good!, highly recommend","alt=""5.0 star rating""",5,doyles-restaurant-houston,doyles-restaurant-houstonhttps://www.yelp.com/biz/doyles-restaurant-houston?start=20,Val K.,"Bethesda, MD",0,2,4,,9/1/14,The chicken sandwich was awful. Liked the garlic bread thou and the service was good.,"alt=""2.0 star rating""",2,doyles-restaurant-houston,doyles-restaurant-houston