URL,User Name,User Location,Friend Count,Review Count,Photo Count,Elite 17,Review Date,Review,Rating,Rating Extracted,Restaurant Extracted,Restaurant Extractedhttps://www.yelp.com/biz/doyles-restaurant-houston?start=20,Melissa W.,"Houston, TX",4,6,,,11/13/12,"I grew up on Doyles, eating many spaghetti dinners with my grandparents from here. We almost always called our orders in and took it home to eat. When I moved back to the neighborhood a of couple years ago, I was excited to try it out and see if it was still as good as I remember it. Good news - my spaghetti dinner hasn't changed a bit! It is not fancy, it comes in the same silver to-go container as it did before, there are no gourmet ingredients, and it is perfect. Hot, tomato-sauced, and parmesan-cheesed heaven. I love calling in my to-go order and walking up to the window outside the Restaurant like I used to with my grandpa. There are always neighbors outside talking while they wait for their orders to be ready. Last time my husband and I were there, we saw some of our own friends from the neighborhood picking up dinner. I don't know if anyone else thinks this is a plus for Doyles, but I like the neighborhood following it has. It's like a small town Restaurant in our big city. It is nice to see a local place get community support.  I can get a spaghetti dinner with meatballs to-go for under 10 dollars, and it is enough for two or three meals. That is a deal! The garlic bread that comes with is a generous serving as well.I do not dine-in here very often, but the few times I have, the service has been great. Last time I came with my husband and my mom, he got a sandwich with turkey and avocado, and he loved it! My mom got a salad and it was a generous portion. Only complaint about dining room is that it is always cold in there! For some reason I prefer to get my food to-go. Habit I guess. This is a great place if you want some delicious comfort food to bring home and eat curled up on the couch. I hear they make some great pizzas - I think my next trip to the walk-up window might be for one of them!","alt=""4.0 star rating""",4,doyles-restaurant-houston,doyles-restaurant-houstonhttps://www.yelp.com/biz/doyles-restaurant-houston?start=20,Stephen M.,"Houston, TX",0,2,,,11/18/14,Great lunch spot. Had a coworker introduce me to this family run restaurant and couldn't be more happy. We now make it at least once every two weeks. The sandwiches are tasty and can be daunting. Order a club and you will feel tiny in comparison. The side of potato chips is awesome and the garlic bread which is brought out when u sit is a nice extra treat. I would definitely recommend it to a sandwich aficionado. I'll have to give the pizzas a try soon enough.,"alt=""5.0 star rating""",5,doyles-restaurant-houston,doyles-restaurant-houstonhttps://www.yelp.com/biz/doyles-restaurant-houston?start=20,Rue S.,"Houston, TX",17,45,25,,5/18/12,"What was the hubbub about this over priced meager food?I dont get it. My coworkers eat at this place alot and I thought id try. Only offering one brand of chips? Really? I guess. The double cheese burger was cold and soggy in 10 minutes.","alt=""2.0 star rating""",2,doyles-restaurant-houston,doyles-restaurant-houstonhttps://www.yelp.com/biz/doyles-restaurant-houston?start=40,Shaun G.,"Houston, TX",71,18,,,1/3/14,"Best pizza in town without a doubt. Forget star, pinks, Barry's, the meatza pizza was one of the best pizzas I've had in Texas!","alt=""5.0 star rating""",5,doyles-restaurant-houston,doyles-restaurant-houstonhttps://www.yelp.com/biz/doyles-restaurant-houston?start=40,Jason V.,"Houston, TX",5,96,3,,7/15/13,It blows my mind that this place has been here as long as it has. It's moderately priced food that has to be frozen and warmed in an oven. I had a pizza and it was like they warmed a frozen cheese pizza up and when it came out of the oven just added peperoni and hamburger meat to it. YUCKY! There are so many other places to go eat better in the area...it is not worth it.,"alt=""1.0 star rating""",1,doyles-restaurant-houston,doyles-restaurant-houstonhttps://www.yelp.com/biz/doyles-restaurant-houston?start=40,Michael H.,"Houston, TX",8,19,,,12/3/12,"I hadn't been to Doyle's restaurant in a while so when I was in the neighborhood I decided to stop by. I have always gotten the supreme pizza or one of their sandwiches, and decided this time to try something new and try the Meatza Pizza. I am assuming that is the pizza with all of the meats. For one thing, I thought it was very unusual that when they had hamburger meat on a pizza that they used REAL hamburger meat they cooked there. The sausage was REAL Italian sausage sliced up, and the bacon was REAL bacon that they had cooked and crumbled up and put on the pizza. Their toppings were not the kind you get frozen off one of those pizza ingredients delivery trucks you see driving around. I haven't had a real great tasting pizza in such a long time. I wasn't sure what I was eating it was so good. The quality of this little hole in the wall pizzeria was way above any pizzeria I have been to in Houston. The only problem was they put way too many toppings on top and it will take me 4 days to eat the whole pizza. Poor me, I will have to suffer through the agony. Haha!Like always, I just called in my order and picked it up on their side window. My wife got the Reuben and she said it was the best she has had here in Houston not including the ""New York style deli restaurants"". But there is no deli located near that location. My mother stops by there weekly because she says their salads are the best in Houston.Ok! I have to say I am a little biased about this restaurant. I have been going there since the 1960's when it was the only restaurant that had pizza. But, on this trip I didn't get the usual comfort food I am accustomed to, so it was different for me, so I assume I can leave a comment.","alt=""5.0 star rating""",5,doyles-restaurant-houston,doyles-restaurant-houstonhttps://www.yelp.com/biz/doyles-restaurant-houston?start=40,Kevin T.,"Houston, TX",4,17,1,,10/2/12,"Absolutely mediocre. I had the spaghetti plate, my husband had the lasagna. I have news for Doyle's, there are these things called ""herbs"" (like oregano and marjoram) that you can add to food to improve the flavor! Try them sometime. The waitresses were very nice though, so it was more pleasant than eating at someplace like Denny's, but the food wasn't any better. I won't go back.","alt=""2.0 star rating""",2,doyles-restaurant-houston,doyles-restaurant-houstonhttps://www.yelp.com/biz/doyles-restaurant-houston?start=40,Megan P.,"Cypress, TX",0,5,2,,2/7/12,"Doyle's has been a staple restaurant of my childhood. Incidentally, it has also been a staple restaurant of my mother's childhood too! Doyle's, founded in 1954, if I'm correct, is a Houston institution.Housed in a modest building, the food at Doyle's is both comforting and delicious. My personal favorites are the pizza with original crust, spaghetti, and spaghetti chicken. The waitresses are friendly and the whole attitude of the restaurant is warm and inviting. It's a little old-fashioned, but in a good way. I hope this Doyle's will be around long enough for it to become a favorite of my children as well!","alt=""5.0 star rating""",5,doyles-restaurant-houston,doyles-restaurant-houstonhttps://www.yelp.com/biz/doyles-restaurant-houston?start=40,Brad C.,"Houston, TX",1,11,3,,11/19/12,"You have to get this place to like it. It reminds me of a college bud asking me to go home with him and eat at his grandma's house. If u think of it like that u will enjoy it. Staff is sooo sweet, food is fresh, but lacks seasoning. Salad was fresh crunchy and good. If you compare to an Italian restaurant, you will be disappointed. If you compare to someone's grandmother taking care of you, you will feel happy and good. Lots of food, surprisingly decent wine selection. Good pie...","alt=""3.0 star rating""",3,doyles-restaurant-houston,doyles-restaurant-houstonhttps://www.yelp.com/biz/doyles-restaurant-houston?start=40,Sonya A.,"Houston, TX",93,6,2,,2/28/12,"Wonderful Lasagna! Bread is good too.Love the simpleness of this place, Pizza is great too.","alt=""4.0 star rating""",4,doyles-restaurant-houston,doyles-restaurant-houstonhttps://www.yelp.com/biz/doyles-restaurant-houston?start=40,mark z.,"Kingwood, TX",3,123,,,7/20/10,"Multi generation patron to Doyles. so perhaps i am bias. I and my family enjoy coming here. The food is not necessarily the best but the whole package, resteraunt, food, service, and the history makes this one of my favorite places to visit when in the area.Family owned and ran for years. Service is helpful and playful and interact with my 2 year old. I enjoy the reuben, the wife prefers the pastas. this is a well run family establishment, enjoy it take your family as well.","alt=""4.0 star rating""",4,doyles-restaurant-houston,doyles-restaurant-houstonhttps://www.yelp.com/biz/doyles-restaurant-houston?start=40,David V.,"Houston, TX",71,102,31,,9/21/10,"Can I just say that I love diners! I work close to this wonderful family-owned establishment. My co-worker and I are avid foodies! So after his suggestion to go to this spot, I was sold! It has a large parking lot and an approachable look to it. You know you are in for a good home-cooked treat.I was on a diet the last time I went there so I went with a Chicken Breast Salad that I customized my self and a Cup of gumbo. My co-worker had the Reuben. The Gumbo which came out first was actually pretty darn good! I wast zesty and spicy! I hot sauced the crap out of it, cause I like it spicy! My salad was everything and anything I expected. I created it! Dressing was a light Italian. I don't know what brand, but it was good.I don't think my co-worker was as pleased with the sandwich, but ended up eating it all...hmmm. regardless I had a nice stay there and I will make it a point to come back when I get the urge for the home cooking. Place is small so travel with few.","alt=""4.0 star rating""",4,doyles-restaurant-houston,doyles-restaurant-houstonhttps://www.yelp.com/biz/doyles-restaurant-houston?start=40,Scott H.,"Houston, TX",14,11,2,,4/29/10,"If you don't want to make spaghetti at home, Doyle's is a quick fix - but you could do better at home. Sandwiches and other fare on the menu are pretty pedestrian.Great service and very friendly staff.The food's nothing out of the ordinary, but if you're not in the mood to cook or go somewhere else, it's serviceable and reasonably priced.","alt=""3.0 star rating""",3,doyles-restaurant-houston,doyles-restaurant-houstonhttps://www.yelp.com/biz/doyles-restaurant-houston?start=40,Andreuuu W.,"Toronto, Canada",117,102,48,,7/23/09,"This is a great place if you like food that came out of a jar. I come here regularly for lunch because my co-workers love it. Since the joint is always packed, I assume lots of people share their enthusiasm. I'm not one of them.Their menu is packed with comfort food - pasta, sandwiches, burgers - and none of it is home made. Their pasta sauce is Ragu, their burgers are frozen patties and I can make everything at home for a fraction of the price.On the plus side, they do make a mean Reuben. I've explored the menu enough to know that's the only thing I like. The restaurant also has a very comfortable, homey feel. The waitresses do a fine job and nobody takes themselves too seriously. Still, this place ranks way at the bottom of my list.","alt=""2.0 star rating""",2,doyles-restaurant-houston,doyles-restaurant-houstonhttps://www.yelp.com/biz/doyles-restaurant-houston?start=40,David B.,"The Heights, Houston, TX",0,7,,,11/29/11,"Only been here once and only ordered the the spaghetti, so, maybe there are other things on the menu that are decent, but the spaghetti was seriously the worst I've ever had, including high school cafeteria spaghetti.","alt=""1.0 star rating""",1,doyles-restaurant-houston,doyles-restaurant-houstonhttps://www.yelp.com/biz/doyles-restaurant-houston?start=40,Sam V.,"Houston, TX",149,375,20,,12/15/08,"This place isn't much more than an outdated diner that tried to be upscale at some point - maybe back in the 70's.Sandwiches are nothing special nor did anything else look that appetizing. And to top it off, from the outside this place kinda reminds me of an old doctor's office or something - anything but a restaurant. Which means you may pass this place up dozens of times before you even recognize it exists.On my visit here, I was by far the youngest patron in the place, and I ain't no spring chicken. But I am sure this place has its' own loyal following of a generation soon to be extinct.","alt=""2.0 star rating""",2,doyles-restaurant-houston,doyles-restaurant-houstonhttps://www.yelp.com/biz/doyles-restaurant-houston?start=40,Dana C.,"Houston, TX",64,117,77,,1/15/09,"Doyle's gets 3 stars from me for the AWESOME chicken salad. Seriously, it's so creamy and delicious. If you're a fan of chicken salad it will rock your world. The coconut meringue pie is pretty good too. Everything else I've ever tried here wasn't anything to rave about. When I worked down the street we came here all the time during lunch hour. My co-workers loved the pizza and pasta, but I found them both to be rather average tasting. If I'm not craving a chicken salad sandwich, then Doyle's really isn't worth the trip.As others have mentioned, this establishment has been around forever and is pretty popular among an older crowd. If you're young enough to use the Internet and even be reading this right now, then chances are you'll be the youngest person dining here. The building is very dated and the interior will remind you of your grandmother's house with plastic floral table cloths to complete the look.They have really limited hours and aren't open everyday so make sure they're open before you drive over to Doyle's.","alt=""3.0 star rating""",3,doyles-restaurant-houston,doyles-restaurant-houstonhttps://www.yelp.com/biz/doyles-restaurant-houston?start=40,Stephanie K.,"Houston, TX",3,8,,,5/17/13,"My husband and I tried this neighborhood restaurant thinking it must be good since it has been around so long. That will be our first and last visit. Stouffers makes better lasagna than they do. I can't speak for the entire menu,but both our Italian dishes had more cheese than a swamp has moss. We both ordered a glass of red wine and it was served cold. In my opinion this food should be priced at $7 a plate but it is over $10 a plate. Bathrooms are located outside the restaurant kind of like a rest area on a highway. Very low quality food.","alt=""1.0 star rating""",1,doyles-restaurant-houston,doyles-restaurant-houstonhttps://www.yelp.com/biz/doyles-restaurant-houston?start=40,Edgar O.,"Houston, TX",42,16,10,,6/17/11,"I eat here at least twice a week, great pizza at a reasonable price with great flavor. It is near my job so I eat here all the time. This place seems to have been ""The Place"" back when it was, it remains happening, mostly with return and loyal customers as they seem to know most everyone that comes in by name. This is a kind of place that unless you know someone that has been to it before you may not know it is there, it is a small restaurant with a big parking lot and very nice walk up window for to go orders.","alt=""5.0 star rating""",5,doyles-restaurant-houston,doyles-restaurant-houstonhttps://www.yelp.com/biz/doyles-restaurant-houston?start=40,Matthew H.,"Houston, TX",8,18,3,,2/18/11,"Doyle's is a Garden Oaks institution. And I can see why. From the spacious and retro interior, to the super friendly staff, and the cheap beer, I will definitely be making this a frequent stop. I ordered a personal size Pepperoni pizza and thoroughly enjoyed it. A decent menu, mostly pizza, pasta and sandwiches, they know what they're doing. Just try to not fill up on the delicious Garlic Bread they serve you while you wait.","alt=""4.0 star rating""",4,doyles-restaurant-houston,doyles-restaurant-houstonhttps://www.yelp.com/biz/doyles-restaurant-houston?start=40,Jason B.,"New Orleans, LA",22,24,1,,5/20/08,"Just south of the tracks in Oak Forest sits a Houston institution. Doyle's Restaurant started life in 1954 as a deli near 43rd and Ella before moving into the restaurant business a few years later. The future seems safe based on today's lunch crowd.The menu features mostly Italian entrees augmented by a diverse assortment of sandwiches, salads and other favorites. The eatery is known for its lasagna ($8.95) which is served straight from the oven in a nine-inch ceramic dish. The garlic bread is well done and is a handy implement to shovel the tasty cheese and sauce combination into your gullet. Don't worry about running out; more bread is just a wave away. Those of you choosing to ""be good"" should still cheat a little and get the Heartland Salad. Being good goes out the window thanks to the breaded chicken cutlet and bacon, but at least there's still more green than protein. Top it off with the bleu cheese dressing. But, be careful. The dressing is served on the side in a gravy boat; it is so creamily delicious that drinking it may seem like a great idea.Doyle's also features a walk-up order window (and call ahead service) for those of you who'd like to pick-up dinner on the way home from work.No matter how you get it, Doyle's is a can't miss safe bet for Italian comfort food and sandwiches. The food is every bit as good as grandma's home cooking, but you don't have to do the dishes.","alt=""4.0 star rating""",4,doyles-restaurant-houston,doyles-restaurant-houstonhttps://www.yelp.com/biz/doyles-restaurant-houston?start=40,Andrew L.,"Houston, TX",74,139,12,,2/3/13,"this place reminds me of a pizza hut 15 years ago. we had the chicken Alfredo pizza, it was cheese heavy sauce light and had a good taste. the service was great and the atmosphere was definitely senior citizen. This is one of the oldest restaurants in Houston and they definitely have a style","alt=""4.0 star rating""",4,doyles-restaurant-houston,doyles-restaurant-houstonhttps://www.yelp.com/biz/doyles-restaurant-houston?start=40,James S.,"Houston, TX",84,51,2,,9/15/10,Doyle's has been around forever. We've owned a shop down the street since 86 and they've been around way before that. Italian is their main genre but I enjoy their sandwiches and soups. The clam chowder is to die for! Everything else is mmmmeehhhh,"alt=""3.0 star rating""",3,doyles-restaurant-houston,doyles-restaurant-houstonhttps://www.yelp.com/biz/doyles-restaurant-houston?start=60,Kelly L.,"Angleton, TX",1,13,,,7/30/12,Doyle's is a Houston institution and has the best pizza in the Houston area! The Italian food is just wonderful here! It's worth a try! There's a reason that this place has been in business since 1954 -- because it's worth it!!,"alt=""5.0 star rating""",5,doyles-restaurant-houston,doyles-restaurant-houstonhttps://www.yelp.com/biz/doyles-restaurant-houston?start=60,JoAnn O.,"Red Rock, TX",0,153,5,,2/7/10,I was craving for Rueben sandwiches so after search I decided to give Doyle's a try since it is around the neighborhood. The Rueben is not to my liking. It is OK. It is nothing special. The rye bread is kind of soggy. The sandwich is flat. I had much better ones. My husband had the burger and he liked it very much. The place is very cozy. The service is excellent. You feel very warm and welcome when you walk in.,"alt=""3.0 star rating""",3,doyles-restaurant-houston,doyles-restaurant-houstonhttps://www.yelp.com/biz/doyles-restaurant-houston?start=60,Nicole H.,"Houston, TX",3,31,3,,12/2/10,I LOVE THIS PLACE!!! I eat here at least once a week! they have the best chicken salad on alvacado!! mmmhhh sooo good! Its a mom and pop kinda place been there since the 40's but it is just wonderfu!!! :),"alt=""4.0 star rating""",4,doyles-restaurant-houston,doyles-restaurant-houstonhttps://www.yelp.com/biz/doyles-restaurant-houston?start=60,Jaime H.,"Houston, TX",0,2,,,10/18/11,"Love this place. Can't beat the charm, the prices and a great pizza! We're pizza fanatics, and this is one of our favorites! The walk up window is an added bonus. The staff is awesome too.","alt=""4.0 star rating""",4,doyles-restaurant-houston,doyles-restaurant-houstonhttps://www.yelp.com/biz/doyles-restaurant-houston?start=60,Russell S.,"Houston, TX",0,31,2,,12/25/08,"Could service get any friendlier? Everyone here has a smile, from the cashier to the hostess to the waitress to the manager. Doyle's is just a good ol', down home, neighborhood fun place to eat. And the food is quite wonderful. The Italian food is basic, made from the best ingredients and served in huge servings. The sandwiches are freshly made and hark back to the best of neighborhood sandwich stores. But my oh my--you have to have the Potato and Bacon Soup. Filled with chunks of potato laced with crisp bacon bits and topped with cheese, this rich comfort food is served piping hot. Order it with the Croutons, crispy toasted French bread slices, buttered and seasoned just right. And save room for the pie...luscious slices of Lemon Meringue, Chocolate Meringue, or Coconut Meringue, brought in fresh a couple of times a week from one of Houston's best pie bakers, My Dee-Dee's Pie Shop. And smile all the way to the bank when you find that all this deliciousness is a mere pittance compared to other, similar places. Doyle's is an Oak Forest treasure...no, it is a Houston treasure!","alt=""5.0 star rating""",5,doyles-restaurant-houston,doyles-restaurant-houston