URL,User Name,User Location,Friend Count,Review Count,Photo Count,Elite 17,Review Date,Review,Rating,Rating Extracted,Restaurant Extracted,Restaurant Extractedhttps://www.yelp.com/biz/frenchys-chicken-houston?start=40,Antony W.,"Houston, TX",17,41,49,,9/4/14,"Frenchy has the best fried chicken and boudain. It is definitely one of my go-to places. The boudain has cajun spicy flavors to it, as opposed to all the nasty ones you get from regular grocery stores or even the ones you buy from special events (such as Houston Livestock Show and Rodeo). The chicken, assuming that they cooked it fresh (you do take a chance on that when you do drive through), the taste is fantastic. However, through out the times that I visited there, the experience is not all great. So in this review, I am going to list out some tips that can save you time and grief.1. Don't go on Sunday or busy food hours. The line is just insane, and there is no A/C while you are standing in line. You can rely on your A/C while you are waiting in a drive-through, but even that drive through line is long.2. Always.. I mean.. always open up your box, and check your food before you leave. You may assume that they get your order right, but it only takes just one time to mess up your experience. Case to point (I had two orders of 5 Wings Specials on Sept 2nd 2014 around dinner time. Ticket # 264). Well, we were in a rush so we left without checking. When we got home and started eating, we were in for the surprises. For starter, my friend's 5 Wing Special order has 3 stale fried chicken wings and 2 fresh fried chicken wings. For my 5 Wing Special order, well, I got 3 fresh fried chicken wings + 1 chicken drum stick, and 1 chicken thigh (I have picture to proof that too if the manager ever decides to get in touch with me). So much for a simple and clear 5 Wings Special order.3. The employees are rude when you complain over the phone, so maybe try in the morning when the managers may be present. I called to complain about messed up 5 Wing Special, and the employee simply said that there is nothing she could do until manager is around next morning. 4. If you want to save a buck or two on boudain, you can buy the pre-packaged ones (Frenchy Chicken brand) from the H-E-B (Scott & OST). You can oven bake or BBQ the boudain yourself, and it will come out just as good.5. Don't go shortcutting by buying from the Frenchy Chicken inside the H-E-B (Scott & OST)... the one inside H-E-B doesn't always keep the oil fresh (either that or that specific H-E-B keeps its in-store temperature so cold that it is hard for Frenchy to fry at the right temperature)...so chicken tastes stale, and simply just not as good as the original location on Scott & Wheeler.","alt=""3.0 star rating""",3,frenchys-chicken-houston,frenchys-chicken-houstonhttps://www.yelp.com/biz/frenchys-chicken-houston?start=40,Tiffany G.,"Fourth Ward, Houston, TX",196,9,2,,5/8/16,I love the food not the customer service. The workers in the drive thru always have some type of attitude lol. Honestly this place is hit or miss. Sometimes the chicken is piping hot and the fries are seasoned. Then other times the chicken and fries taste old.,"alt=""3.0 star rating""",3,frenchys-chicken-houston,frenchys-chicken-houstonhttps://www.yelp.com/biz/frenchys-chicken-houston?start=40,Cody H.,"Houston, TX",26,6,,,8/24/16,"I'm a huge chicken eater. What I like the most, after their chicken, is that the staff is never angry or upset, but always absolutely friendly and treat you like a old friend.","alt=""5.0 star rating""",5,frenchys-chicken-houston,frenchys-chicken-houstonhttps://www.yelp.com/biz/frenchys-chicken-houston?start=40,Michel P.,"Houston, TX",0,9,2,,11/9/16,"let me say this, I take no pleasure in criticism of anyone's place of business. However, this establishment would do well in teaching it's employees what customer service means. Secondly, I'm a police officer; have been for nearly 35 years. I went to Frenchys in a police uniform. Apparently, police officers in uniform are not welcome at this French's Chicken Establishment. I ordered a large red beans and rice, what I walked away with was ""Cold Red beans and slop"", a so called biscuit, I swear was as hard as a brick, three pieces of chicken that nearly felt they were left at room temperature for hours. Further, I'm an African American with very light Skin. I am often mistaken for being white. All of my life I've struggled with racism within my own race. I'm sensitive about doing business in the black community because often I sense the misguided hatred. I do not believe my experience was an accident. Too many factors were against me. I will never EVER eat at this crappy place again and would warn any uniform officer to be aware of what hatred may occurr with their food from this place of business. I'm saddened about this and regret that some people simply can not appreciate difference in our society.","alt=""1.0 star rating""",1,frenchys-chicken-houston,frenchys-chicken-houstonhttps://www.yelp.com/biz/frenchys-chicken-houston?start=40,Lynn L.,"Austin, TX",46,98,7,,11/12/15,"When I come home to Houston, there are a few things that I MUST do. Swinging by Frenchy's on Scott has always been one of them. I used to ride my bike here as a child in the 70s so this is one of my comfort spots.I always get the same thing every time I go --- 3 piece Campus Dark and spicy with fries, a biscuit and a pepper and a link of boudin. It's to go so I can eat it messily and without shame on my drive back to Austin.I just beat the rush so there was zero wait. Because it was lunchtime, the chicken was hot and fresh. So fresh in fact that I squirted myself in the eye with hot grease on my first bite. It was seasoned perfectly and nice and crunchy. The fries and biscuit were also fresh and delicious.Here's where I had to drop a few stars though...the boudin. It still tastes good, but now it seems to be packed with too much rice. This used to be the thing I would bring back on the road and eat the next day. Not sure I want to do this again unless they go back to the old ratio where i could actually see and chew on some pork.I am anxiously awaiting the opening of a location here in Austin. I just pray they maintain the quality and taste!","alt=""3.0 star rating""",3,frenchys-chicken-houston,frenchys-chicken-houstonhttps://www.yelp.com/biz/frenchys-chicken-houston?start=40,It's Me J.,"Houston, TX",1,70,61,,9/26/15,Frenchys is good but certainly not as good as it use to be....over time it seems that the chicken got smaller and the prices got larger..... the wait at this place is ridiculous and the cashier that assisted me today was the absolute worst..... I love supporting local businesses but it will be a while before I go back to this location .....the customer service /politeness sucks at this place,"alt=""3.0 star rating""",3,frenchys-chicken-houston,frenchys-chicken-houstonhttps://www.yelp.com/biz/frenchys-chicken-houston?start=40,Lillian M.,"Houston, TX",48,276,445,Elite ’17,11/24/15,"When you want a good seasoned nicely breaded piece of fried chicken, this is the place to go. You will always have a line around the building, but don't get discouraged, it is totally worth the wait. On average I have waited 15-20 minutes in the drive thru, but just be patient. I usually opt for the Campus with a biscuit. Then throw in a wing or two for good measure.","alt=""4.0 star rating""",4,frenchys-chicken-houston,frenchys-chicken-houstonhttps://www.yelp.com/biz/frenchys-chicken-houston?start=40,Mo' B.,"Houston, TX",1,61,,,12/4/16,"Yelp says they're open til 1am but when I called at 11:30 was told they're closing at midnight, so I rushed over -- should have gone somewhere else. The ""King Special"" of 3 wings + 2 pieces dark meant 2 drumsticks, no thighs, no breast, not event a biscuit or a drink for $9.","alt=""2.0 star rating""",2,frenchys-chicken-houston,frenchys-chicken-houstonhttps://www.yelp.com/biz/frenchys-chicken-houston?start=40,Alan S.,"Houston, TX",562,1393,230,Elite ’17,5/15/15,"This is one of those ""Houston Institutions"" that people tell you that you just have to try. So I did... in fact I convinced the office to go. For about $9 I got a small drink, dirty rice, two wings, a chicken breast and a pepper. According to the menu I think I was suppose to get a biscuit or roll with that... but I didn't. Based on what I asked for, I should have gotten fries instead of dirty rice... but i didn't open the box to check until I had walked away from the place. There are no many seats so that was a bit of an issue as well. The chicken itself was good, so there was that. Everyone seemed to like it... but not having a place to sit and messing up my order were two pretty big strikes in my book.","alt=""3.0 star rating""",3,frenchys-chicken-houston,frenchys-chicken-houstonhttps://www.yelp.com/biz/frenchys-chicken-houston?start=40,Kia J.,"Houston, TX",9,41,11,,6/7/16,Great southern fried chicken! For some reason the wings always seem extra fresh and yummy! The breast is a little drier than other chicken spots. Customer service at this location is nonexistent...and downright comical at times. And expect to wait.,"alt=""4.0 star rating""",4,frenchys-chicken-houston,frenchys-chicken-houstonhttps://www.yelp.com/biz/frenchys-chicken-houston?start=40,Shayer J.,"Houston, TX",22,14,,,4/12/15,"Best damn fried chicken you'll find in Houston. You haven't had fried chicken til you've tried Frenchy's. One bite and you're mouth will have a experience that I can't say on Yelp. This restaurant isn't for health nuts watching their weight, far from it but for those who wish to engage in pleasure food experience once in a while. Drive-thru will set you back a good 30 if you go at lunch time but is all good because the chicken will be hot fresh and you'll be glad you waited. This location is the OG restaurant and I feel like they have the better chicken than the other stores due to the fast turnover from high traffic.Service is real good aswell, if they make you wait more than they promise they'll hook you up with a freebie like a drink size upgrade for the inconvenience. Yeh. So check em out & report back.","alt=""5.0 star rating""",5,frenchys-chicken-houston,frenchys-chicken-houstonhttps://www.yelp.com/biz/frenchys-chicken-houston?start=40,Jason W.,"Richmond, TX",302,52,3,,6/23/16,"Grungy. Food subpar, dirty and wait for food was long. After waving the flies away, beggars asking for money and bearing the heat of this semi covered location we promised never to return.","alt=""1.0 star rating""",1,frenchys-chicken-houston,frenchys-chicken-houstonhttps://www.yelp.com/biz/frenchys-chicken-houston?start=40,Cameron C.,"Houston, TX",16,83,14,Elite ’17,8/22/15,"Seasoning is really good. Sides are flavorful too. Long line in drive thru, but it didnt take as long as I thought. The lady at the window was really nice. The large sides arent that large and I wish the chicken had a little more crunch. Other than that, pretty solid fried chicken.","alt=""4.0 star rating""",4,frenchys-chicken-houston,frenchys-chicken-houstonhttps://www.yelp.com/biz/frenchys-chicken-houston?start=40,Rachel D.,"Cypress, TX",135,81,27,,5/15/16,"I was super hyped about Frenchy's. I got quite a few recommendations. Unfortunately my experiences have been disappointing. Fries are good, rice is good, chicken is alright. But it's open late(1am) so that's a plus. It's not bad, just was expecting a little bit more, ya know?","alt=""2.0 star rating""",2,frenchys-chicken-houston,frenchys-chicken-houstonhttps://www.yelp.com/biz/frenchys-chicken-houston?start=40,Summer D.,"Toledo, OH",258,234,1357,Elite ’17,2/2/14,"I just don't think it's that good. I went back a second time because I thought I missed something. Houston loves this place, right? The fried chicken is good, maybe a tad above average. I honestly like Popeyes spicy chicken better. The second try I was picking lil pieces of bones out of my mouth.Biscuits need some butter and jelly to make them ok. The collard greens are not even as good as Glory greens from the can.The cook should be ashamed of those greens. No seasoning whatsover. I threw them away. There's no help for those things. French fries are ok. I've had much better and much worse. I don't get the hype here. I'm done with them","alt=""2.0 star rating""",2,frenchys-chicken-houston,frenchys-chicken-houstonhttps://www.yelp.com/biz/frenchys-chicken-houston?start=40,Kris J.,"Houston, TX",0,7,4,,2/21/16,"As this location has grown in popularity their prices have been raised and the quality of their food has been on a steady decline. I frequented this place in my college days and the food was excellent on a scale of 1-10 I rated the a 9. Fast forward to 2016 the price for 5 chicken wings is $10. With a price increase I expect the same great food and service. The food is horrible. The wings are smaller, the flavor is bland. The dirty rice was dry and tasteless. The best thing about 2016 Frenchys is their strawberry soda. The soda is ""Fanta"" brand but it doesn't taste like the same Fanta strawberry soda that other fast food restaurants serve.","alt=""1.0 star rating""",1,frenchys-chicken-houston,frenchys-chicken-houstonhttps://www.yelp.com/biz/frenchys-chicken-houston?start=40,Haydee N.,"Houston, TX",602,103,55,,1/7/15,Horrible service! They also gave me a burnt and dry boudin!! The skin outside tasted like burnt rubber!,"alt=""1.0 star rating""",1,frenchys-chicken-houston,frenchys-chicken-houstonhttps://www.yelp.com/biz/frenchys-chicken-houston?start=40,Thuy P.,"EaDo, Houston, TX",176,14,2,,12/21/15,"I have lived in Houston my whole life and never been here. I wish I would have came sooner! It is very affordable and yummy. Fries are delish, and tenders are good. I liked the boudin (sp?) too. But next time I will definitely remember to BRING HOT SAUCE! It was good without it, but they don't provide any of there own. Also, the biscuits were soo good. And they have jalapenos that you can order too so that is a plus!","alt=""4.0 star rating""",4,frenchys-chicken-houston,frenchys-chicken-houstonhttps://www.yelp.com/biz/frenchys-chicken-houston?start=40,Cindy L.,"Chamblee, GA",17,30,43,,1/7/16,"i came here twice in the past month. i was really blown away the first time however about 5 (yes, i eat a lot) pieces of chicken through i thought...hey this is kind of salty. well, after last night's batch i'm definitely confirming the fact that they definitely are heavy handed with the salt. other than that i really liked it!!! the fries had the right amount of spice (just too much salt, again) and the boudin balls were yummmmmmm. i just wish they hold back on the salt just a bit, because i really really really wanted to love this place.drive thru - yesparking - yesgroup seating - yes - this place is like a small little kitchen with windows and a medium sized covered patio area for guests","alt=""3.0 star rating""",3,frenchys-chicken-houston,frenchys-chicken-houstonhttps://www.yelp.com/biz/frenchys-chicken-houston?start=40,Suneye H.,"Weatherford, TX",59,36,16,,3/11/15,"Delicious white meat lightly crisped perfectly seasoned and usually open until 2am.Go, Frenchy's, go.","alt=""4.0 star rating""",4,frenchys-chicken-houston,frenchys-chicken-houstonhttps://www.yelp.com/biz/frenchys-chicken-houston?start=60,Mark M.,"Houston, TX",120,258,227,,7/7/13,"This is the quintessential HOU hole-in-the-wall restaurant. The chicken is fantastically salty and artery-clogging. The two-piece-and-a-pepper is one of my faves...the chicken is crunchy and its always fresh. It's sad that I know the dessert schedule, as well...but the peach cobbler is to die for...Now, in terms of service...that's another story. It seems that no matter if there is one person or twelve in line ahead of you...you end up waiting about 20 minutes for your order to get ready. It's the only place where I will continue to go and expect to receive such poor service.Although the satellite restaurants are good imitations...there is nothing like the original.","alt=""4.0 star rating""",4,frenchys-chicken-houston,frenchys-chicken-houstonhttps://www.yelp.com/biz/frenchys-chicken-houston?start=60,Sabrina N.,"Houston, TX",411,126,61,Elite ’17,9/7/14,I don't love it nor do I hate it. This place is different and their chicken tasted good but kinda in the salty side that kinda keeps you wanting more. If your in the area stop by and try them out but I wouldn't recommend going out of the way to get some fried chicken. This place is known for their chicken so if you decide to try something else be ready to be disappointed. That is all!,"alt=""3.0 star rating""",3,frenchys-chicken-houston,frenchys-chicken-houstonhttps://www.yelp.com/biz/frenchys-chicken-houston?start=60,Maria W.,"Houston, TX",314,844,3909,Elite ’17,10/28/12,"Good fried chicken, well seasoned, and when you bite into the meat your mouth is smothered in spices and juices. You will love this finger-lickin' good chicken!Though, I wouldn't say they have the BEST fried chicken because I've tasted the best and it wasn't frenchy, but they do have good chicken.","alt=""4.0 star rating""",4,frenchys-chicken-houston,frenchys-chicken-houstonhttps://www.yelp.com/biz/frenchys-chicken-houston?start=60,Mar C.,"Houston, TX",12,55,184,,10/29/15,"So disappointed. I was so hyped about this place after hearing glowing reviews. But my two piece meal was so sad. The drumstick and chicken breast was so dry, small and I think it had been sitting under the heat lamp for some time. Popeyes and Church's taste better on a bad day. All I could think was WTH after the meal. Sad sad day","alt=""2.0 star rating""",2,frenchys-chicken-houston,frenchys-chicken-houstonhttps://www.yelp.com/biz/frenchys-chicken-houston?start=60,D N.,"Houston, TX",3,20,6,,11/17/15,"Chicken isn't all that great...Cajun or creole...I just taste more salt in the seasoning than anything else. Chicken was not as fresh as I thought it would be based on the other reviews. Also chicken is kind of small. A little too expensive tooThree small wing (small but salty)One leg (decent size but salty)One thigh. (Really small...hardly any meat on it)Fries (salty)Tea (taste terrible...dump it as soon as I took a sip...)All for $9.73. And this is enough for them to think they should open 500 more stores??? I came to try the place because I thought it has to be good if they're thinking of opening more frenchy's. Popeyes and Churches chicken has them beat. Improve your service, product, and presentation. Maybe use filter water so you can at least make some good tea.","alt=""1.0 star rating""",1,frenchys-chicken-houston,frenchys-chicken-houstonhttps://www.yelp.com/biz/frenchys-chicken-houston?start=60,A W.,"Houston, TX",0,53,19,,12/2/15,I would drive 30 mins just to get some fried chicken. Staffs are friendly but Parking can be a problem sometimes,"alt=""5.0 star rating""",5,frenchys-chicken-houston,frenchys-chicken-houstonhttps://www.yelp.com/biz/frenchys-chicken-houston?start=60,Kathy G.,"Charleston, SC",2,68,2,,5/1/14,"I heard great things about this place but it was the most horrible, unhealthy chicken Ive ever eaten, I couldn't eat it past the first few bites. The Boudan was good but so salty I could see it causing high blood pressure and swollen ankles. The lemon cake was plain and flat on taste. Greens tasted fresh out if the can. People with high bloodPressure or heart/stroke, cholesterol issues should stay away from here, unless you want to have another heart attack or stroke. Very unhealthily place to eat in addition to not tasting good either.","alt=""1.0 star rating""",1,frenchys-chicken-houston,frenchys-chicken-houstonhttps://www.yelp.com/biz/frenchys-chicken-houston?start=60,Jamie E.,"Houston, TX",138,268,82,Elite ’17,5/20/13,"I bet Frenchy's tastes better after church. Not on a Tuesday night when there's nobody standing in line and few people eating. That being said, the food was alright. I wouldn't necessarily say that KFC or Popeyes is better since I don't think I experienced Frenchy's at its best. Like everyone says, the traffic getting there is pretty bad because of the construction. I went to UH for 4 years and still had trouble figuring out where the construction started and ended.","alt=""3.0 star rating""",3,frenchys-chicken-houston,frenchys-chicken-houstonhttps://www.yelp.com/biz/frenchys-chicken-houston?start=60,Parice L.,"Houston, TX",25,100,45,,5/9/15,"Had the sexiest night here with the dreamiest friend Ive happened upon in ..eh days. !!So we'd been traipsing all over town practically all nite and with my new found liqueur intolerance I needed grub to soak up the suds n my dream was like lets roll on down to Frenchys im like Huh?? how are they open at this time.. never knew this to be. Anyway we get there .. Idk their menu so he gentlemanily orders some king thing for us n all I hear is TWENTY FIVE dollars ...im like yahhhh REALLLY? jeewillickers. Extra feature theyve got that see thru tent set up thing its like maybe 1-2am we get to sit there middle of the hood not worried bout getting shot up.robbed [God bless Houston] and tear into wings n fingers n he FEEDS me greens.. my eyes see stars LOLLLLLLL. The order takers were absolute riots in their communication. The food baskets were a conglomeration of cancer n heart disease ive never tasted so much salt in commercial food like i dont think ANYWHERE i couldnt believe it; but HEY! Its the hood :D :D :D I was just thanking him for ordering the greens so we could get some semblance of roughage. my body doesnt know how to process that much overprocessed salt oil carbs whatever.. we couldnt finish it ..boxed up n mashed out.I just thank them for the food at that time and the cool atmosphere and slight comedy.","alt=""3.0 star rating""",3,frenchys-chicken-houston,frenchys-chicken-houstonhttps://www.yelp.com/biz/frenchys-chicken-houston?start=60,Dan T.,"Houston, TX",9,19,,,4/2/14,"I wouldn't say eating here was a chicken life changing experience...but it was a damn near it.After hearing so many raves and reviews, as a junk foodie, it's my job, NO, duty to clog my arteries and spread the greasy gospel. I strolled in around 2pm on a Tuesday, there wasn't much of a line, so lucky me. I ordered the 3 piece, 1 breast and 2 legs. The drumsticks and a hand held and the best ratio of meat to skin/batter. The breast has the is all white meat, so it's a good measure of frying technique (over cooked/under cooked and skin meat adhesion) . The chicken is fried to perfection, nice and crispy and moist and juicy on the inside. The batter was light, crispy and very flavorful, a little on the salty side, but just right. The chicken was fried so well that the skin and meat were properly bonded. Every bit of meat, you had a bit of skin. Nothing irritates me more about eating fried chicken than just having a big shell of skin/batter that falls apart after the first bite. I just realized i forgot about the fixins, cornbread and red beans All in all a proper chicken establishment.","alt=""5.0 star rating""",5,frenchys-chicken-houston,frenchys-chicken-houstonhttps://www.yelp.com/biz/frenchys-chicken-houston?start=60,Mike F.,"Houston, TX",60,272,71,,9/5/14,"It was good; it's comparable to all the other fried chicken places in town. To be fair there are a lot of fried chicken places here; it's the south! Overall I didn't overtly love this place but i have to give credit where credit is due. I wasn't a fan of their rice and beans :( I also wish they had honey and butter for their delicious biscuits.","alt=""3.0 star rating""",3,frenchys-chicken-houston,frenchys-chicken-houstonhttps://www.yelp.com/biz/frenchys-chicken-houston?start=60,Live T.,"Houston, TX",0,12,3,,10/21/15,"Four stars for the near perfect fried chicken. Got the 99c Wednesday special. As recommended, I got there around 1 pm and found zero line and freshly fried still hot chicken.one star off for the so-so red beans.","alt=""4.0 star rating""",4,frenchys-chicken-houston,frenchys-chicken-houstonhttps://www.yelp.com/biz/frenchys-chicken-houston?start=60,Darryl B.,"Houston, TX",2,11,,,4/19/15,"We went to the original Frenchy's Chicken on Scott st. We've been there several times before, and enjoyed the food. Yesterday, however was a one star experience. I ordered a three piece meal, dark meat, biscuit, lemon cake etc. We ordered thru the drive thru. They handed us our food, and we almost drove off without the cake, because they forgot to hand it to us. Then we parked around the corner to eat. Instead of what I ordered I was given three small wings, a roll instead of a biscuit, and dirty rice instead of fries. I went to their website to comment on this, but there encryption catcha was extremely hard to use. This is probably not a coincident. Maybe they had to hire a new crew. I was looking forward to that meal, but it was messed up.","alt=""1.0 star rating""",1,frenchys-chicken-houston,frenchys-chicken-houstonhttps://www.yelp.com/biz/frenchys-chicken-houston?start=60,J H.,"Washington, DC",1,180,110,,6/29/14,"Chicken was juicy but along with everything else was reallllly salty. Beware if you have heart or blood pressure problems, seriously. Sides were mediocre. Really affordable though, I recommend you take a guilty indulgence and try it out at least once. I'd give it 3.5 stars if that was an option. Quick tips - they only do fish on Fridays, must spend at least $5 for credit cards, and they also have a drive through.","alt=""3.0 star rating""",3,frenchys-chicken-houston,frenchys-chicken-houstonhttps://www.yelp.com/biz/frenchys-chicken-houston?start=60,Angela E.,"Houston, TX",170,35,3,,10/19/15,Good good but very slow service. I sat in line for 45 min waiting to place an order. Haven't been to any other locations but I assume the service is better elsewhere.,"alt=""3.0 star rating""",3,frenchys-chicken-houston,frenchys-chicken-houston