URL,User Name,User Location,Friend Count,Review Count,Photo Count,Elite 17,Review Date,Review,Rating,Rating Extracted,Restaurant Extracted,Restaurant Extractedhttps://www.yelp.com/biz/frenchys-chicken-houston?start=120,Sonia T.,Hong Kong,552,942,13,Elite ’17,8/11/10,"I have been hearing about this place since college when I dated a frat guy that went to the University of Houston. Frenchy's this, Frenchy's that. I remember thinking Okay, come on, its ONLY fried chicken, how good could it be? Well I found out, its DAMN good! I had to work a convention over at Reliant and lunch time came around my boss and co worker mentioned Frenchy's. So, we wondered over ran though the drive through and ran back to the office mouth watering. Holy Crap! My mom never made chicken like this. It was crispy without being TOO crispy, peppery without being TOO peppery, and the dirty rice was awesome. The biscuit was a nice extra, and it was $5.99. How can you beat that? Obviously, its not a meal you could have everyday, but definately worth it!","alt=""4.0 star rating""",4,frenchys-chicken-houston,frenchys-chicken-houstonhttps://www.yelp.com/biz/frenchys-chicken-houston?start=140,Jenny L.,"Stafford, TX",0,44,,,3/16/13,"Very good fried chicken.The drive-through line was long. But I guess the chicken was worth the long time. Was told the original Frenchy's serves the best fried chicken. Their other location(s) cannot compete.","alt=""4.0 star rating""",4,frenchys-chicken-houston,frenchys-chicken-houstonhttps://www.yelp.com/biz/frenchys-chicken-houston?start=140,Jay W.,"Markham, Canada",0,120,102,,9/6/13,"Always come here whenever I have a FC craving, even if I have to drive through the ghetto to get here... IMO it's better than Willy Mae's in NOLA. The meat is always juicy and the skin is crunchy. I also like how they don't charge extra for white meat. However... I'm always disappointed with the chicken breast here. They're huge, moist, and crunchy at the same time, but... it always lacks flavor. Kind of tastes like boiled chicken after the first few bites. So my advice is to stick with the drums, thighs, and wings...","alt=""4.0 star rating""",4,frenchys-chicken-houston,frenchys-chicken-houstonhttps://www.yelp.com/biz/frenchys-chicken-houston?start=140,Michael P.,"Pearland, TX",77,176,76,,3/25/10,"Went a couple of days ago for lunch after reading a couple of the reviews and I have to say that I was really impressed with the fare at Frenchy's. Not knowing the ordering process/options I decided to go with the first combo meal I saw. That ended up being the King special; 5 pieces of dark and white meat chicken with fries and drink for about $7 (yes, I was really starving). The main attraction, the fried chicken was really, really good. It was very crispy, not as salty as say TBK's, and had a little kick which I can appreciate. I didn't want to bother with fried rice so I went with the fries, that weren't anything special. Simple but delicious and burn-your-fingertips fresh.4 stars. Being so close to the Robertson Stadium lot, this is my new favorite lunch spot. P.S. - I drove thru, since I was in a hurry, but if you want to hang around they have covered, patio seating but does not look very air conditioned.","alt=""4.0 star rating""",4,frenchys-chicken-houston,frenchys-chicken-houstonhttps://www.yelp.com/biz/frenchys-chicken-houston?start=140,S P.,"Houston, TX",17,57,8,,6/20/11,"The chicken is god, perfectly seasoned and fried. The sides I had were greens and red beans and rice. The greens were smoky but otherwise bland. The red beans were pretty good, and the sausage that came with was even better. Too bad you only get the one bite of it though. All in all, its no Harold's or Curt's, but it is good chicken.FYI- Only outdoor seating or drive-thru at this location.","alt=""3.0 star rating""",3,frenchys-chicken-houston,frenchys-chicken-houstonhttps://www.yelp.com/biz/frenchys-chicken-houston?start=140,Vic C.,"Houston, TX",12,244,8,,7/4/13,Fast and friendly service at the counter. Loved the coating. The chicken itself was EXCELLENT quality.,"alt=""4.0 star rating""",4,frenchys-chicken-houston,frenchys-chicken-houstonhttps://www.yelp.com/biz/frenchys-chicken-houston?start=140,Robert J.,"Mont Belvieu, TX",2,41,19,,9/15/13,I've eaten here a couple of times. The chicken is seasoned perfect. The fries are seasoned good but a little under cooked. Tried the red beans and rice for the first time and they were excellent. I will try the catfish next time,"alt=""5.0 star rating""",5,frenchys-chicken-houston,frenchys-chicken-houstonhttps://www.yelp.com/biz/frenchys-chicken-houston?start=140,Nicole F.,"Brooklyn, NY",47,153,286,,4/10/10,Frenchy's Chicken is a staple to Third Ward. They have the best chicken here ever hence the long lines. It's worth the wait for a king's special or 3 piece campus meal. The dirty rice and sweet potato pie are the best! Best time to come here is as soon as they open to avoid a long wait!,"alt=""5.0 star rating""",5,frenchys-chicken-houston,frenchys-chicken-houstonhttps://www.yelp.com/biz/frenchys-chicken-houston?start=140,Dallas P.,"Stratford, CT",0,2,1,,9/10/13,"I got the chicken tenders. It was really flavorful and seasoned extremely well. The dirty rice was really good and the biscuits had a hint of sweetness to it. The iced tea wasn't the best, but was okay. The price was decent, but there was a little wait. Check it out. Good food!","alt=""4.0 star rating""",4,frenchys-chicken-houston,frenchys-chicken-houstonhttps://www.yelp.com/biz/frenchys-chicken-houston?start=140,Hope C.,"New Orleans, LA",11,28,30,,7/23/12,Oh how I miss Frenchy's Chicken on Scott Street. While studying at Texas Southern University this place kept me fed after midnight.The campus special with a pepper and a strawberry fanta Lawdieeeee. The lines are always long; this is how you know the food is good and your tastebuds will thank you for waiting.. The sides and desserts are also great. The gumbo is sooooo goood and being from Nola I can be a little harsh at times but Frency's has gumbo making down to a T.,"alt=""5.0 star rating""",5,frenchys-chicken-houston,frenchys-chicken-houstonhttps://www.yelp.com/biz/frenchys-chicken-houston?start=140,Kepa P.,"Houston, TX",2,41,,,9/6/13,I thought I did not like fried chicken but Frenchys has great taste. I really like the flavor of their chicken and I love that is juicy and crunchy. I stopped for lunch and would definitely come back if I am in that area. The only thing is that I had to wait for my food and was kind of in a rush.,"alt=""3.0 star rating""",3,frenchys-chicken-houston,frenchys-chicken-houstonhttps://www.yelp.com/biz/frenchys-chicken-houston?start=140,Chris L.,"Pflugerville, TX",0,47,,,1/20/14,I have no idea why this place is so highly reviewed. We went out of our way to try this place while in Houston and the chicken sucked. NOt only is it limp and flavorless it was served cold and by surly employees. Don't go here. It is grocery store quality chicken and restaurant prices. Perhaps the great people of Houston don't really know good chicken. I can't fathom why this place is so well reviewed. Don't go.,"alt=""1.0 star rating""",1,frenchys-chicken-houston,frenchys-chicken-houstonhttps://www.yelp.com/biz/frenchys-chicken-houston?start=140,David V.,"Houston, TX",71,102,31,,9/21/10,"MmmMmm! Damn good chicken! The location alone makes you feel like you're getting some diamond in the rough type meal. I love hole in the wall places. I've been once and all I remember was I loved it! Im not sure on the pricing, but get you some!","alt=""4.0 star rating""",4,frenchys-chicken-houston,frenchys-chicken-houstonhttps://www.yelp.com/biz/frenchys-chicken-houston?start=140,Jordan N.,"Austin, TX",501,2054,1627,Elite ’17,9/17/05,"Cajun-styled fried chicken that has claimed itself to be the best fried chicken in Houston -- and rightly so (at least one of the best). They don't use much white meat though (I'm not sure if I can recall seeing any white meat as a matter of fact), and they don't seem to give big chicken legs. What makes this place the best is the seasoning put into the batter and just for the burst of flavor, I would be willing to come back and have their chicken.  This is located in the Third Ward (an African American ghetto in Houston) and is right by University of Houston and close to Texas Southern University. The building looks shabby and the light green paint seems to be peeling off. Age shows but not when it comes to the chicken.  There's a drive-thru at this location but usually the line is long and the drive-thru won't make your car feel comfortable (as it is tight and kinda hard to drive through. If you have a big car, forget it. Park the car and order inside (which by the way doesn't have much a/c to offer).  But despite the structural flaws, this place is often packed. So obviously they've been doing something right.  You can get sides such as dirty rice. This isn't your standard fried chicken place.","alt=""5.0 star rating""",5,frenchys-chicken-houston,frenchys-chicken-houstonhttps://www.yelp.com/biz/frenchys-chicken-houston?start=140,Roy G.,"Walnut Creek, CA",17,12,,,8/5/13,"By far the best chicken ever!! My mom & aunts can cook but I will have to say that this is better & that's a lot coming from me who loves when they prepare food! Lol I highly recommend that whenever you are in Houston that you come to this place!! It has to be this location since it is the ORIGINAL!!! Trust me I'm from Houston, TX & only come here!!","alt=""5.0 star rating""",5,frenchys-chicken-houston,frenchys-chicken-houstonhttps://www.yelp.com/biz/frenchys-chicken-houston?start=140,Joshua J.,"Houston, TX",198,124,139,,5/9/13,Best Fried Chicken in Houston and maybe in Texas. I go to u of h and its around the corner. Words can not describe the legend of this place.,"alt=""5.0 star rating""",5,frenchys-chicken-houston,frenchys-chicken-houstonhttps://www.yelp.com/biz/frenchys-chicken-houston?start=140,Carmen J.,"Houston, TX",0,27,34,,12/21/12,"Well I went to Barbecue Inn tonight because Houston Press rated it the #1 chicken in Houston over Frenchy's #2 and they are very, very wrong. Barbecue Inn's fried chicken was bland, so bland that I asked for seasoning salt and they didn't have any. I spent $50 for 9 pieces of chicken when I could've came to Frenchy's and got 3 King Specials for $30. Well, I'm sorry I cheated on you Frenchy's...because you should've been ranked #1. Frenchy's chicken is flavorful, fresh and just good especially with some dirty rice and a strawberry soda!","alt=""5.0 star rating""",5,frenchys-chicken-houston,frenchys-chicken-houstonhttps://www.yelp.com/biz/frenchys-chicken-houston?start=140,kenneth t.,"Houston, TX",11,16,6,,3/10/11,"I had a craving for fried chicken last week so I made a quick venture off to Frenchy's when I was in the area. I ordered the King's Special, and let me tell you that although it may sound like a lot, it really isn't. I finished it easy still with room left. The wings and chicken were pretty good, but meat was semi dry and had too much breading. Still enjoyable but personally I prefer the wings and rice down the street at timmy chans, and it's cheaper.Edit: Came back again to give a fair assessment. Yeah I am not denying that this is realllly gooood fried chicken, but it is cheaper down the street.","alt=""4.0 star rating""",4,frenchys-chicken-houston,frenchys-chicken-houstonhttps://www.yelp.com/biz/frenchys-chicken-houston?start=140,Sami A.,"Seattle, WA",221,504,5,,9/27/11,The best kind of Sunday is eating some Frenchy's chicken with strawberry soda while watching the epic hats come out of the church next door. Extra biscuit please!,"alt=""4.0 star rating""",4,frenchys-chicken-houston,frenchys-chicken-houstonhttps://www.yelp.com/biz/frenchys-chicken-houston?start=140,Luis M.,"Houston, TX",522,17,8,,5/4/14,I hadn't been to Frenchy's in quite some time. I was craving fried chicken so I had over. It was delicious! The only complaint I have is that the driver thru attendant was very rude. But I will still be back because the chicken was that good!,"alt=""4.0 star rating""",4,frenchys-chicken-houston,frenchys-chicken-houstonhttps://www.yelp.com/biz/frenchys-chicken-houston?start=140,Stephanie J.,"Mesa, AZ",29,171,,,7/30/09,"I know it's stereotypical for a black person to say she loves a chicken place, but God damn the chicken and sides here are delicious. I'm going to stop the description here as to keep Martin and Malcolm from turning in their graves, but this is one of my favorite Houston gems. Only thing keeping me from giving it five stars is the service (I can even overlook the shady location--it adds to the charm a bit). I don't know why it's so slow. Every time we did catering from this place for a school event, we'd build in an hour in order to get our food on time.","alt=""4.0 star rating""",4,frenchys-chicken-houston,frenchys-chicken-houstonhttps://www.yelp.com/biz/frenchys-chicken-houston?start=160,Irene K.,"Frisco, TX",31,54,16,,5/12/09,"Frenchy's = AWESOME fried chicken. I was a student at the surrounding University, and this place sure got frequented before and after class. I either get the King's Special (if I'm really REALLY hungry and want leftovers on top of that) or just the 2 or 3 piece meals with sides. The Dirty rice is very well seasoned and the frenchy fries at this location beat the ones out at the Kirby location. The chicken itself is crispy and a bit salty, yet tasty and fresh -- a really unique batter compared to KFC (yuck) or even Popeye's. Don't overlook the desserts -- both the sweet potato pie and the bread pudding were delicious and the perfect ending to a heavy meal. The service isn't necessarily the fastest (if you plan on going on Sunday, good luck as both the line and the drive through stretch on forever, especially right after church) -- but it's well worth the wait. I wish there were Frenchy's outside of Houston! :(","alt=""4.0 star rating""",4,frenchys-chicken-houston,frenchys-chicken-houstonhttps://www.yelp.com/biz/frenchys-chicken-houston?start=160,Daniel L.,"Houston, TX",5000,1308,2661,Elite ’17,3/31/11,"What can be said about Frenchy's that has not already been said? This is not the best fried chicken ever made - you find that back in Dallas at Bubba's on Hillcrest - so if you are a connoisseur of the chicken that has been efficiently fried, touring the world and educating others on the ins and outs of it, then you are going to be sad and depressed that this is the best Houston has to offer. If you are anyone else besides that globetrotting person of fried chicken infamy, then you are going to be quite pleased with what you find here: you don't know the power of the dark side of fried chicken until you eat here for the first time. This is one of my favorites and a local favorite of many other people as well. Why? It is pretty awesome all around; it is unique; and not easily replicated - KFC, Church's, and Popeyes tried and failed. I could not make this food in my kitchen if I tried - so that gives the place some epic points for being able to churn out fun food that I like and could not find anywhere else.","alt=""3.0 star rating""",3,frenchys-chicken-houston,frenchys-chicken-houstonhttps://www.yelp.com/biz/frenchys-chicken-houston?start=160,Charles H.,"Houston, TX",0,6,,,12/27/14,"I'm torn. Natives love the food so much we give them a pass even when they offer poor service, long wait times, and bad orders; visitors think it's just all part of the lore. When will we take this chain to task? Dang if the chicken isn't among the best in Houston, but should I have to wait in line for :20 and endure sour faces and bad attitudes just to get it? For that matter, while Frenchy's has a few ancillary items on their menu, their staple is chicken and fries... CHICKEN AND FRIES! Why does it have to take so dang long just to get chicken and fries?! Ask for extra seasoning, you may not get any at all. Ask for a 5 piece wing dinner, you may get 4 and a thigh. Frenchy's has been an institution since I've been alive, and we all have a natural propensity to protect our own, but when is enough enough? I'm tired of settling for mediocrity when I'm paying good money... that said, I'll probably stop by after church tomorrow. Sigh.","alt=""2.0 star rating""",2,frenchys-chicken-houston,frenchys-chicken-houstonhttps://www.yelp.com/biz/frenchys-chicken-houston?start=160,Jackie H.,"Kingwood, TX",54,101,92,,11/8/12,"Mmmmmm wings and dirty rice what more can I say.......the best fried chicken in houston for sure,,,,, only this original one not the other imposter Frenchy's","alt=""4.0 star rating""",4,frenchys-chicken-houston,frenchys-chicken-houstonhttps://www.yelp.com/biz/frenchys-chicken-houston?start=160,Ryan L.,"Houston, TX",142,281,,,7/12/10,"This is some good fried chicken. It just pops with flavor, crispy, salty, juicy, and almost perfect. Sides are almost inconsequential, but I go for the fries, sprinkled with cajun salt.No a/c, so this is definitely a to-go place, lest we get one of those rare beautiful days.","alt=""3.0 star rating""",3,frenchys-chicken-houston,frenchys-chicken-houstonhttps://www.yelp.com/biz/frenchys-chicken-houston?start=160,Carl H.,"Houston, TX",24,178,960,,1/29/11,"Don't be deterred by the outside or location, cuz inside you will find some good fried chicken. Seasoned without being spicy, a crisp outer with a moist and juicy inner. You're gonna have to make a mess in your kitchen at home, if ya wanna try and beat this chicken. The fries are ok and the dirty rice is pretty good. The location at I-10 and Waco is comparable too.","alt=""4.0 star rating""",4,frenchys-chicken-houston,frenchys-chicken-houstonhttps://www.yelp.com/biz/frenchys-chicken-houston?start=160,Omar B.,"Houston, TX",39,27,3,,9/8/12,"I love this chicken and the sides are legit. If I'm rating the place as a whole, I'd give it 4 bc you're sitting basically outside but the food is a 5!!! Been going here since I was a young boy so I love it","alt=""4.0 star rating""",4,frenchys-chicken-houston,frenchys-chicken-houstonhttps://www.yelp.com/biz/frenchys-chicken-houston?start=160,Emerson F.,"Seattle, WA",224,283,1,,11/20/08,"Frenchy...baby.. I wanted so much to like you. In the time I've lived here I've heard over and over about Frenchy's. Man.. You gotta try Frenchy's etc. Then, I look, and my fellow Yelpers have given this place glowing reviews also. So naturally I think ok if THIS many people like this place, and come over here to 3rd ward to eat here, it's gotta be good.Nope. It's just chicken. I don't know what I was expecting, but there are far better places to get a fried wing. Plus the service was horrible. I wouldn't even call it service. At one point, I wanted to say screw it and just put on a hair net and fry my own damn wings, ring myself up, and leave. Popeyes is better. Timmy Chan is better. Actually, I'M better at frying wings at home than this junk. Sorry to go against the consensus, but this place just didn't do it for me. The wings were lukewarm, and the seasoning was still batterish, not crispy. I won't be back.","alt=""2.0 star rating""",2,frenchys-chicken-houston,frenchys-chicken-houstonhttps://www.yelp.com/biz/frenchys-chicken-houston?start=160,C H.,"Houston, TX",0,64,28,,3/15/12,"If you're a health fanatic or if you're afraid to be in the 3rd ward, this is not the place to be (not even to reward yourself!). We ordered the 10 piece family meal ($19.99) which came with 10 pieces of great sized chicken (mainly breasts & wings), 2 large sides, and 4 rolls. The rolls were gone to waste because they were just your ordinary, plain dinner rolls. We ordered 2 large fries and for a meal of 2, this entire meal could defeat you. Even though the fries were delicious, you could taste the all the salt with each bite, which was way too much for me. I ended up drinking 3 glasses of water to recover from it! The chicken was juicy, tender, & the skin was seasoned well, however, it was saturated in oil. If you are into fast food & fried chicken, this is the place to go, hands down. But, if not, avoid for health concerns.","alt=""3.0 star rating""",3,frenchys-chicken-houston,frenchys-chicken-houstonhttps://www.yelp.com/biz/frenchys-chicken-houston?start=160,Harold B.,"Houston, TX",120,297,158,,11/1/10,"being high on mucinex and benedryl (thanx to newfound allergies) i honestly cant remem if it was fri or sat i went here lol but...its just chicken..popeyes is way betterall it would take is for an asian spot to open up nearby, bang out sum fried chicken and give them a serious run for the money..only good side is dirty rice - the jambalaya and gumbo are wack-ok supa wackbread pudding is diff but good with lil lemon taste to it...its good chicken dont get me wrong but nothing to hoop n holla about mang....also im not sure if its all that safe even in the daytime lol...","alt=""2.0 star rating""",2,frenchys-chicken-houston,frenchys-chicken-houstonhttps://www.yelp.com/biz/frenchys-chicken-houston?start=160,Mohammed A.,"Richmond, VA",2,22,,,3/23/09,"The Frenchy's on scott st. is probably the best one out of all the others.That being said, I think that the looks of this place are decieving... and the location is very shady, but the food is amazing. The fried chicken is soo good and the fries w/ the seasoning is out of this world. Although the fried chicken is delicious i still think that its a little too salty. Perfect place to eat once. If it wasn't so fattening I would go everyday!Pro: FOOD, FOOD, FOODCons: shady area, very fattening!","alt=""4.0 star rating""",4,frenchys-chicken-houston,frenchys-chicken-houstonhttps://www.yelp.com/biz/frenchys-chicken-houston?start=160,Sonia G.,"Houston, TX",1,91,2,,8/27/11,"I tried their recession special fried chicken. I was not impressed, it was too greasy and my stomach felt heavy afterwards. Church's makes better chicken, at least in Miami. The staff was not the most helpful. Every time I asked a question they had a 'huh' facial expression. I do speak good English, maybe I had an accent, I don't know. I did find it amusing that the cashier called the spork that she gave me a spark. The only thing that I loved was their lemon cake. I would come back just for that.","alt=""2.0 star rating""",2,frenchys-chicken-houston,frenchys-chicken-houstonhttps://www.yelp.com/biz/frenchys-chicken-houston?start=160,Chef D B.,"Houston, TX",2,70,,,3/8/09,"Between this and and the Fried chicken at spanish village, it's hard to say. It's flakey, perfectly seasoned, and it's not slimey like all the fast food chains seem to be. The dirty rice is fantastic, the fries are great with great seaoning. And the biscuits have a little honey drizzled on the top. Soooo good!","alt=""5.0 star rating""",5,frenchys-chicken-houston,frenchys-chicken-houstonhttps://www.yelp.com/biz/frenchys-chicken-houston?start=160,Kimberly N.,"Houston, TX",11,29,5,,7/27/11,The chicken was good the fries were fine the biscuit was a little dry. All in all if you want good fried chicken go to frenchy's if you want great chicken go to Popeyes. I got the two piece with fries and a biscuit all under 6 bucks so its really cheap and the food is alright.,"alt=""2.0 star rating""",2,frenchys-chicken-houston,frenchys-chicken-houstonhttps://www.yelp.com/biz/frenchys-chicken-houston?start=160,Thuyvi T.,"San Francisco, CA",186,193,19,,10/29/08,"I was so excited stumbling on to Frenchy's. My friend and I were wandering the area near Reliant Stadium trying to find good eats. When we spotted, the Frenchy's sign I was more than thrill after reading such great reviews. I love fried chicken but I much prefer other chains such as Popeye's or Church's. The crispy skin was a bit bland in flavor and I had to doust it with hot sauce. To me, it was just alright. I also tried the fried catfish, collard greens, and mashed potatoes. Those were also mediocre. Nothing wowing, nothing wrong either. I have to say that it's probably one of the nicer fast food developments though. There's even a bar inside.","alt=""3.0 star rating""",3,frenchys-chicken-houston,frenchys-chicken-houstonhttps://www.yelp.com/biz/frenchys-chicken-houston?start=160,Helen D.,"San Antonio, TX",336,119,97,,11/19/11,"Best FRIED CHICKEN EVER!!!!!!!!!!!! I used to frequent this place each month as an undergrad student at the University of Houston. I was introduced to it by a fellow student and quickly got addicted to their receipe. Needless to say I'd always get the 10 piece chicken, bisquits and mashed potatoes and gained some weight. :) It always felt like heaven when I smelled the chicken and ate it. I miss it and wished they opened up locations here in San Antonio!","alt=""5.0 star rating""",5,frenchys-chicken-houston,frenchys-chicken-houstonhttps://www.yelp.com/biz/frenchys-chicken-houston?start=160,Kendall F.,"Beaumont, TX",0,2,,,7/26/11,"When I first saw the place I wasn't impressed. It was a little shack in a iffy neighborhood (apparently I was at the original). But after my first bite I was pleasantly surprised. The chicken was fresh and hot with a tasty, crispy skin while the inside was juicy. The biscuits were excellent and the dirty rice was the best I ever had! Spicy with a tangyness to it that was amazing! All in all, it was a great, affordable meal that both my family and I enjoyed!","alt=""4.0 star rating""",4,frenchys-chicken-houston,frenchys-chicken-houstonhttps://www.yelp.com/biz/frenchys-chicken-houston?start=160,Gracie R.,"Houston, TX",12,62,22,,4/8/09,"This is one of those places where looks are deceiving! But the food is great and cheap!!! It has great flavor! It's also entertaining to watch the birds attack people for food =P","alt=""5.0 star rating""",5,frenchys-chicken-houston,frenchys-chicken-houston