URL,User Name,User Location,Friend Count,Review Count,Photo Count,Elite 17,Review Date,Review,Rating,Rating Extracted,Restaurant Extracted,Restaurant Extractedhttps://www.yelp.com/biz/frenchys-chicken-houston?start=60,MaxFoodie S.,"Houston, TX",0,25,28,,8/20/13,"Frenchys chicken is perfect for my senses - crisp and crunchy on the outside. Lovely seasonings. Juicy on the insideThe chicken thighs are my favorite with the wings a close secondIt's open till late late on weekends so its a great choice on a non sober night","alt=""5.0 star rating""",5,frenchys-chicken-houston,frenchys-chicken-houstonhttps://www.yelp.com/biz/frenchys-chicken-houston?start=60,Margo S.,"DeSoto, TX",1,38,3,,7/30/15,Great! I will visit every time I'm in in Houston. The flavor of the chicken makes your mouth water. There are several locations and we visited 2. The newest one in the Woodlands.,"alt=""5.0 star rating""",5,frenchys-chicken-houston,frenchys-chicken-houstonhttps://www.yelp.com/biz/frenchys-chicken-houston?start=60,Vicki C.,"Los Angeles, CA",20,52,,,5/28/15,"YUMMMM! Fried chicken is delicious, the red beans and rice looked messy but turned out to be just as tasty. The corn bread was a little dry. But the FRIES!! The fries were bahmb! I mean seasoned with seasoning salt and pepper, the fries were simply amazing. If you're in town, grab some Frenchy's from this location. The staff is pretty nice for the most part and they will help you out with ordering if you're new to town.","alt=""4.0 star rating""",4,frenchys-chicken-houston,frenchys-chicken-houstonhttps://www.yelp.com/biz/frenchys-chicken-houston?start=60,Tony A.,"Houston, TX",71,79,28,,8/14/14,"I ate here the other day and I thought their chicken was pretty good. I wouldn't say it was legendary or anything I'd crave weekly, but it did have good flavor. A bit too salty for some peoples taste, but the chicken had a unique flavor unlike the other big chains. Give it a try but don't take the 4 & 5 star ratings on here to hart.","alt=""3.0 star rating""",3,frenchys-chicken-houston,frenchys-chicken-houstonhttps://www.yelp.com/biz/frenchys-chicken-houston?start=60,Mykie D.,"Valley Ranch, TX",487,896,756,Elite ’17,10/14/13,Their side dishes are terrible! Particularly the dirty rice and collard greens. The customer service is horrible and they don't have hot sauce! How do you serve soul food style fried chicken and fried fish but don't carry hot sauce?!?!,"alt=""1.0 star rating""",1,frenchys-chicken-houston,frenchys-chicken-houstonhttps://www.yelp.com/biz/frenchys-chicken-houston?start=80,Jeffrey C.,"Silicon Valley, CA",577,1003,906,Elite ’17,7/31/11,"The money quote from people in the know: just like Coca-Cola, ain't nothin' like the real thing, baby. If you're doing Frenchy's Chicken, do it right and go to the original location next to University of Houston. At least, the rumor is this one is the original. I'd confirm, but Google isn't helping.For me, Frenchy's holds the title for second best fried chicken in Houston (sorry, Breakfast Klub takes the pole position for me). Start with chicken. Add sides. Add biscuit or cornbread. Enjoy.Seating is outside only, so be prepared to sweat a bit if you want to ""dine-in."" To cure that, wash it down with a super-sugary sweet tea that requires a bit of dilution but is otherwise incredibly tasty.Bring cash, and be prepared to wait if you're coming in peak times. Make sure to understand how to properly throw scraps far away so the birds don't swarm you. Ambiance, in my opinion. There's a system and madness to eating here, and the two aren't mutually exclusive.And, oh my god. The chicken. Yum.","alt=""5.0 star rating""",5,frenchys-chicken-houston,frenchys-chicken-houstonhttps://www.yelp.com/biz/frenchys-chicken-houston?start=80,T M.,"Oklahoma City, OK",22,135,,,12/1/14,"I ate here last night after I came from U of H's all night library. The chicken could have been cooked a little longer it was too mushy, but it did have a nice color and flavor to it. I had fries which were good and the strawberry soda. About an hour later my stomach starting hurting, and I was unable to keep the food down. This usually happens with old grease. They are not changing out their grease on a regular basis. The diner itself was dirty, and the counter staff were slow. Bad neighborhood as well, but ample parking.","alt=""1.0 star rating""",1,frenchys-chicken-houston,frenchys-chicken-houstonhttps://www.yelp.com/biz/frenchys-chicken-houston?start=80,Victor C.,"Houston, TX",10,150,6,,1/8/14,"Went on a Sunday afternoon and received our share from the giant trough of fried bird behind the ordering counter. I mean, this stuff is clearly inferior to a decent Popeye's location's food (though I have heard tell the Popeye's down the street near UH is gross). Nothing worth waiting for.","alt=""2.0 star rating""",2,frenchys-chicken-houston,frenchys-chicken-houstonhttps://www.yelp.com/biz/frenchys-chicken-houston?start=80,Kari O.,"Washington, DC",135,210,126,,4/14/13,"I can't even begin to speak on the institution that is Frenchy'sThe short story is- parking can be awful- driving down Scott is tedious because of the construction, and the folks who insist on doing 17 mph an hour on a 35mph road (I thought it was some Seniors or some youngstas looking for attention - nope, just slow drivers for no particular reason. And believe me, if you've had the chicken once, you don't want there to be any thing between you and the restaurant)- there is no bathroom, and there's no A - you've got 4 picnic tables if you want to eat there- the drive through takes FOREVER. (in most cases, you're better off sending someone inside to order. I rolled up the same time a dude in a 3 series coupe did. I got my meal, ate it, chatted with some folks, before he even got to the pick up window)But- The Chicken is fantastic, quite possibly the best you'll ever have.Frenchy's is so much more. I rolled up on Sunday. The car is rolling right, although as soon as I pulled in, I felt like I could have done a quick 2 hour detail, and worn my business gear. Sunday afternoon features- Pastors and Deacons in bowties and nice suits- Church Ladies in fabulous hats with purses to match- ballers rolling through in bentley's, beamers, and benz's- someone's granny in a 1970's era Chevy Pick Up (Lord, bless her heart)- plenty of folks mystified by 4 lines and 3 registers- whole families in SUV's- heat- good $%@! chicken and Sweet Potato Pie (which they kinda stingy with)It is simply one of the places that shows off the best that Houston has to offer. Every demographic you can think of shoulder to shoulder, elbow to elbow, ready to partake in possibly the best meal in the city that all of us can afford.Frenchy's is Houston at its best.","alt=""5.0 star rating""",5,frenchys-chicken-houston,frenchys-chicken-houstonhttps://www.yelp.com/biz/frenchys-chicken-houston?start=80,Charlie W.,"Houston, TX",34,37,,,8/18/13,"I am here to rescue those that are contemplating going to Frenchy's, but have not yet decided and are getting no help from the reviews. Issues with Frenchy's include: (1) Less flavor than Popeyes. (2) Bread tastes like yeast. (3) Always in a bad neighborhood and can guarantee there are roaches scampering about in the kitchen. My advice... If you want Cajun style fried chicken, go to Popeyes. There is a reason why they are a National Chain after starting as a local eatery in Louisanna, unlike Frenchy's which is stuck in Houston's ""inner city"".","alt=""3.0 star rating""",3,frenchys-chicken-houston,frenchys-chicken-houstonhttps://www.yelp.com/biz/frenchys-chicken-houston?start=80,Kyndal M.,"Spring, TX",13,33,118,,8/12/14,"There was a time when Frenchy's had some of the best chicken in Houston. Much has changed.. The pieces are smaller than most, which really isn't a biggie for me, but for my Husband who said ""this chicken's leg look like a pigeon's leg ""; it's a problem... The skin was overly seasoned and the meat was bland. Now if you're like most just eat it all at the same time and it'll balance itself out. Well I don't eat the skin on chicken, so basically what? What did it for me, a few feathers were still on the leg I had AND I WAS DONE. Who eats feathers? Not I said the cat..We ordered a medium rice with the intent to share between three of us (other places MED are enough for atlease 2) well their size medium is enough for 1 person.. Which ended up not being a problem because it was so bad & dried out; we were fighting over who was going to eat it because nobody wanted to eat it..I know Frenchy's is a Houston staple but y'all can have that..I tried to find another star but the feathers took it.","alt=""1.0 star rating""",1,frenchys-chicken-houston,frenchys-chicken-houstonhttps://www.yelp.com/biz/frenchys-chicken-houston?start=80,Endless O.,"Chicago, IL",11,57,,,9/19/13,"This place is right near where I work and it wasn't good at all. Sorry. The customer service was okay, they were trying & it appeared they had JUST trained the girl at the window because she was talking like a robot lolI had chicken fingers and fries. I don't remember the fries but the chicken fingers tasted like rubber. Basically they probably just defrosted them and threw them in the fryer. On top of that the chicken fingers were cold....no bueno. All I need is one bad menu item to not be bothered with going back to try the rest. If you mess up chicken fingers then I don't even want to know how you will mess up the fried chicken. Oh & I went through the drive-thru so I can't say what the experience inside is like.","alt=""1.0 star rating""",1,frenchys-chicken-houston,frenchys-chicken-houstonhttps://www.yelp.com/biz/frenchys-chicken-houston?start=80,Kris B.,"Salt Lake City, UT",68,572,62,Elite ’17,10/7/13,"Landed in Houston around 1 AM and was starving for dinner. Wanted to find something close to the hotel, and found this place which was still open. Drive-through line went around the block, so we figured it had to be good. The cops having a bite to eat also had to be good news. I had no idea what to order, so asked the lady behind the counter what to get. She started reading down the most popular items, and I knew what to have - the King Special with wings, a leg, a thigh, dirty rice and a drink. I don't know how they do it, but the chicken was crispy, not greasy, and perfectly seasoned. Wife had the catfish which had an amazing seasoned breading. Very fortunate our late landing took us here.","alt=""4.0 star rating""",4,frenchys-chicken-houston,frenchys-chicken-houstonhttps://www.yelp.com/biz/frenchys-chicken-houston?start=80,Alexander W.,"Manhattan, NY",640,599,1116,Elite ’17,3/18/09,"When you played M*A*S*H in elementary and middle school you tried to avoid 'S' because ... who wants to live in a Shack? If I had a time machine, I would go back in time wishing I got that 'S' every time. Reason? If that Shack was Frenchy's Fried Chicken. Although the establishment may look shack-like and rundown from the outside, the fried chicken makes you dream that you are eating 5 star food in a Mansion.Frenchy's could possibly be my new favorite fried chicken destination. I am a big Popeye's spicy fried chicken fan. Frenchy's chicken has a subtle spicy peppered skin. The spiciness crescendos with each bite you eat. This is different from the spiciness of Popeye's that just punches you in the mouth.I went to Frenchy's at around 330pm on a Saturday (after waking up at 230pm)...and there was a line. This proves that you can have fried chicken for breakfast, brunch, lunch, afternoon tea, linner, dinner and for a late night snack.Parking is in a private lot. There are park benches for you to sit on ""inside"" the restaurant with fans cooling you in this humid Houston weather.","alt=""5.0 star rating""",5,frenchys-chicken-houston,frenchys-chicken-houstonhttps://www.yelp.com/biz/frenchys-chicken-houston?start=80,Rose P.,"Houston, TX",24,38,50,,2/3/14,"I've had everything on the menu (chicken, catfish, rolls, cornbread, all sides, all desserts, and boudain) in my first 4 visits! :)***Chicken and the boudain are AMAZING! *Everything else is so-so.Totally worth the visit to enjoy their crunchy, seasoned, mouth-watering chicken. -Rose","alt=""4.0 star rating""",4,frenchys-chicken-houston,frenchys-chicken-houstonhttps://www.yelp.com/biz/frenchys-chicken-houston?start=80,Nissa E.,"Atlanta, GA",316,130,113,,4/16/13,"OMG!! I grew up in Texas, lived in Houston for YEARS before heading to the ATL. So THIS spot I can personally tell you is one of THE best chicken spots in Texas and you HAVE to go to this one!! The other locations are ""okay"" but THIS one is that bomb.com. The WHOLE menu from the chicken to the sides to the dessert!! I went home this weekend and was surprised with a Frenchy's lunch and baaaaaybay!!!! I was a happy camper!!!Besides ya mama's or your granny's or whoever's kitchen, if you want some chicken, you need to head to 3919 Scott St...love this spot!!!The best thing to do is do a drive-thru stop, you can park and walk-up and even sit and eat if you want but because of the size of the property, it can be crowded. I see some folks giving it a mediocre rating..and i'm like ""ok whatever"" Frenchy's is where you wanna go if you want chicken.Enjoy!!","alt=""5.0 star rating""",5,frenchys-chicken-houston,frenchys-chicken-houstonhttps://www.yelp.com/biz/frenchys-chicken-houston?start=80,Merk P.,"Missouri City, TX",141,35,,,5/13/15,"They have a large selection of fried foods including their world famous chicken, which is pretty tasty. I wouldn't say it's the best I've ever had but it's good. They also have good boudain, which you want find at a fast food joint.","alt=""4.0 star rating""",4,frenchys-chicken-houston,frenchys-chicken-houstonhttps://www.yelp.com/biz/frenchys-chicken-houston?start=80,Jeremiah H.,"Medical Center, Houston, TX",47,96,40,,12/8/14,Was a weekly go to place until the raise in prices but I still go and get my wing dinner or chicken tender dinner,"alt=""3.0 star rating""",3,frenchys-chicken-houston,frenchys-chicken-houstonhttps://www.yelp.com/biz/frenchys-chicken-houston?start=80,Gina T.,"Moreno Valley, CA",397,32,25,,6/22/13,"OMG OMG!!!! Talk about creol food. Frenchy's chicken I don't know how to explain it but it's sooooo gooood. The flavor in the seasoning is just amazing. I can't eat this stuff all the time cause its greasy but it's good tasting greasy fried chicken LOLThey have greens, corn bread, the french fries yes yes yes!!!! It's always a long line in both the drive in and stand in window. You have got to try this chickenno wait staff, it's every man for himself. Buy your food wait for it sit down and eat it on their open door patio or drive away eating while driving cause you can't wait the smell of the creol seasoning will drive you crazy! Love that chicken from Frenchy's. Popeyes and KFC can't touch this place","alt=""5.0 star rating""",5,frenchys-chicken-houston,frenchys-chicken-houstonhttps://www.yelp.com/biz/frenchys-chicken-houston?start=80,Glenn L.,"Argyle, TX",0,42,4,,2/17/16,"I was working at UH and I heard so much about Frenchy's. I stopped in for a bite and was impressed by their Cajun and fried chicken menu. I ordered the three piece combo, boudin, and got the biscuit and pepper along with a side of greens. For a dessert I got the bread pudding.The chicken pieces were a little smaller than I expected, the batter a little greasy. But hot and tasty. It helps when you miss lunch that makes everything one star extra in taste.They forgot the boudin on the order. The greens were under cooked and not very good.Bread pudding the size of a small cupcake, cold, but good.I'll definitely come back but try the catfish, red beans, next time, and try the boudin if it makes the order. The place was a little trashy with eaten chicken on the floor and tables, used napkins, smashed ketchup packets on the floor.But get it to go and you don't have to deal with that except watch where you walk.","alt=""3.0 star rating""",3,frenchys-chicken-houston,frenchys-chicken-houstonhttps://www.yelp.com/biz/frenchys-chicken-houston?start=80,Kacey T.,"Charlotte, NC",45,37,1,,8/17/13,"I had heard so many people rant and rave about how good the chicken was at Frenchy's so naturally I was curious. I was in Houston for work and one day during my lunch break I decided to give the legendary Frenchy's a try. The place was beyond packed which made me think that I was about to be in for some of the best tasting, finger licking, lip smacking fried chicken of my life. I was super duper excited! I waited in line for about 20 minutes before I got up to the counter, placed my order (5 wing special for about $9) and waited about another 10 minutes to receive it. I swiftly walked to my car to eat since there was no place for me to eat there. I opened up my food and saw that it was still smoking hot from being freshly cooked. I waited a couple of minutes for my wings and fries to cool down and then took a bite. I was expecting a savory explosion of flavor but was left disappointed. My chicken was seasoned but it wasn't as good as I expected it to be. No where near as good as my favorite chicken place, Eat-n-Run in Chicago but I'd definitely be willing to give it another try just in case the cooks were having an off day.","alt=""3.0 star rating""",3,frenchys-chicken-houston,frenchys-chicken-houstonhttps://www.yelp.com/biz/frenchys-chicken-houston?start=80,Kris G.,"Houston, TX",17,8,3,,1/9/15,Frenchys is the best. That is all. I'm in love with their wings and fries w/peppers combo,"alt=""5.0 star rating""",5,frenchys-chicken-houston,frenchys-chicken-houstonhttps://www.yelp.com/biz/frenchys-chicken-houston?start=80,Marinela B.,"Houston, TX",2,45,,,6/20/14,"So hubby wanted this place so we went and freaking yuck!! You know years back at other locations it was ok so we thought surely they improved their quality and service WRONG seriously overrated. I felt robbed it's one of those establishments that just pulls the old stuff and try's to push it off on you. Chicken extremely salty dry, boudin omfg shriveled up nasty like it was left over and boo if you ask for exchanges you will get attitude and do trust I really aient got time for dat... So go at your own risk you've been warned!","alt=""1.0 star rating""",1,frenchys-chicken-houston,frenchys-chicken-houstonhttps://www.yelp.com/biz/frenchys-chicken-houston?start=80,Shannon O.,"Austin, TX",103,282,408,Elite ’17,6/6/11,"Yet ANOTHER place I love in Htown...and try to eat at when Im there...this fried chicken is soo good, when I attended PVAMU I tried to hit this place up as often as I could get to Houston..now they have one down the street from my old school! (figures)...anyhoo I digress...this place is just plain o' good.A 2 piece and a peppa...all day long.","alt=""4.0 star rating""",4,frenchys-chicken-houston,frenchys-chicken-houstonhttps://www.yelp.com/biz/frenchys-chicken-houston?start=80,Keandra S.,"Atlanta, GA",229,89,118,,10/7/12,"I've been coming here since I was a teeny-weeny baby gnawing on the chicken gristle!What can I say!? It's deliciousness creole flavored chicken made with all types of cholesterol love... We have used Frenchy's for many occasions.. I've tried Frenchy's in all kind of settings walk-a-thons, catering for a private party, etc. One thing that stays consistent which is why the other locations probably didn't do so well... is the flavor & Frenchy family community involvement. The chicken can get pricey but they offer many specials on their campus specials & chicken strip specials that usually included a pepper, seasoned fries, sweet roll or biscuit & a drink. The best time to go is around 8PM, or when the line is long.... which is almost alllll the time during lunch hour & dinner hours because the chicken is freshly cooked...People travel from all over the world to Houston & when they come, they are in the line... I live an hour a way but it is the best hour a way drive!If you haven't tried Frenchy's Chicken, plz tell me what you are waiting on!? Live a lil' it is deliciousness!","alt=""4.0 star rating""",4,frenchys-chicken-houston,frenchys-chicken-houstonhttps://www.yelp.com/biz/frenchys-chicken-houston?start=100,Tonya B.,"Houston, TX",634,79,29,,8/20/14,"I can't believe that I've been coming to this place for well over 20 years. The food is still A1 - fresh and delicious. Although, I can no longer muster up the patience to actually eat at the establishment, Frenchys travels with me to potlucks, picnics, and family gatherings. Everything is really good!","alt=""4.0 star rating""",4,frenchys-chicken-houston,frenchys-chicken-houstonhttps://www.yelp.com/biz/frenchys-chicken-houston?start=100,E B.,"Houston, TX",6,53,22,,1/26/15,Delicious!! My first time tasting the chicken was back in 2007. My first time back since then and it was worth it! Red beans and biscuit were even good. I normally don't eat the biscuits but I did this time!! Definitely recommend Frenchys!,"alt=""5.0 star rating""",5,frenchys-chicken-houston,frenchys-chicken-houstonhttps://www.yelp.com/biz/frenchys-chicken-houston?start=100,Diana L.,"Houston, TX",42,290,1,Elite ’17,11/20/13,"I can't believe we haven't eaten here sooner! We needed to grab a quick lunch so we headed to the drive-through. We ordered the Feast, which consisted of 4 pcs (your choice of dark, white or mixed), a cornbread muffin or biscuit, and a side. We had the fries and ordered an extra side of dirty rice. The chicken was so flavorful, juicy, and crisp! The biscuit was melt-in-your-mouth yummy! The fries were good with a little touch of cajun seasoning. The dirty rice was also great. We'll definitely be back!","alt=""4.0 star rating""",4,frenchys-chicken-houston,frenchys-chicken-houstonhttps://www.yelp.com/biz/frenchys-chicken-houston?start=100,Errol B.,"New York, NY",88,36,5,,8/18/13,"This is part of my undergraduate nostalgia, how I miss thee Frenchy's. This place has some of the best fried chicken, boudain and peach cobbler.Always a line, always worth the wait.","alt=""5.0 star rating""",5,frenchys-chicken-houston,frenchys-chicken-houstonhttps://www.yelp.com/biz/frenchys-chicken-houston?start=100,Jae J.,"Houston, TX",2,38,9,,10/13/14,"I don't even like chicken like that, but this place is sooooooo good. Chicken and fries are always well seasoned and hot. One of my staples","alt=""4.0 star rating""",4,frenchys-chicken-houston,frenchys-chicken-houstonhttps://www.yelp.com/biz/frenchys-chicken-houston?start=100,Castro S.,"Houston, TX",155,146,232,,2/19/13,"I've frequented the Southwest locale mostly. Since living more central now, I decided to check out the Scott St. location. As I pulled up to it there was a line around the restaurant and down the street. I thought it was because of ALL-STAR WEEKEND, but apparently this is the norm. So I parked and got into the line inside. After close to an hour wait in line (there are 3 registers) I got my food. SO WORTH THE WAIT! The chicken is always good. Rice and beans were amazing, and their Red soda never fails. The workers behind the glass window were all very friendly and worked fast to get everyone in and out. Oh yes... the seasoned fries are one of a kind. I will return!","alt=""4.0 star rating""",4,frenchys-chicken-houston,frenchys-chicken-houstonhttps://www.yelp.com/biz/frenchys-chicken-houston?start=100,Rasteen W.,"Tomball, TX",98,134,64,Elite ’17,9/23/13,H-Town Favorite end of story!,"alt=""5.0 star rating""",5,frenchys-chicken-houston,frenchys-chicken-houstonhttps://www.yelp.com/biz/frenchys-chicken-houston?start=100,Krystal B.,"San Francisco, CA",0,8,2,,4/16/15,"So disappointed. I love frenchys! That being said, it really saddens me to give them one star but really they deserve it.The prices have gone up which I don't mind normally but the portions have gone down simultaneously *note wing special now consists of only 4 instead of 5* they also changed their kings special and replaced the wings with tenders.... ok? On the the actual reason for my review... I went through the drive-thru today and ordered a kings special, asked to pay extra to sub the tenders for wings, the woman says ""sorry they won't let me do that"" i say okay i'll just take it as is, she never asks what drink i want so i just tell her. When i pull up to the window i pay and she hands me my food. I check it as i start pulling out an lo-behold, there is literally only 2 chicken tenders in my box... I just paid $10. I had to drive back around. Park my car & go inside and tell someone that my order was wrong. Then the woman who took my order starts asking the woman helping me why she's changing my order cause ""that's what I asked for"" apparently. By this point I am BEYOND pissed. I finally get the right order and drive off, get home & start eating my food & all of it is disgusting. Dry tenders & my fries weren't even cooked all the way. I WILL NEVER COME BACK. And that makes me f-ing angry because I have been coming here for years.","alt=""1.0 star rating""",1,frenchys-chicken-houston,frenchys-chicken-houston