URL,User Name,User Location,Friend Count,Review Count,Photo Count,Elite 17,Review Date,Review,Rating,Rating Extracted,Restaurant Extracted,Restaurant Extractedhttps://www.yelp.com/biz/frenchys-chicken-houston?start=0,Gerald N.,"Fort Worth, TX",343,39,316,,11/24/17,Frenchy's chicken is a Houston staple when it comes to chicken it's some of the best chicken I've had in a long time you can't go wrong with the 3 piece and two sides meal.,"alt=""5.0 star rating""",5,frenchys-chicken-houston,frenchys-chicken-houstonhttps://www.yelp.com/biz/frenchys-chicken-houston?start=0,Kandis J.,"Houston, TX",321,196,342,Elite ’17,2/26/17,"So ever since I moved to Houston all I would hear about is Frenchys this and Frenchys that. However I'm just like .... whatever! Anywho, I got to try Frenchys for the first time during Super Bowl weekend. So you know the lines were insane. My companions and I opted to go inside because the drive thru line did not look as if it was moving any time soon. The menu was so overwhelming I just could not decide on what to order. That is when the person taking my order informed me to I guess get the original with chicken and fries even though I was sad it didn't come with the biscuit smh. (Oh oh oh apparently the sweet tea isn't all that so Texas just CANNOT be the south and my thoughts remain the same on it being the Midwest) It only took less than five minutes to receive my other and everything was good. Although I will say I liked my chicken better as leftovers but the fries were yummy with whatever kinda salt they sprinkle on top. I would highly suggest this is be a drunken night too spot though because I just couldn't imagine eating this on a regular sober day. Maybe it's me but it was an heavy meal that my body just couldn't handle.","alt=""4.0 star rating""",4,frenchys-chicken-houston,frenchys-chicken-houstonhttps://www.yelp.com/biz/frenchys-chicken-houston?start=0,travis l.,"Houston, TX",13,111,22,Elite ’17,6/1/17,Frenchy's oh Frenchy's...you're my addiction my fried chicken affliction. I can't get enough of you. I feel dirty when I eat you and at the same time crave for more. I am so sad you're leaving your original location I hope all the best for you at your new spot. I hope you still tickle my funny bone like you have done for years when you start slinging at a different spot. Campus meal=my crack cocaine,"alt=""4.0 star rating""",4,frenchys-chicken-houston,frenchys-chicken-houstonhttps://www.yelp.com/biz/frenchys-chicken-houston?start=0,Aaron M.,"Houston, TX",352,302,30,Elite ’17,5/22/17,"If you're getting hot fried chicken - it's damn good. You'll have grease running down your forearms and want some more. If you're getting cold tenders, blech. Staff loves sliding those doors shut in your face. You'll receive very little customer service no matter your color or creed (we sat and watched, hilarious).But, there's just something about this chicken. Man it's good.","alt=""4.0 star rating""",4,frenchys-chicken-houston,frenchys-chicken-houstonhttps://www.yelp.com/biz/frenchys-chicken-houston?start=0,Linda E.,"Houston, TX",491,539,2406,Elite ’17,8/11/16,"This classic Houston joint serves some great tasting chicken. Crowds have been flocking here for ages to enjoy that homemade taste that is associated with Frenchy's. Is it the best chicken you can find?, not by far. For me personally, I think I have dabbled on too many variations of fried chicken. I must say that the ones that are top contenders are definitely the Palestinian and Chinese versions. Frenchy's version is well made but it fails to deliver those punchy flavors that other versions offer. This version reminds me of a home cooked one with no secret recipe to boast. You will definitely enjoy it though! My favorite part of the meal is always the biscuit. This is how I imagine Martin's mama biscuit tastes like! Still although no my favorite, it is still a Houston classic that should be enjoyed at least once.","alt=""3.0 star rating""",3,frenchys-chicken-houston,frenchys-chicken-houstonhttps://www.yelp.com/biz/frenchys-chicken-houston?start=0,Son N.,"Houston, TX",34,24,99,,9/7/17,"It's been awhile..thought about bw3..but went for frenchys ""king special"" now called kings something..got my jalapenos and substituted the wings for thighs in my order..got my family some..its been over a year since I had it..yummerz..opened till 12am","alt=""4.0 star rating""",4,frenchys-chicken-houston,frenchys-chicken-houstonhttps://www.yelp.com/biz/frenchys-chicken-houston?start=0,Brianna B.,"Houston, TX",276,66,71,Elite ’17,1/11/17,"You would be blocking your blessings if you decided not to go to this place because a couple of yelp reviews labeled it as ""sketchy"". First and foremost I'm not sure what exactly constitutes a place as sketchy but no one has ever gotten robbed or harmed trying to get a wing special. Frenchy's is a legend around these parts and I feel as though anyone visiting this city needs to try it at least once. This isn't your Popeyes or your KFC chicken. Although seemingly small in size their wings are like no other and I wish I had the seasoning on their fries at my house. You get a pepper and cornbread or biscuit with some other combos as well. Everyone knows that a strawberry soda is a perfect combination with chicken. They don't carry hot sauce here but no worries a real southern girl keeps a couple of packets in car and purse.","alt=""5.0 star rating""",5,frenchys-chicken-houston,frenchys-chicken-houstonhttps://www.yelp.com/biz/frenchys-chicken-houston?start=0,Karina T.,"Houston, TX",58,49,74,,7/27/17,"Prices went up, service is slow, wait is still loong but OMG the chicken is so soooooo good!","alt=""4.0 star rating""",4,frenchys-chicken-houston,frenchys-chicken-houstonhttps://www.yelp.com/biz/frenchys-chicken-houston?start=0,Claire L.,"Houston, TX",141,75,22,Elite ’17,1/12/17,"It's located right outside of UH (scott street).I used to go here in freshmen and sophomore year, around last night with my friends. To be honest, the area and environment is not the best. But they open till like 3-4am and the chicken is pretty good considering the price. I don't go anymore but I think if you want chicken around school you could visit there.","alt=""3.0 star rating""",3,frenchys-chicken-houston,frenchys-chicken-houstonhttps://www.yelp.com/biz/frenchys-chicken-houston?start=0,Tieon O.,"Shreveport, LA",120,172,828,,3/3/17,OMG the chicken was super yummy! The french fries was right! The chicken tenders was juicy and seasoned well! The customer service was poor but the food made up for it! I will return!,"alt=""4.0 star rating""",4,frenchys-chicken-houston,frenchys-chicken-houstonhttps://www.yelp.com/biz/frenchys-chicken-houston?start=0,mAndy P.,"Austin, TX",108,29,10,,4/22/17,"Wow! Yes I see what all the fuss is about concerning this little chicken stand. That was one of the crispiest most delicious fried chicken breasts I've had in a very long time! My only complaint was it was a little salty but I think that comes with the territory. Also had the red beans and rice (which had a really good piece of Cajun sausage in there to top it off), and some terrific home style collard greens. Glad we stopped in on our way through Houston to see this neighborhood landmark!","alt=""5.0 star rating""",5,frenchys-chicken-houston,frenchys-chicken-houstonhttps://www.yelp.com/biz/frenchys-chicken-houston?start=0,Shelly S.,"Frisco, TX",0,3,,,10/23/17,"I wanted to give 0 starts the worst chicken ever I was so excited to try this chicken we drove from Dallas to Houston to visit , and I suggested we try this chicken I always hear people from Houston saying it's Good and it's better then Rudy's Chicken or Halls in Dallas ! False first off the whole Chicken was over $20 with added sides you can get a Whole Chicken extra seasoning in Dallas for $15 and fries come with it The Cashier was rude the wait was long and the chicken under cooked definitely will not be eating here again a waste of money P.S we ordered a Peach Cobbler and it was frozen","alt=""1.0 star rating""",1,frenchys-chicken-houston,frenchys-chicken-houstonhttps://www.yelp.com/biz/frenchys-chicken-houston?start=0,Nicole C.,"Dallas, TX",756,225,2765,Elite ’17,2/23/16,"Soooooo I am sold on Frenchy's chicken!!! The chicken has the right spices and it is always hot and fresh. The chicken wings are on the small side but that just lets me know they are not pumped up with a bunch of hormones. I had the wings and dirty rice the first time I went and I am not a fan of the dirty rice. It was a little dry for my liking. The next time I went I had the wings and fries and I had no complaints. This particular location is not easy on the eyes but the employees were nice and were good at trying to get us to buy the peach cobbler. The peach cobbler tastes just like your grandma would make it. It doesn't look like it has a drive thru but it does so if you want to stay in your car you can.","alt=""4.0 star rating""",4,frenchys-chicken-houston,frenchys-chicken-houstonhttps://www.yelp.com/biz/frenchys-chicken-houston?start=0,Mary D.,"Houston, TX",0,23,49,,8/10/17,"I've been eating there for years. Even worked there for 5 years in my younger years. Fried chicken frenchys fries . Jalepeno, seasoning salt, collard green, dirty rice ,strawberry soda, peach cobbler lemon cakes w real lemon rimes, chocolate cake, sweet potato pie and don't forget creole sausage poboy all the way. Best chicken I'm Houston","alt=""5.0 star rating""",5,frenchys-chicken-houston,frenchys-chicken-houstonhttps://www.yelp.com/biz/frenchys-chicken-houston?start=0,Dione P.,"Shreveport, LA",82,18,44,,3/3/17,"I would give them 5 but the customer service succck! Now the chicken and fries are a different situation! Lol The chicken was HOT, fresh, juicy and delicious!!! The French fries were AWESOME!!!! Expect to wait a while but it's worth the wait!","alt=""4.0 star rating""",4,frenchys-chicken-houston,frenchys-chicken-houstonhttps://www.yelp.com/biz/frenchys-chicken-houston?start=0,Shirley G.,"Houston, TX",15,162,158,Elite ’17,7/2/16,"Omg this place looks horrible; old and busted lol. My husband really wanted to try this place out, so I agreed to give it a try. Surprisingly the Chicken is wonderful. However Customer service is not so good. I felt like I was being rushed when making my order. The line was super packed so I guess they have faithful customers coming back for a reason. :-)","alt=""3.0 star rating""",3,frenchys-chicken-houston,frenchys-chicken-houstonhttps://www.yelp.com/biz/frenchys-chicken-houston?start=0,Angela C.,"Irving, TX",17,26,33,,5/30/16,"I FINALLY made my way to Frenchy's and all I can say is YUM! This has got to be the best chicken that I've tasted in a while. My only issue is with their lack of condiments and the rude staff. Frenchy's on McGregor does not offer any hot sauce, bbq sauce or anything. No matter how flavorful the chicken is, a little hot sauce never hurts. The staff was quite rude. We consistently said ""thank you"" to the woman working the drive-thru and NOT ONCE did she ever acknowledge it with a response. Thanks for living up to the ""stereotype.""","alt=""4.0 star rating""",4,frenchys-chicken-houston,frenchys-chicken-houstonhttps://www.yelp.com/biz/frenchys-chicken-houston?start=0,Ryan P.,"Los Angeles, CA",210,295,632,Elite ’17,10/6/15,"I have several friends from the Houston area and they all recommend I check out Frenchys, specifically the one by the University of Houston. I am a huge wing fan and my expectations were really high but these definitely disappointed. The flavor was ok, but nothing special. My favorite thing was the fries.","alt=""3.0 star rating""",3,frenchys-chicken-houston,frenchys-chicken-houstonhttps://www.yelp.com/biz/frenchys-chicken-houston?start=0,Lynette L.,"South Central Houston, Houston, TX",0,1,,,7/17/17,Decent food but too too slow! Need to improve the drive through!! Alway a long long line.,"alt=""3.0 star rating""",3,frenchys-chicken-houston,frenchys-chicken-houstonhttps://www.yelp.com/biz/frenchys-chicken-houston?start=0,Jackie K.,"Houston, TX",6,870,,Elite ’17,5/22/16,"Wonderful fried chicken!! The fried chicken and the french fries were my favorite. Seriously, the french fries are maybe the best french fries I've had in Houston. The fried chicken was nice and juicy with wonderful, flavorful breading. The collard greens were just fine, and a thought the biscuits were pretty good.But here's my recommendation: eat the french fries shortly after you get them from the counter when they're so hot and fresh! We ate some in the car, and they were amazing; but they were a little soggy by the time we got home 20-30 minutes later. Note that they have a little patio where you could eat, but I'm not sure that it's air conditioned, and it's a little small.","alt=""5.0 star rating""",5,frenchys-chicken-houston,frenchys-chicken-houstonhttps://www.yelp.com/biz/frenchys-chicken-houston?start=20,Ray G.,"Los Angeles, CA",174,55,36,,12/13/16,"Yes, it is located in a shady shack looking establishment like others have said in previous reviews. But aren't all the hidden gems stationed in less than desirable locations. Don't let the bad looks fool you, this is a destination spot in the city of Houston. It didn't get the popular title of ""Best Fried Chicken in the City"" for no reason. Frenchy's has lived up to the high expectations I had for it since I first arrived here.Since it's just a hop and a skip away from campus, this particular one is very popular among U of H and TSU students. My advice would be to go during peak hours from 4-7 to ensure that the food is fresh.","alt=""5.0 star rating""",5,frenchys-chicken-houston,frenchys-chicken-houstonhttps://www.yelp.com/biz/frenchys-chicken-houston?start=20,Angel J.,"Atlanta, GA",120,68,32,,10/31/16,"I just relocated to Houston fromAtlanta so I've been told to check it out but others kept referring me to Hertz Chicken but I never got around to it. Any who Frenchys is the BEST... If you want good chicken and red beans, go to Frenchys.. Taste homemade","alt=""5.0 star rating""",5,frenchys-chicken-houston,frenchys-chicken-houstonhttps://www.yelp.com/biz/frenchys-chicken-houston?start=20,Doria H.,"Richmond, TX",0,13,1,,5/8/17,After hearing lots of good reviews on this place I decided to give it a try. The parking was adequate and the service was fast and friendly. The chicken was delicious and tasted authentic and the French fries are sooo good I highly recommend! Only thing is it's a little hot inside because there was no AC lol but overall great restaurant.,"alt=""5.0 star rating""",5,frenchys-chicken-houston,frenchys-chicken-houstonhttps://www.yelp.com/biz/frenchys-chicken-houston?start=20,Amanuel D.,"Spring, TX",0,3,,,4/19/17,"The food is alright, nothing to write home about but adequate and is the sole reason this is not a 1 star review. My issue was with the service, specifically service that followed the reception of my credit card. Instead of swiping my card or inserting the chip the cashier opted to manually input my information. This would be well and fine if there wasn't a screen angled at the customers showing clearly all of my credit card information. I then tried to be polite and as I thought it an honest mistake, chuckling, remarked, could you please not show everyone else my credit card information? To which I received a rather curt ""i dont care"". Exemplifies the service you should expect from here","alt=""2.0 star rating""",2,frenchys-chicken-houston,frenchys-chicken-houstonhttps://www.yelp.com/biz/frenchys-chicken-houston?start=20,Meka G.,"Rockwall, TX",22,16,104,,3/13/17,The best chicken I've ever tasted. It's a must that we stop here every trip to Houston. We bought ten wings and then we stopped to get the kids something else because we didn't want to share. Lol.,"alt=""5.0 star rating""",5,frenchys-chicken-houston,frenchys-chicken-houstonhttps://www.yelp.com/biz/frenchys-chicken-houston?start=20,Ronnie B.,"Rockwall, TX",46,236,561,Elite ’17,8/20/16,Amazing chicken!!! Friendly staff and nice location. Speedy drive thru... Only issue fries were a bit salty,"alt=""4.0 star rating""",4,frenchys-chicken-houston,frenchys-chicken-houstonhttps://www.yelp.com/biz/frenchys-chicken-houston?start=20,Christine R.,"Houston, TX",22,382,1177,,9/1/16,"I love eating at different chicken places. This place is near my school so I yelped it. It's pretty shady looking at it. Its looks like a shack from the outside in a ghetto atmosphere. For me it didn't matter, I was on a quest to eat some good chicken. I got to say their chicken has a different spicy taste different from others. I was quite impressed and was pleasantly happy.","alt=""4.0 star rating""",4,frenchys-chicken-houston,frenchys-chicken-houstonhttps://www.yelp.com/biz/frenchys-chicken-houston?start=20,Mr. Bean B.,"Houston, TX",36,97,629,,11/17/15,"Sak pase? M'ap boule!I came thru Frenchy's last night after attending the Celtics/Rockets game; in which my boys #CELTICSPRIDE handily opened up a can of whoop ass. I was fixin' (I'm getting acclimated to the lingo down here) for some late night grub and wanted to see what H-town's scene was all about. I ordered the 4 piece party pack which consisted of fried chicken and 2 boudins, and also got a side order of dirty rice. After a few minutes the lady who took my order asked if I wanted something to drink, pro bono. I appreciated the gesture and gladly obliged. Mèsi anpil!In all honesty the area seemed a bit sketchy so I took my food and waited 35 minutes until I got home to chow down, and everything was still warm - and more importantly - fucking delicious! I'd never had boudin before and immediately fell in love with my first bite. SO GOOD! It does have a spice tint to it, but the heat was in every way welcoming for my palate. The fried chicken was a soft-crispy type and albeit small, very juicy and seasoned to perfection.Bon bagay!-Bean","alt=""4.0 star rating""",4,frenchys-chicken-houston,frenchys-chicken-houstonhttps://www.yelp.com/biz/frenchys-chicken-houston?start=20,Daniel M.,"Wharton, TX",26,28,29,,2/22/17,"Chicken was good and tried it because I was in the area. I wouldn't drive from where I live to just eat their chicken, but it was darn good!","alt=""4.0 star rating""",4,frenchys-chicken-houston,frenchys-chicken-houstonhttps://www.yelp.com/biz/frenchys-chicken-houston?start=20,Penny N.,"Montrose, Houston, TX",2,35,5,,8/29/16,"I always liked fried chicken, but now I love and crave fried chicken. This place is hella good. It's salty as shit, but in the best way possible. It will put other chicken to shame. My friend had her baby shower catered by them and the chicken was gone in about twenty minutes.The staff is always super friendly. It's good no frills and Super yum!","alt=""5.0 star rating""",5,frenchys-chicken-houston,frenchys-chicken-houstonhttps://www.yelp.com/biz/frenchys-chicken-houston?start=20,Cynthia J.,"Houston, TX",124,169,852,Elite ’17,5/15/16,"I was coerced into ordering to go from this establishment and I'm still salty about it. Speaking of salty.....it's the best word to describe the chicken. Salt was the predominant flavor that was fighting with the flavor of slightly stale grease. Also, the chicken wings were small (super) leading me to deduce that the chickens were swapped out for cornish hens. I don't remember my order being super expensive so maybe the prices are pretty reasonable. I was looking forward to my meal since so many people I know have raved about this place but no, not so much. Atleast I can say I tried it. Three stars for the polite and welcoming staff!!","alt=""3.0 star rating""",3,frenchys-chicken-houston,frenchys-chicken-houstonhttps://www.yelp.com/biz/frenchys-chicken-houston?start=20,Damica C.,"Miami, FL",5,31,196,,9/3/15,"Honey when I tell you this food was everything I needed in my life, goodness gracious.This is the best fast food/soul food I've ever had. I had chicken strips, French fries, sweet potatoe pie, & gumbo. It all taste like good home cooked food.Kudos to the restaurant owner, & these recipes.","alt=""5.0 star rating""",5,frenchys-chicken-houston,frenchys-chicken-houstonhttps://www.yelp.com/biz/frenchys-chicken-houston?start=20,Tapa D.,"Bellaire, TX",3,35,60,,9/12/15,"Yes, it is that good. Perfectly seasoned and perfectly fried ... this is really delicious chicken. I like my food fresh out of the kitchen so I always eat there on their patio. No hot sauce, no plate, uncomfortable seats, cars zooming by ... yet we enjoy every bit of it.Besides chicken, we also like the fries and sweet potato pie. Boudin has very nice seasoning ... but more rice than meat in it.","alt=""4.0 star rating""",4,frenchys-chicken-houston,frenchys-chicken-houstonhttps://www.yelp.com/biz/frenchys-chicken-houston?start=20,Simon C.,"Houston, TX",0,8,,,11/11/16,Good solid fried chicken at a reasonable price.,"alt=""4.0 star rating""",4,frenchys-chicken-houston,frenchys-chicken-houstonhttps://www.yelp.com/biz/frenchys-chicken-houston?start=20,Ele M.,"Arlington, TX",294,24,17,,9/6/16,"This was my first time eating at Frenchy's and it was good! The chicken was fresh and tasty. The fries were crispy which I liked! Loved the biscuits but I wasn't so crazy about the muffins. Overall, my experience was average.","alt=""3.0 star rating""",3,frenchys-chicken-houston,frenchys-chicken-houstonhttps://www.yelp.com/biz/frenchys-chicken-houston?start=20,J J.,"Houston, TX",1,4,5,,1/29/16,"Absolute bull****. Frenchys has fallen, BADLY! -Bite size wings-2 day old dirty rice w/ an odor-molded yeast rolls xtra cost I rude everyone not to spend your time & effort.","alt=""1.0 star rating""",1,frenchys-chicken-houston,frenchys-chicken-houstonhttps://www.yelp.com/biz/frenchys-chicken-houston?start=20,Cat N.,"Dallas, TX",1114,1376,1440,Elite ’17,12/5/14,"Ohhhhhh Frenchys!!! you are the bomb! I mean if fried chicken had a heaven, it'll be called Frenchys. One bite and you'll be hooked!!!! This is the best fried chicken of H-town! I got hungry on the way to the airport so I decided to get a few piece. The chicken was juicy on the inside and deliciously fried on the outside. It was both juicy and crunchy!!! I liked the wings more than the drumsticks but that's just me. I rather eat here than overrated Breakfast club that charges $16 for a few wings and a waffle. Outta their mind!","alt=""4.0 star rating""",4,frenchys-chicken-houston,frenchys-chicken-houstonhttps://www.yelp.com/biz/frenchys-chicken-houston?start=20,Abdulaziz A.,"San Antonio, TX",40,49,309,,2/7/16,This is my first time to be here in this area and in this restaurant. We came on Sunday around 4:30pm. The restaurant are crowded of people because they take long time to take the order. Overall i like it the food are delicious but the employee never smile and they are very slow. I love there french fries and fried chicken.,"alt=""4.0 star rating""",4,frenchys-chicken-houston,frenchys-chicken-houstonhttps://www.yelp.com/biz/frenchys-chicken-houston?start=20,Katherine W.,"Houston, TX",66,30,2,,8/28/16,"This location has always been my favorite. I've driven from Spring to 3rd Ward for this chicken once or twice (before I lived closer). Last week I stopped by after work for the famous 5 piece wing special. The lady at the window was a little unkept (noticeably dirty nails) but I didn't hold that against her of Frenchys. Got my food fast once I was at the window. Great! Got home (5 mins away) and was ready to eat as soon as I walked in. My entire box of chicken and fries were lukewarm at best. Nothing was fresh at all. Actually seemed to be old. I picked around and ate what I could. So unusual but so disappointed seeing as though I wasted calories on a less than perfect $10 box of chicken. I hope this isn't the new way because I love this place but I can't take chances with my money or my calories on cold, old chicken.","alt=""1.0 star rating""",1,frenchys-chicken-houston,frenchys-chicken-houstonhttps://www.yelp.com/biz/frenchys-chicken-houston?start=20,Kelly M.,"Medical Center, Houston, TX",22,17,21,,1/28/16,"I finally broke down and decided to try out Frenchy's food. The smell always permeates the Shopping Center parking lot and I have fried food on my brain but behave and get healthy stuff from the grocery store. Ok, so I ordered a kids meal which consisted of 1 fried piece of chicken, a thigh, French fries, biscuit and a drink. The options for this were a leg, thigh or wing, rice or fries and it comes with a roll but I swapped it for the biscuit. The biscuit comes topped with this honey butter and it was very good. It wasn't dry or hard. The fries were ok, salty but the seasoning on the were good. The fried chicken was fried crisp, it was juicy, a little oily, not much and the seasoning on it had a little spice & heat but it worked well together. Overall for $4.19 it was a good deal.","alt=""4.0 star rating""",4,frenchys-chicken-houston,frenchys-chicken-houston