URL,User Name,User Location,Friend Count,Review Count,Photo Count,Elite 17,Review Date,Review,Rating,Rating Extracted,Restaurant Extracted,Restaurant Extractedhttps://www.yelp.com/biz/molinas-cantina-houston-3?start=20,Taylor W.,"Houston, TX",30,35,16,,3/31/15,"This is tough. I grew up going to Molina's (The location we went to was off Buffalo Speedway where the HEB is now in West U). I loved it. My dad especially loved it. So many fond memories.After they tore down ""our Molina's"" we began coming to this one on Washington. The food was slightly different, the service was about the same (Our favorite waiter Jose transferred over). But after a few years I noticed a slight decline. The service has slowed down and the attention to detail is not what it once was. My family and I have a certain ""brand loyalty"" to Molina's that we will always have. But if I could give a few humble suggestions to the owners, speed up the service and adjust the food quality. Favorite foods at the restaurant: House Margarita, Jose dip, Ladies special, and of course the pecan cookies at the end!","alt=""3.0 star rating""",3,molinas-cantina-houston-3,molinas-cantina-houston-3https://www.yelp.com/biz/molinas-cantina-houston-3?start=40,Maria C.,"Austin, TX",49,3,1,,3/21/16,"My husband and I come here often for the strawberry margaritas & carne guisada (OMG) but sorta disappointed with Molina's today. Today there was no meat to be found in our bowl of carne guisada. We had tons potatoes, onions, bell pepper ect. but no beef. Hope that IF we decide to give the dish again, we won't be let down again.","alt=""1.0 star rating""",1,molinas-cantina-houston-3,molinas-cantina-houston-3https://www.yelp.com/biz/molinas-cantina-houston-3?start=40,Philip L.,"Houston, TX",1,9,1,,5/3/15,"I wanted to like this place but it was tough. There was no structure. We never received silver wear or napkins even after we had chips and salsa and the nachos-which were covered in carrots, still trying to figure that out. The house margarita tasted like water so we sent them back. Our waitress was nice enough to give us new ones on the house. We had a combination of two waiters/waitresses so it was hard to tell who was serving us. After the appetizers we decided to leave because the food wasn't all that great and we weren't impressed by the drinks eitherOverall the outdoor atmosphere was nice on a beautiful night, but I probably will not be returning here.","alt=""3.0 star rating""",3,molinas-cantina-houston-3,molinas-cantina-houston-3https://www.yelp.com/biz/molinas-cantina-houston-3?start=40,Mike H.,"Houston, TX",214,397,53,Elite ’17,9/5/13,"I most recently went here for dinner, but I have been here a few times for lunch. At dinner there is free valet parking which is convenient. After being seated we waited for a long time for our waiter to come and take our drink order. It took even longer for him to bring me my beer and my date's margarita. At the 30 min mark (without getting drinks) I asked my date if she just wanted to leave but she said we should stick it out. We started with the queso dip, it was good and was the highlight of the dinner. Well it is probably tied with the Negra Modelo I was drinking for the highlight of the dinner. I then had the Tacos ala Molinas or something like that. It is basically ground beef tacos, which I normally love. These were just too greasy. The grease was dripping off of them and I had some killer indigestion afterwards.Like I said, usually I have been there for lunch and it is totally empty. Then the service was considerably better.","alt=""2.0 star rating""",2,molinas-cantina-houston-3,molinas-cantina-houston-3https://www.yelp.com/biz/molinas-cantina-houston-3?start=40,Tyler H.,"Houston, TX",92,148,109,Elite ’17,9/1/14,"It was okay. Everything down here is very Tex Mex. looking for something like my favorite place from back home, Cebolla's, even las limas and Acapulco (Angola, IN) were great! But for now this will do. Great service and that is what makes or breaks a place in my opinion.","alt=""3.0 star rating""",3,molinas-cantina-houston-3,molinas-cantina-houston-3https://www.yelp.com/biz/molinas-cantina-houston-3?start=40,Vanessa J.,"Houston, TX",106,85,,,6/27/15,"My father-in-law loves Molina's, but I was not impressed. Even though we came after the dinner rush, it took 20 minutes for a server to come take our drink order (after my father-in-law went and got one) and then another 10 minutes for our actual waitress to finally show up. The salsa and green dip were not as good as other Mexican restaurants in the city. Our Jose dip arrived after some of the food and I thought it was over-hyped. You can get free queso with ground beef at Chuy's happy hour. I made the mistake of ordering the spinach enchiladas, which were really bland. I prefer the spinach and artichoke enchiladas at El Tiempo. I tried some of the other plates at the table, which were much better, but I don't think I'd ever come back here on my own.","alt=""2.0 star rating""",2,molinas-cantina-houston-3,molinas-cantina-houston-3https://www.yelp.com/biz/molinas-cantina-houston-3?start=40,Leila N.,"Houston, TX",137,88,75,,3/17/14,"Every time I'm hanging out with my friends Ryan and Kristy and we decide to go out to eat, we end up in the bar area at Molina's on Washington. This weekend I finally asked them what they love so much about it and they didn't have to think twice: It's laid back, there's always a table available, the wait staff is friendly and doesn't mind if you stay for hours, food is good and cheap, parking is easy, and the margaritas are strong. Plain and simple, for lunch, drinks, or a casual dinner, the bar area at Molina's is pretty cool.","alt=""4.0 star rating""",4,molinas-cantina-houston-3,molinas-cantina-houston-3https://www.yelp.com/biz/molinas-cantina-houston-3?start=40,Big Ken L.,"Houston, TX",1,27,7,,8/31/14,"Average, Average, Average - with all the great Mexican restaurants in Houston this one is well known and has the reputation. And do to this wonderful rep we drove in from the suburbs to find average to bland food - kind of water downed Mexican food you find at a cheap chain restaurant - think the Chili's of Mexican restaurants.Service was slow to non-caring , please dont get me wrong we got are food and drinks but nobody likes to think you bothering your waiter by being there.Bloody Mary's were good but small - the margaritas average at best We wont be back- too many other great Mexican Restaurants in the area","alt=""2.0 star rating""",2,molinas-cantina-houston-3,molinas-cantina-houston-3https://www.yelp.com/biz/molinas-cantina-houston-3?start=40,Lillian D.,"Seattle, WA",182,121,144,,1/31/15,"Came for lunch and dinner. Great both times. Baja fish tacos, beans and rice, chips and salsa, beer or margarita. All good. Some places don't do fish tacos well, but these are yummy! Would try something else if they weren't so good.","alt=""4.0 star rating""",4,molinas-cantina-houston-3,molinas-cantina-houston-3https://www.yelp.com/biz/molinas-cantina-houston-3?start=40,Travis J.,"Houston, TX",1,18,3,,4/4/16,"Always a good meal! If you like a spicy chicken mole, then this is a great place to go. Margaritas are good, but small, and their two salsas are delicious. An extra bonus, most nights there is not a wait, so reservations aren't needed.","alt=""5.0 star rating""",5,molinas-cantina-houston-3,molinas-cantina-houston-3https://www.yelp.com/biz/molinas-cantina-houston-3?start=40,Stephen B.,"Houston, TX",140,12,,,8/5/15,"I have yet to go here in the evening for dinner but it's close to my work so this is one of my favorite lunch spots. So far, every time I've been my experience has been very pleasant. The staff is always nice and hospitable. The managers also go out of their way to make sure everything is fine while I'm there. The food is always very good. I'm definitely going to stop by in the evening if I'm every on this side of town during that time. It just hasn't happened yet. But for lunch, I'm completely satisfied.","alt=""5.0 star rating""",5,molinas-cantina-houston-3,molinas-cantina-houston-3https://www.yelp.com/biz/molinas-cantina-houston-3?start=40,Reggie E.,"Washington, DC",0,17,5,,8/29/14,"The Queso and Margaritas were good; however, the service was not good. The bartender apparently, knew one of the customers at the bar who was an old coworker and spent that time talking to her. By the time he came to me an hour and a half later, the kitchen was closed. I don't live in TX, but I am from the area and when I want Mexican food, this is where I prefer. I think this speaks volumes to restaurant owners and their need to be attentive to customer service. This location is not the best, PLEASE GO TO WESTHEIMER LOCATION!","alt=""1.0 star rating""",1,molinas-cantina-houston-3,molinas-cantina-houston-3https://www.yelp.com/biz/molinas-cantina-houston-3?start=40,ms p.,"Houston, TX",0,17,,,8/10/16,awesome!!!! these guys are the best. i called in an order for p/u and. they gave me more than expected. like the best southern candy ever-prailines. they didn't have a to go box for my drinks but the mngr allowed me comp. queso-jose special. u gotta gotta gotta do an office lunch or hh there. hey guys i'll be back!!!!!,"alt=""5.0 star rating""",5,molinas-cantina-houston-3,molinas-cantina-houston-3https://www.yelp.com/biz/molinas-cantina-houston-3?start=40,Bad B.,"Houston, TX",0,3,,,3/6/16,"Once my goto weekend spot, now it seems that Molina's Washington is on its last pierna. It's been painfully obvious over the last few months that they have had staffing issues, and when they no longer had the patronage to support the valet, well, that was the sign of its inevitable demise. Not even the regulars are returning. My prediction is that it will shudder before Cinco de Mayo. Adios, my old friend. You will be missed.","alt=""2.0 star rating""",2,molinas-cantina-houston-3,molinas-cantina-houston-3https://www.yelp.com/biz/molinas-cantina-houston-3?start=40,Megan O.,"Houston, TX",181,30,,,5/26/15,"Just what you expect for a mexican restaurant on washington, fun atmosphere and good food. It was very ""come as you are"" and delicious food. The margaritas are strong and the salsa is spicey! I got the ladies special and the pricing was great and I still had more than enough food.","alt=""3.0 star rating""",3,molinas-cantina-houston-3,molinas-cantina-houston-3https://www.yelp.com/biz/molinas-cantina-houston-3?start=40,Lisa F.,"Cypress, TX",110,10,,,2/14/15,"The service here was terrible. Our server, Jose, asked us if we would like a top shelf margarita and I wish I would have asked how much they were. I was thinking $11, tops. We got three margs and it came out to $51. I'm sure a regular top shelf isn't $17 and he just punched in whatever the hell he wanted to. He was slow and barely spoke to us. The food wasn't anything special and he got one of our orders wrong. We will not be coming back.","alt=""1.0 star rating""",1,molinas-cantina-houston-3,molinas-cantina-houston-3https://www.yelp.com/biz/molinas-cantina-houston-3?start=40,Monica R.,"Houston, TX",1,9,,,2/2/15,"The Jose Dip was not as good as advertised, more like Rotel and beef which I could have done at home. My husband had the mole enchiladas they were ok as were my chicken flautas. Our waiter Armando was horrible had a attitude the whole time, came to our table a few times only to get drink order, drop off, get food order and drop off, the lady giving us chips and refills came by more often than he did. Would not recommend anyone going here, I would rather eat at Taco Cabana before I go here again.","alt=""1.0 star rating""",1,molinas-cantina-houston-3,molinas-cantina-houston-3https://www.yelp.com/biz/molinas-cantina-houston-3?start=40,Wassim N.,"Montrose, Houston, TX",1,3,,,5/8/15,"The service was good but not the food. Our server was very nice. It took long time to get our food. The manager came by and apologized which was very nice and professional. However, after waiting too long for the food, the portion was very little. The meat was cooked good but as if they only gave me 2 small spoons of rice and beans!! especially that we had to wait too long. The other thing I noticed is that if your server is busy, no one else can offer you a refill of your drink. I think they need to make the try runner to offer refills as well when the server is busy. I might consider going there but for sure not soon.","alt=""2.0 star rating""",2,molinas-cantina-houston-3,molinas-cantina-houston-3https://www.yelp.com/biz/molinas-cantina-houston-3?start=40,Kenneth H.,"Houston, TX",2,42,3,,1/23/15,"There's so much parking in the back, but it's all for valet parking. Pretty annoying of you ask me, had to park by some graffitied building and walk. The food was good and the hostess was nice, the guy walking around the restaurant was obnoxious though probably a manager or owner. Have fun finding a place to park","alt=""3.0 star rating""",3,molinas-cantina-houston-3,molinas-cantina-houston-3https://www.yelp.com/biz/molinas-cantina-houston-3?start=40,Carole B.,"Houston, TX",5,19,2,,12/12/12,"This review pains me deeply. You see, I have been a Molina's addict ever since,well forever. The Margaritas that packed a wallop, the chili gravy that was unparalleled and the friendly, welcoming service that made you feel at home, or better. Then once upon a time, Molinas opened their Bellaire location (after the Buffalo speedway closure) and everything fell apart at Washington. It's like once they opened in Bellaire, they raped and pillaged the Washington location. They took the best waitstaff (actually they took most of the waitstaff) and the management is practically nonexistent but the management that remained is incompetent and rude.So the straw that broke the camels back? Husband Bruce and I went Sunday night for our Sunday Mexican food ritual. Place was nearly empty. Ordered frozen Margaritas which were completely melted. Waitpersongoes MIA after delivery of these messes and is nowhere to be found. We return Margaritas to the bar ourselves in exchange for FROZEN Margaritas which we are given. Bruce orders 2nd Margarita midway through meal and same issue. Margarita Meltdown. Tells waitress, she says she will talk to manager. Manager (who has been scarce all night) comes over and accuses us of trying to return the same Margarita we ordered earlier. (and why should we have to explain ourselves anyway?) We tried to explain this was round 2. He was rude and abrasive but agreed to bring Bruce another. By that point we had lost the desire to stick around and just told waitress to bring the check. To their credit they comped the drinks but we weren't even expecting or wanting this. We did expect to be treated like good customers in a place where there appears to be a shortage of any customers.Mind you, we have been patronizing Molinas for 13 years. Both the Buffalo speedway location and then the Washington location. We were familiar faces in this restaurant. We were willing to put up with the valet parking which I hate, simply because we liked the place.Molinas is going to be off the rotation for now. They need to do better or just shut the doors and be done with it. It almost seems that is the plan because the place is practically dead every time we go. I guess it's El Tiempo, Los Tios and El Patio (Club No) from here on.","alt=""2.0 star rating""",2,molinas-cantina-houston-3,molinas-cantina-houston-3https://www.yelp.com/biz/molinas-cantina-houston-3?start=40,Travis F.,"Houston, TX",19,18,4,,5/8/14,"I don't know why anyone would bother going here with how many better options there are within blocks. The salsa is nice and spicy, but everything else was plan and bland. The margarita was just ok too. I will definitely not be back since you can throw a rock from the front door of this Molina's and hit 3 or 4 better tex-mex places.","alt=""2.0 star rating""",2,molinas-cantina-houston-3,molinas-cantina-houston-3https://www.yelp.com/biz/molinas-cantina-houston-3?start=60,Crystal F.,"Manvel, TX",32,37,3,,6/24/14,"Stopped in for lunch with 4 coworkers. Service was great, food was tasty and we were given Mexican pralines for dessert. I had the grilled chicken and veggies. Wonderful seasoning and open flame flavor!","alt=""5.0 star rating""",5,molinas-cantina-houston-3,molinas-cantina-houston-3https://www.yelp.com/biz/molinas-cantina-houston-3?start=60,Laura K.,"Houston, TX",0,16,,,1/24/16,"So sad. We used to go here all the time when they first opened and it was great. We haven't been in a long time so we thought we would try it. The first thing we noticed was no valet. Look, I am not a snob but that is not a safe place to park yourself. Then, it was dead inside. We got a booth and were ignored! When we finally go service, it was AWFUL. The service, the food, even Jose's Dip is bad now. What happened to this place? We won't be going back.","alt=""1.0 star rating""",1,molinas-cantina-houston-3,molinas-cantina-houston-3https://www.yelp.com/biz/molinas-cantina-houston-3?start=60,Tina T.,"Houston, TX",214,32,71,,8/6/14,"Server Armando was great,house margarita's are strong but good. We had the fajita's and they were good, no complaints. Fridays are hit or miss on being packed with a wait.","alt=""4.0 star rating""",4,molinas-cantina-houston-3,molinas-cantina-houston-3https://www.yelp.com/biz/molinas-cantina-houston-3?start=60,Mark M.,"Houston, TX",120,258,227,,5/28/13,"The last time I was here was for their month-long anniversary celebration. Every day, they would do their ""back-in-the-day"" lunch specials...charging you the value of your meal in ol' skool prices. Even with a normal lunch special, the pricing is good and the waitstaff is friendly. I've only been to this location at lunchtime and they tend to get super busy...the best bet is to go right when they open if you need to be back at work within the hour...The highlight of the decor is the water fountain that greets you at the door.....","alt=""3.0 star rating""",3,molinas-cantina-houston-3,molinas-cantina-houston-3https://www.yelp.com/biz/molinas-cantina-houston-3?start=60,Thomas D.,"Houston, TX",191,19,4,,10/6/13,"HEADS UP: Apparently the kitchen closes at 9:15 on Sundays.This coming from the waiter the hostess leaned over and asked. If you're open till ten, take people in the last hour. I know it sucks for the kitchen and it sucks for front of house but it's what we all do. Whoever runs this place needs to have a talk with their staff.","alt=""1.0 star rating""",1,molinas-cantina-houston-3,molinas-cantina-houston-3https://www.yelp.com/biz/molinas-cantina-houston-3?start=60,Lucy M.,"Houston, TX",0,20,,,11/11/15,Fajitas and Ritas last Wednesday were above average and flan was decent -- however the wait staff and service were excellent -- a BIG hats off to all the staff and valet guys for letting our mini family reunion last three hours and go a few minutes pass closing - our apologies as we totally lost track of time. Your extra patience in letting us stay late enabled us to make our mini reunion event even more memorable. FIVE stars to ALL the staff !!,"alt=""4.0 star rating""",4,molinas-cantina-houston-3,molinas-cantina-houston-3https://www.yelp.com/biz/molinas-cantina-houston-3?start=60,Ali V.,"Houston, TX",16,124,4,,8/4/14,"I've been to Molina's a few times, and I always have enjoyed my meal. It is not my number 1 Tex Mex place in Houston, but it is definitely in my top 5. The Jose's Dip is absolutely delicious and hard to not fill up on. I would recommend this place if you're in the area and craving Tex Mex!","alt=""4.0 star rating""",4,molinas-cantina-houston-3,molinas-cantina-houston-3https://www.yelp.com/biz/molinas-cantina-houston-3?start=60,Sonia M.,"Austin, TX",14,7,1,,9/4/13,"We were sitting on the outside patio and the service was really slow. It took about 35 minutes to actually order and then when we got the food the meat in my enchiladas was really tough. The best part though are the sopapillas. If you go you HAVE to get them they are amazing.","alt=""2.0 star rating""",2,molinas-cantina-houston-3,molinas-cantina-houston-3https://www.yelp.com/biz/molinas-cantina-houston-3?start=60,George N.,"Houston, TX",0,13,1,,9/22/14,"Two great dishes, otherwise average options. Want a lighter meal? Then try the campechana. The shrimp is in a mild/spicy sweet sauce with just the right hot to sweet balance. You could make a meal out of this. My friend says that, if he had a choice, this would be his last meal; it is that good. Want a more filling option? The carnitas are tender and well-seasoned with a salty crust. Either option could be spooned onto chips and shared with a friend. Don't forget to try the pickled carrots that come with the chips. Called cortida in parts of Mexico, the carrots are firm and provide a satisfying hit of vinegar.","alt=""3.0 star rating""",3,molinas-cantina-houston-3,molinas-cantina-houston-3https://www.yelp.com/biz/molinas-cantina-houston-3?start=60,Cheradan N.,"Houston, TX",11,22,,,4/13/12,"Food was barely average Tex Mex. I ordered the Deluxe Dinner. Lots of food, but it wasn't all that great. I think I can remember being more satisified with Taco Smell. My husband got the Burly Burrito. It looked good, but it's wasn't quite as ""burly"" as it should have been. It was about the size of a fat enchilada. Joined their e-club. Received a free jose dip. It was good. Kind of. Melted velveeta with a tiny scoop of ground beef. No spices, no nada. Just melted queso cheese. Service really wasn't very good. When you ask for something three times (green sauce), and still don't get it....what does that tell you? In addition to my tea not being refilled even once? I'm not terribly picky. I'll eat generally whatever you put in front of me, but when you don't refill my tea....we have problems. No thanks, Molina. Won't be back...ever.","alt=""2.0 star rating""",2,molinas-cantina-houston-3,molinas-cantina-houston-3https://www.yelp.com/biz/molinas-cantina-houston-3?start=60,Leon G.,"South Main, Houston, TX",0,24,5,,4/27/14,"Excellent service, bad food. My wife and I ordered Cancun Shrimp and Carne Asada. Shrimp was pretty good, but rice was soggy, enchiladas were tasteless, and my Carne asada steak - which was supposed to be tender, was so rough that I only had a few bites and, after 10 minutes of chewing, gave up.","alt=""3.0 star rating""",3,molinas-cantina-houston-3,molinas-cantina-houston-3https://www.yelp.com/biz/molinas-cantina-houston-3?start=60,Carolyn K.,"Harris, TX",31,97,60,,6/21/11,"Came here on a Sunday afternoon so I managed to find a parking spot in the back parking lot rather than on the street like my friends that came 5 minutes after me had to.I didn't know they had green sauce here or why I never bothered to ask before, but they do. They only serve upon request as they only make so much / day... or however often they make it.The five stars is mostly for our server, Travis. He was nice, fun, & very attentive. I really never request a server (in a restaurant), but if I come here again I will ask if he is working.","alt=""5.0 star rating""",5,molinas-cantina-houston-3,molinas-cantina-houston-3https://www.yelp.com/biz/molinas-cantina-houston-3?start=60,Nicole M.,"Houston, TX",161,12,2,,3/15/14,"The food and drinks are pretty good, but the service can be quite slow","alt=""3.0 star rating""",3,molinas-cantina-houston-3,molinas-cantina-houston-3https://www.yelp.com/biz/molinas-cantina-houston-3?start=60,Katie R.,"Austin, TX",1,19,2,,11/8/13,"As a Molina's patron for over 20 years (Westheimer location), I am very sad to write this review. My husband and I recently moved nearby, and I have excitedly dragged him to this restaurant many times. Unfortunately, the ""fluke"" mishaps with drinks and food have become more of a regular occurrence. I sent back an entree twice for the first time in my life tonight. I usually am not so high maintenance, but I let the mixed up order go the last two times we came. Come on Molina's, help a sister out! I have brought so many new customers with me to this location, and most have left apathetic or disappointed. This never happened at the Westheimer location.My family loves Molina's so much, we order quarts of Jose's dip and salsa at Christmas and other holidays every year. This past year, I drove all the way to the other location because I was worried this one would mess it up. My parents gave me $250 in Molina's gift cards in my stocking last year, this is how much I love you.But I'm starting to lose respect from my foodie friends, I have to stop bringing people other than my husband here. Please Washington Molina's, I'm begging you - make things better so I can keep coming! My husband has finally given up, and I don't know if I can go it alone. Please.","alt=""2.0 star rating""",2,molinas-cantina-houston-3,molinas-cantina-houston-3https://www.yelp.com/biz/molinas-cantina-houston-3?start=60,Denisse M.,"Houston, TX",79,36,12,,10/29/13,I'm usually a fan of Molina's and let's be honest it's really hard to mess up Mexican food. I was rather disappointed I had hyped it up to a friend and we ended up with bad service and bad watery margaritas. I def will think twice about returning.,"alt=""2.0 star rating""",2,molinas-cantina-houston-3,molinas-cantina-houston-3