URL,User Name,User Location,Friend Count,Review Count,Photo Count,Elite 17,Review Date,Review,Rating,Rating Extracted,Restaurant Extracted,Restaurant Extractedhttps://www.yelp.com/biz/molinas-cantina-houston-3?start=60,Allegra G.,"Houston, TX",149,29,4,,12/24/11,"I have been coming here for years and still love the place. Leydi and Manuel take care of us almost every time we come in - they are awesome. The service we get is always fantastic. Jose's Dip is delish - it is the first thing I ever had here and I get it every time we come. I love the cheese enchiliadas - the cheese doesn't get greasy like at some restaurants - and the gravy is delicious. But sometimes I like to do the taco salad - the best I have had at local mexican restaurants. Berly's Burrito is tasty too - love the meat gravy on top! We also like the fajitas or tacos al carbon. Margaritas are good and definitely pack a punch. We like to sit on the patio - which luckily is pretty nice most of the year. Simple and delicious food, reasonable prices and fantastic service keep us coming back time after time. Check it out. (And while the parking lot does fill up in prime time, you can either valet or park in the neighborhood behind - just don't leave anything in your car that might tempt someone to break in. We haven't had any issues, but the neighborhood has.)","alt=""5.0 star rating""",5,molinas-cantina-houston-3,molinas-cantina-houston-3https://www.yelp.com/biz/molinas-cantina-houston-3?start=60,Greg B.,"Virginia Beach, VA",0,31,20,,12/29/14,We live round the corner from this place and never visited as there are so many other choices nearby on Washington for great mexican & Latin food. But always wondered why it 'seemed' busy but had such a poor yelp rating. Now having been I know why. Uninspiring menu (no chimichanga at a mexican restaurant?) food was served so quick no way had it been cooked fresh and the looked and tasted like that too. Our server was more interested to go home than serve we felt as when we called him over to order more drinks he brought us the check.,"alt=""2.0 star rating""",2,molinas-cantina-houston-3,molinas-cantina-houston-3https://www.yelp.com/biz/molinas-cantina-houston-3?start=60,Ryan H.,"Houston, TX",16,61,19,,8/25/13,"Pedestrian and basic/predictable in decor. The staff are very nice. Chips are hot and the salsa is smoky and fresh. Having gone to the westheimer location growing up and tex mex locations all over town, I prefer molinas over the much hyped El Tiempo or Escalantes, both of which served me bone dry fajita chicken that was unacceptable at an equally unacceptable price.","alt=""3.0 star rating""",3,molinas-cantina-houston-3,molinas-cantina-houston-3https://www.yelp.com/biz/molinas-cantina-houston-3?start=60,J H.,"Houston, TX",20,26,4,,10/11/13,I have found that I don't love this place. The food is so so and the service is just okay. The drinks are not even nothing to write home about,"alt=""3.0 star rating""",3,molinas-cantina-houston-3,molinas-cantina-houston-3https://www.yelp.com/biz/molinas-cantina-houston-3?start=60,Cynthia R.,"Spring, TX",18,3,,,1/31/15,This is our favorite Tex-Mex. We drive down from The Woodlands because we can't get better. The combo fajitas with whole wheat tortillas are my staple. The skinny margaritas are the best I have had and I have tried a lot.,"alt=""5.0 star rating""",5,molinas-cantina-houston-3,molinas-cantina-houston-3https://www.yelp.com/biz/molinas-cantina-houston-3?start=80,Katie W.,"Houston, TX",84,314,1,Elite ’17,6/19/11,"I came here with a Groupon and was surprised to find such cheap prices, we actually had to order an appetizer to hit the $30 limit. The service was amazing. Our orders were taken promptly, the chips were replenished when needed and waters were refilled before they even needed to be. The salsas are so-so, the vinegary one is very interesting, but the chips are what stood out, light and crisp. We left armed with a big to-go box and happy that we have another Groupon to use this coming summer.","alt=""4.0 star rating""",4,molinas-cantina-houston-3,molinas-cantina-houston-3https://www.yelp.com/biz/molinas-cantina-houston-3?start=80,Dana S.,"Houston, TX",3,21,,,8/27/13,"Great location in a trendy area. Service was horrible. The server might have been new or something but was confused when we ordered a Red Bull. The on the rocks margaritas tasted like gasoline so I ordered a frozen thinking it would be better. Nope. It was just as bad. Fajitas were good but our order was all messed up. Stuff was ordered but not received. Long story. Will not return.","alt=""2.0 star rating""",2,molinas-cantina-houston-3,molinas-cantina-houston-3https://www.yelp.com/biz/molinas-cantina-houston-3?start=80,Greg F.,"Houston, TX",549,327,48,,7/10/10,"Today, I decided to put the car in drive, head for wherever and just let the Houston roads take me. Today, that lead me to Washington and just as I crossed Shepard, I see a Cantina! Yum! I love me some Mexican food, so in I go. Apparently, there is a language gap here -- I don't speak Spanish and the person manning the ""welcome to the Cantina"" doesn't understand English. I drum up enough words for Uno Table Por Favor and still I get the RCA dog look -- what you talkin' about Willis look. She signals for another person to come over and I say table for one please, -- and I get seated.I wasn't out for a gigantic meal, so i thought I'd stick to the appetizer section -- and got the taquitos. So, while I waited, I can see that this is actually two sections --a dining area and a bar area. Naturally, the bar area was the noisy section and the large entry way provided just the right amount of acoustics to make it sound like there was a rock concert going on in there. So, out comes the food -- apparently ""small"" taquitos are the way they serve them here, and apparently chicken is the new beef, as I ordered beef and got chicken. Oh well. The taquitos were served with sour cream and their chili queso dip -- and yum! That queso dip is GOOD. So, I nom nom on the taquito's for a bit, then decided to get the check. It arrives, but they charge me for a drink I never ordered. So, I get them to fix it and out I go.3 stars for the food, 2 for the ambience (noise), 3 for the service and 2 for the incorrect check. Meh, 2.5 stars is more accurate, but they don't get a 3, so 2 it is :)","alt=""2.0 star rating""",2,molinas-cantina-houston-3,molinas-cantina-houston-3https://www.yelp.com/biz/molinas-cantina-houston-3?start=80,Susannah L.,"Houston, TX",128,96,110,,3/16/11,"Yikes. May need to rethink this one.Location: great! On Washington, spacious in the inside, cool patio but pray for parking or just valetFood: not that impressed. Didn't care for the chips and salsa, had the stuffs bell pepper and 'took it home' so I could throw it out. Oh yes, I had to pull 'the full'. Meaning act like I was full so I could move on to the next one.Service: great! I feel so bad that I was so unsatisfied with the food! I thought the service was great which is the ONLY reason I gave this restaurant better than bad rating.Tips: make sure to tip the server based on the service, they can't do anything about the flavor of the food!","alt=""2.0 star rating""",2,molinas-cantina-houston-3,molinas-cantina-houston-3https://www.yelp.com/biz/molinas-cantina-houston-3?start=80,Michael C.,"Houston, TX",44,18,2,,7/9/13,Great place with Houston style tex mex.. This is a family run family style restaurant that happens to be on Washington Ave. so don't let the location fool you. Also this place is secretly one of the best places to watch a high profile game.,"alt=""5.0 star rating""",5,molinas-cantina-houston-3,molinas-cantina-houston-3https://www.yelp.com/biz/molinas-cantina-houston-3?start=80,Michelle W.,"Austin, TX",169,82,2,,3/11/11,"I try to scoot by this Molina's location anytime I am in Houston. If my favorite server (Manuel) is there, I know we are in for a good experience. My favorite meal is the combo #2 which comes with a beef taco, bean chalupa, and cheese enchilada. Just the right size! The queso is okay, the salsa is tasty, and their mango margaritas are fantastic! Parking can be a problem if you attempt to park in the lot across the street. Though it is designated for Molina's and Max's, if the stalkerish (and very rude) tow-truck guy doesn't see you jay-walk across Washington and enter Molina's, he will tow you. Yes, even if you simply walk to the left ... to the crosswalk ... and THEN go to Molina's. If I can find the name of that company, I'll write a separate review about them. HOWEVER -- our waiter (Manuel) and the manager (Jimmy) noticed our issue and, because we had been at Molina's for at least an hour, Jimmy had our car brought back to the establishment. Lesson here? Either park in front, use the lot in back, or use the free valet when they are offering it. That said, the friendliness and attentiveness of the staff has always been excellent during my visits, and I am quite a fan of the food.","alt=""5.0 star rating""",5,molinas-cantina-houston-3,molinas-cantina-houston-3https://www.yelp.com/biz/molinas-cantina-houston-3?start=80,Jacob R.,"Houston, TX",0,2,,,12/5/12,"Automatic pilot service turns casual dinner into disaster. This place fits the Washington corridor perfectly with its bland food, doe-brained staff and completely inept parking. First off, the parking is Valet only, giving the impression the restaurant may be packed, when in fact it is less than half full. If not for our persistence, this may have been a blessing to discourage us from eating at Molina's. I ordered the cheese enchiladas and twice they handed me plates with beef. Each time I explained that I am a vegetarian, and that I explicitly ordered cheese enchiladas. After the second plate, I confessed to the waitress that I did not know what to order at that point - and that I would just like something without meat on it.The manager then delivers me the third(!) plate of food and for some insane reason, he felt like it was appropriate to ask me ""Hey are you allergic to beef or something?""No, asshole, I've been a vegetarian for TEN years. F&%* Molina's.","alt=""1.0 star rating""",1,molinas-cantina-houston-3,molinas-cantina-houston-3https://www.yelp.com/biz/molinas-cantina-houston-3?start=80,Tex M.,"Houston, TX",9,193,46,,6/28/11,"UPDATE: The new location on Holcomb is open, and you can get a Jose Dip fix closer!!!!!I miss theBuffalo Spwy location, but this one will do until they build a new one closer..The Jose Dip is absolute heaven in a bowl(ask for a side of Pico De Gallo to stir in)I usually go with the Deluxe Dinner to get a nice selection of my favorite TexMex foods!","alt=""5.0 star rating""",5,molinas-cantina-houston-3,molinas-cantina-houston-3https://www.yelp.com/biz/molinas-cantina-houston-3?start=80,Ryan S.,"Ithaca, NY",35,170,10,,6/21/10,"""You want your negro modelo on the rocks?"" Wait...what??? So, we had some communication issues..no worries. Turns out they actually ran out of negro modelo anyways...and no I don't want my pacifico on the rocks.I had the baja fish tacos. Size was good. Plating was weird. They put all of the dressing at one end of the taco--aesthetically pleasing? Yes. Annoying to eat? Yes. I had to disassemble the taco flipping one piece of the fish end-over-end and moving some of the red cabbage around to spread around the dressing...and in general it was too much of the stuff.And their spicy salsa left much to be desired. It tasted like the packet of salsa that comes in those old el paso taco kits. In the end, the Yelp description of two-stars nails it again: ""Meh. I've experienced better.""","alt=""2.0 star rating""",2,molinas-cantina-houston-3,molinas-cantina-houston-3https://www.yelp.com/biz/molinas-cantina-houston-3?start=80,Mitchell P.,"Houston, TX",156,158,3,,6/15/10,"I've been here several times for lunch and it is pretty much the go-to place for our office when we want to do mexican food. What keeps us coming back is the consistently good food and great service. They offer the typical mexican food dishes (enchiladas, fajitas, carnitas, etc) and the portion sizes are fairly large. Despite always going in a large group, they always refill our chips and drinks before we run out or request more. The only deterrent is parking (small lot in front/back and limited, narrow street parking).","alt=""3.0 star rating""",3,molinas-cantina-houston-3,molinas-cantina-houston-3https://www.yelp.com/biz/molinas-cantina-houston-3?start=80,Jack H.,"Houston, TX",137,362,124,,4/22/10,"Molina's has a great location on Washington, and makes a great spot for dinner before heading to the bars. The restaurant itself is spacious, with a large bar area to one side, as well as a nice covered patio out front. The patio however is rather on the small side, so it can be pretty tough to get a table out there on a nice day. Regardless of where you sit though, the food is always consistently good, if unremarkable. I tend to go for the Fajitas or Tacos al Carbon, but since this is such a convenient location, we actually come here quite a bit, and I've tried a number of their offerings.On the downside, I didn't particularly care for their Tortilla Soup - a thick puree without the large chunks of chicken and avocado I'm used to at almost every other Mexican place I've been to. On the plus side, however, I was pleasantly surprised how good their Grilled Fish Tacos were. Flaky white fish in a corn tortilla topped with grilled corn pico de gallo - excellent.The margaritas are ok, but you can't go wrong with a Mexican cerveza for a warm evening out on the patio - if you can get a seat.","alt=""3.0 star rating""",3,molinas-cantina-houston-3,molinas-cantina-houston-3https://www.yelp.com/biz/molinas-cantina-houston-3?start=80,Pierre H.,"Richmond, TX",62,106,13,,2/8/10,"Been here twice now and I have pretty much got the same impression about the food and service both times. I had the Carnitas and the Tacos al Carbon. The carnitas were good and provided me with everything i wanted that night. The place were they really out did themselves was the tacos al carbon. The meat by itself was really flavorful, almost to flavorful. But when you put it together with all the fixens, it made my taste buds do a jig. I think that might have be the best I had ever had. The area they lost points with me was the margaritas. The first time i had them I couldn't get enough of it. But this last time, it seemed like it was weak and watered down. So maybe next time I'll get a great one again.","alt=""3.0 star rating""",3,molinas-cantina-houston-3,molinas-cantina-houston-3https://www.yelp.com/biz/molinas-cantina-houston-3?start=80,Omar K.,"Houston, TX",20,116,8,,10/14/12,One of the best Mexican Resturants in the city. My family has been coming to Molina's Resturants since before I was a born. I am glad they opened this location. The jose dip and their tacos are what they are known for. Also if you are a lightwight...go easy on the margiritas.,"alt=""5.0 star rating""",5,molinas-cantina-houston-3,molinas-cantina-houston-3https://www.yelp.com/biz/molinas-cantina-houston-3?start=80,Jed B.,"Galveston, TX",8,239,13,,8/4/12,"I judge a Tex Mex restaurant by the quality of their chili gravy. And this one excels. The service was great. This was my first time and I had a combo plate. The taco fell apart and had nothing but meat and a little lettuce. The queso was a tortilla fried in a muffin cup and turned upside down with queso poured over it. Not too excited, but the enchilada and the tamale were excellent. I'll be back and try something more exciting. My friend had the guisada and it was a little disappointing. Going to go for the green sauce. I'd love to find some green sauce like I get in Santa Fe.","alt=""4.0 star rating""",4,molinas-cantina-houston-3,molinas-cantina-houston-3https://www.yelp.com/biz/molinas-cantina-houston-3?start=80,Richard A.,"Houston, TX",30,60,4,,8/16/12,Stopped in for a Margarita. size was small but it packed a punch!,"alt=""3.0 star rating""",3,molinas-cantina-houston-3,molinas-cantina-houston-3https://www.yelp.com/biz/molinas-cantina-houston-3?start=80,Rachael M.,"Dallas, TX",238,447,109,,1/11/10,"Really I'm between 2 & 3 stars here. The location is good, the setup is alright, & there is a nice big bar & patio area. Mainly, I think my time here just left me w/that ""meh"" feeling & I'm not really concerned whether or not I get to visit again. That is never a good sign in my book.We had a bit of a large party, but we were seated fairly quickly. Our table was stuck in a corner, however, & made moving around (even to go to the bathroom) nearly impossible without bumping into another table. Our servers were alright, but they always seemed to disappear for long periods of time. Our drinks ran dry more often than not & trying to get our checks taken care of was an act of Congress.Foodwise, the salsas were tasty, though I liked the spicy one the best (anyone shocked?). I wasn't crazy about the queso - too velveta-like for my tastes. For dinner, I ordered the tacos al carbon with chicken, which came with rice & beans, of course. My dinner was alright, but nothing stood out as particularly wonderful or with a distinct flavor. I wasn't really impressed by the margaritas, which were small & weak considering the price. Clearly, the whole food experience underwhelmed me greatly. Not my favorite mexican place around, though I'd probably give it another shot if it comes up again.","alt=""3.0 star rating""",3,molinas-cantina-houston-3,molinas-cantina-houston-3https://www.yelp.com/biz/molinas-cantina-houston-3?start=80,Den C.,"Houston, TX",8,2,,,4/21/13,"The fajitas are fabulous when you get all the vegetables cooked with them. They serve some sauce on the side that I could just drink. I don't like being charged SO much for a tiny side of sour cream and cheese - the upcharge on those items seems unfair. However, the margaritas make up for it. This is my favorite place to go sit on the patio and drink margaritas with the missus on Saturdays. Oh, and i have found that if you can get one of the waitresses you'll get better service. The male servers seem to take too long and not check back nearly enough. I'm always wanting or needing something, and usually end up just saying, ""well, screw it, I'm full now"".I go back, so they must be doing something right.","alt=""3.0 star rating""",3,molinas-cantina-houston-3,molinas-cantina-houston-3https://www.yelp.com/biz/molinas-cantina-houston-3?start=80,Angel F.,"Houston, TX",167,141,4,,12/29/11,"It has taken me forever to write this review. I've been to a couple locations and overall, I'm not that pleased with Molina's. In my opinion, the food is average and the service is lacking. I was so unimpressed that I haven't visited a Molina's restaurant in over two years.","alt=""1.0 star rating""",1,molinas-cantina-houston-3,molinas-cantina-houston-3https://www.yelp.com/biz/molinas-cantina-houston-3?start=80,Crystal A.,"San Diego, CA",14,50,5,,5/29/12,"After reading the reviews on Yelp we decided to try Molina's on Washington for dinner on a Friday night. Based on the reviews we thought service might be slower (which we were fine with), but the services was some of the fastest we have experienced! We were seated immediately, orders taken, and our food came out so quickly we almost thought it was too fast! All of our food was amazing with huge helpings. We ordered the Jose dip because of the recommendations on Yelp and enjoyed it, but I would say the best thing on any of our plates was the fajita meat that was in the Taco Al Carbon. The meat was extremely tender and had a great smoky taste to it. All in all we enjoyed everything on our plates and left completely stuffed. We recommend Molina's on Washington to everyone we know!","alt=""5.0 star rating""",5,molinas-cantina-houston-3,molinas-cantina-houston-3https://www.yelp.com/biz/molinas-cantina-houston-3?start=80,Ty D.,"Houston, TX",42,384,,,3/11/12,"My initial experience with Molina's was just so-so, and perhaps it's just a reflection of the fact that I now live within a few blocks of the place, but Molina's has really grown on me. The chips and salsa are some of the best in the city; the enchiladas and tacos al carbon are consistently good, and it's easy to wash everything down with a cold beer or margarita. Service is generally good, even when the place is packed. I can't give 5 stars, but Molina's is solid, and always worth the occasional visit.","alt=""4.0 star rating""",4,molinas-cantina-houston-3,molinas-cantina-houston-3https://www.yelp.com/biz/molinas-cantina-houston-3?start=100,Melissa B.,"Houston, TX",14,21,,,7/23/09,"Dude. Don't go to Molina's. Although the food is edible and the patio is somewhat decent if the Houston weather is in your favor, I couldn't bring myself to give this place more than one star. It's a Tex-Mex place in HOUSTON and it's lame. Molina's has crappy service, weak margaritas, mediocre food, and it's the same price as El Tiempo. If you really can't stand the crowd at El Tiempo, then I would suggest El Pueblito, La Mexicana, the original Ninfa's, Cafe Adobe....you get the idea. But, I mean, just go to El Tiempo. Seriously. It's worth the wait.","alt=""1.0 star rating""",1,molinas-cantina-houston-3,molinas-cantina-houston-3https://www.yelp.com/biz/molinas-cantina-houston-3?start=100,Eren M.,"Austin, TX",252,89,317,,2/18/09,"Came here with my girlfriends on a recent evening when it had been raining cats and dogs outside. I had suggested Max's Wine Dive next door, which I've been dying to try, but my girlfriends insisted on margaritas so I gave in to Molina's. Finding parking was a bit hectic, I almost had to fight someone to get a spot close enough so we wouldn't get drenched in the rain. When we made it inside there wasn't a waiting line, except for a man who looked anxious to get his to-go order. We waited to be seated.....stared at the water fountain in the entrance....then waited some more....oh here comes someone...it was a waiter, he smiled, kept walking, umm okay, kept waiting.... finally the man waiting on his to-go order went and got someone to help him, who in turn helped to get us a table. Not a good start to our dinner, but we were hungry. We ordered fajitas, a chicken/beef mix, which tasted typical. We also ordered a round of their signature Molina margaritas, which were smooth and crept up on us. Our waiter was attentive and kind, his service somewhat made up for the lack of attention from the hostess. Overall, I thought everything here was simply satisfactory.","alt=""3.0 star rating""",3,molinas-cantina-houston-3,molinas-cantina-houston-3https://www.yelp.com/biz/molinas-cantina-houston-3?start=100,A G.,"Chinatown, Houston, TX",1,38,4,,1/28/14,"A Houston staple. Go for Jose's dip and drinks. There's better Mexican down the street. Entrees are hit and miss. One day, the cheese enchiladas are very Tex Mex. the next, it's akin to a frozen dinner.","alt=""2.0 star rating""",2,molinas-cantina-houston-3,molinas-cantina-houston-3https://www.yelp.com/biz/molinas-cantina-houston-3?start=100,Alex R.,"Bellevue, WA",161,219,36,,3/12/09,"Goodness no, with a blah!Ok so we came here on a wed night.... a night where it is not so busy... or is it a night when the waiters are just lazy? It took too long to get seated, too long for our waiter to take our order, too long for us to get our food and too long for us to get our check. My food was super blah, super bland and I had to add a whole lot of salsa and caso just to make it taste ok. The meals are not cheap and you do not get that much food at all. I was very disappointed and the only reason why I gave it 2 stars is because the my friends fajitas were not bad.I don't want to come back here when there are so many other places that are fantastic around this area.","alt=""2.0 star rating""",2,molinas-cantina-houston-3,molinas-cantina-houston-3