URL,User Name,User Location,Friend Count,Review Count,Photo Count,Elite 17,Review Date,Review,Rating,Rating Extracted,Restaurant Extracted,Restaurant Extractedhttps://www.yelp.com/biz/tonys-houston-2?start=120,Bryce K.,"Houston, TX",11,144,8,,2/26/13,"I came here with the girlfriend for Valentine's Day. I thought the experience overall was pretty good, but there are definite areas for improvement. And yes, the dinner did burn a hole in my wallet.We started with ordering a bottle of wine with the sommelier's help - he was great and very helpful. We got the Duemani Altrovino, which was fantastic and thankfully not insanely expensive.For the first course, she got fettuccine and I got a dish called caramelli - I liked both, and thought mine was very good. It was rich and cheesy. Excellent.Second course: She got the crab and lobster salad, which was so-so. It was all fresh, but just wasn't exciting.I got the lobster bisque, with a little sherry added. Really, really good.Third course:She got the braised beef short ribs while I got the filet mignon of lamb. Her dish edged mine out slightly, but I was still happy with my lamb, perfectly cooked to medium. For dessert, we each received the plate with a mini key-lime pie (great), chocolate mousse/cake thing (okay), and cheesecake (pretty good).Service seemed a bit rushed; it was often hard to catch someone's eye to get more water, but we got a lot of bread. Weird. I was also not a big fan of the table set-up. We were seated against a wall, seated together on the bench with the table pushed in. It made for a good view of the dining room, but I was sorta hoping to watch my date the entire night, not waiters rushing to and fro.Music: The biggest negative. It ranged from horrible rock music to horrible dance/pop/disco, or something like that. The music was too loud and horrific.It totally clashed with whatever 1) Tony's should be about and 2) what Valentine's Day at Tony's should be about. Basically, it ruined the mood and ambiance. Tony's: remember the name Bill Evans, download his jazz albums, and play them softly. That's the mood you should be setting.","alt=""4.0 star rating""",4,tonys-houston-2,tonys-houston-2https://www.yelp.com/biz/tonys-houston-2?start=120,Sanjay M.,"Brooklyn, NY",27,10,,,2/6/15,Fantastic experience - service and cuisine. Italian ingredients with a very modern and nuanced approach - some micro-grastronomic techniques but still recognizable hearty feel. Highly recommended. Service was bar none.,"alt=""5.0 star rating""",5,tonys-houston-2,tonys-houston-2https://www.yelp.com/biz/tonys-houston-2?start=120,Austin T.,"Sugar Land, TX",0,11,,,11/29/14,"Stick to going here on weekdays and on a special date on weekends. Avoid Tony's on Valentine's Day...not the same level of service and your date really won't feel all that special with 50 or more other couples that are there that night. Any other day, Tony's is a special place. My favorites are the steak, any pasta with truffles and a couple of different types of soufflé (just remember to order it ahead of time).","alt=""4.0 star rating""",4,tonys-houston-2,tonys-houston-2https://www.yelp.com/biz/tonys-houston-2?start=120,Magda S.,"Houston, TX",2,49,37,,10/19/12,"Stuff happens ... but some people handle touchy situations better than others.I had contacted Tony's GM, Mr. Scott Sulma, a couple of days ago to ensure that I would be handed the check for lunch today, not my guest. I have not met him but via e-mail he assured me my server would grant my request.From the beginning, Ms. Donna Vallone approached our table and greeted me and my guest. How delightful and unexpected. But aside from Ms. Vallone's special touch, our server was ready for us--no need to wonder when anyone was going to help.We were not made to rush, so we took our time ordering.Our meals were superb, and throughout our meal, our server and others, including Mr. Vinny Montecuollo, checked on us to make sure all was well and we were enjoying our meals. I enjoyed the seared sea bass; and my guest, the tuna tartar, both from the lunch menu.After our lunch, my guest and I sat and conducted business. She departed, and when it was time to pay our bill, I discovered I did not have my billfold. I had no ID, only my word that I would pay my bill. I was distressed and disclosed this fact to the individual who handed me my check. He nonchalantly stated that sometimes that happens. He asked I wait a moment, so he could apprise his superior about the matter.Mr. Vinny Montecuollo approached me and, without hesitation, set me at ease by telling me to take breath, to relax. I verbally gave him my address, but that didn't matter. He asked for my phone number and told me to drive home carefully; then to call in a credit card number. His kindness and consideration floored me. Who am I? A stranger who walked in to have lunch at this elegant establishment.I calmed down and sat and thought for a moment. I remember being on a trip and taking a picture of the cards (including my ID) I would be carrying in my pocket for the day. I perused my photos and discovered I had a picture of the card I wanted to use to pay for the meal. I proceeded to write it onto a piece of paper and handed it to the gentlemen who was responsible for collecting my payment.Done.But I truly, truly appreciate that Mr. Montecuollo proved to me that accepting one's word alone to complete a business transaction (gentlemen's agreement) is still alive today.Thank you ever so much.","alt=""5.0 star rating""",5,tonys-houston-2,tonys-houston-2https://www.yelp.com/biz/tonys-houston-2?start=120,Emily L.,"Houston, TX",68,34,48,,8/23/14,The food was good but be aware the menu price doesn't match the final price. We ordered two pasta dishes that said $16 on the menu but it come out to be $26 each when the bill came. The waiter/manager was extremely rude. NOT FRIENDLY. Can get better service at Chick Fila!,"alt=""3.0 star rating""",3,tonys-houston-2,tonys-houston-2https://www.yelp.com/biz/tonys-houston-2?start=120,Shari S.,"Houston, TX",79,243,711,,8/13/10,"From all the reviews of high-end restaurants that I've read so far on Yelp, Tony's seems to engender the highest degree of angst (ie. ""we're not River Oaks kind of people but we wore nice clothes to dinner at Tony's and were surprised that how well they treated regular Joe's like us""). C'mon folks- why be intimidated by people whose job it is to ""wait"" on you? In other words, they work there. You don't.Anyhoo, given that it was Houston Restaurant Week and I'd never been here before, I rounded up some girlfriends for a Friday night dinner at Tony's. After we were seated, at least 4 waiters swarmed around to place napkins in our laps, offered an assortment of breadrolls, asked us what we'd like for an aperitif, told us the truffle special of the evening, etc... When one of my friends ordered a $20 glass of Veuve Cliquot, the frenzied circling of our table increased until..... DRUMROLL... we asked for the HRW menu. There was an uncomfortable silence from our servers who slunk away to a neighboring table who'd probably just ordered a bottle of Screaming Eagle Cab. As would become shortly and oh so abundantly clear, those words instantly transported us to ""Dining Siberia""! Upon the mention of the presumably déclassé HRW menu (read: you cheapskates), our cadre of waiters dispersed and all that was left was a hapless fellow who resignedly took our HRW order (and insisted that we order all 3 courses from the get-go. Nice.) When we asked if they had NZ Sauvignon Blancs on their wine list, he pretentiously announced that ""Mr. Vallone is only concentrating on French, Italian and California wines"". Wanting to comply with Mr T's three country wine edict, we ordered a 2008 bottle of Sancerre. At which point we were told, ""Are you sure you want to order that? It is our last bottle"". And your point is?As for the food, we all had the ""Lasagnette"" to start which consisted of dry-ish free form lasagna which had done a significant amount of time under the kitchen heat lamp. Once we were done chewing on dried out pasta sheets, our main course of Veal Scallopine with sauteed tomatoes and a fried artichoke swiftly appeared. It was room temperature - I guess there was no more room left under the heat lamps. Once we polished off the veal, like a cuckoo clocking striking on the hour, our pre-ordered desserts arrived. I had a slice of Praline Cheesecake which was decent but honestly, it was no better than something I could have purchased from Randall's. Our check arrived 5 minutes later and after paying approximately $80/pp for very mediocre, pre-prepared food, we were on our way to the valet stand.As you can probably tell from my review, HRW diners get short shrift at Tony's of which I'm mildly resentful. One deserves better from paying a $80/pp tab. Hence, next time I'm in the mood for Italian, I'll go to Giacomo's or Dolce Vita instead. Basically anywhere but here. Thumbs down, Mr. T.","alt=""2.0 star rating""",2,tonys-houston-2,tonys-houston-2https://www.yelp.com/biz/tonys-houston-2?start=120,Steven M.,"San Francisco, CA",969,102,,,1/10/14,"when I recently visited Houston, I hit my old stomping ground, Tonys.Service was excellent food excellent and even some of the wait staff were from when I used to go often. They came up and remembered me even though I had not been in 3 years. felt like old times in Houston","alt=""5.0 star rating""",5,tonys-houston-2,tonys-houston-2https://www.yelp.com/biz/tonys-houston-2?start=120,Elissa S.,"Houston, TX",176,38,4,,12/11/15,"After much hoopla picking out a restaurant for 5 Physician clients (plus spouses) we settled on Tony's. I made a point to tell the waiter that I would take the check. Appetizers were delicious. Wine choices were great. I had the Tony's Filet and it was delicious. It was cooked to perfection and by far the most tender and flavorful steak I've ever had. The entrees were enjoyed by all. My only complaint is regarding the service. It seemed very unorganized. I had the wrong wine poured in my glass and the bar drinks seemed delayed. I found it very distasteful that at the end of the meal the waiter walked up to me loudly and asked if anyone wanted dessert and proceeded to suggest the soufflé for 12 people. I mean at that point what do you say in front of your clients? At $165 for soufflé that I found VERY subpar I was a little annoyed. The bill was almost $2,000 so I suppose I expected more class from such a fine establishment. Outside of that the food was delicious. Worth a try on a special occasion.","alt=""4.0 star rating""",4,tonys-houston-2,tonys-houston-2https://www.yelp.com/biz/tonys-houston-2?start=120,Kris Z.,"Houston, TX",0,9,3,,12/18/15,"Great food but seriously overpriced. I go to high end restaurants all the time. And I mean all the time. But what prompted me to give them 2stars instead of 5 is I had asked them for a risotto last night. Simple risotto. Might cost $15. Overpriced but no big deal. He asked me to choose between two kinds. One of them being a truffle risotto. I said sure. Never tried truffle before so what the heck. Well he failed to mention to me that this tiny dish of risotto with a sprinkle of truffle (and I mean a sprinkle) on it cost me $95 dollars. That is absolutely ludicrous. You can get a Japanese wagyu beef 4oz filet at Killens steakhouse for that price. Not cool what they did to me. I have never ordered anything truffle before, being informed of the expensive cost of it would've been nice. Needless to say, I'll never go back for this reason. Sorry tony. You should tell ur waiters they need to discuss the price of certain items on the menu","alt=""2.0 star rating""",2,tonys-houston-2,tonys-houston-2https://www.yelp.com/biz/tonys-houston-2?start=120,Alison C.,"Houston, TX",56,16,31,,8/5/11,"*** HRW Review *** On a scale of 1 to 10 (10 being the highest).Food: 7.5Service: 7.5Atmosphere: 8.0 (Dinner)Overall: May recommend. The architecture, interior design, and the artworks help set this place apart from the other restaurants. It is also versatile in the sense that it has different sections (bar, dining area, and private rooms) for any occasion. The servers were professional but I wouldn't describe them as friendly or warm. The ""Ribbons & Squares"" (Bluefin tuba, avocado, soy lime vinaigrette) was my favorite of the night. Crisp roast duckling was good but it didn't blow me away. The purple rice was seasoned very nicely but a bit hard. It also had raspberries on the side which I guess is like having cranberry sauce with turkey. For dessert I opted for chocolate souffle (+$8) since I've read some reviews that raved about it. In the end...I was left wondering if I should have ordered cheesecake instead.P.S. It took them about half an hour and three attempts to figure out how to split our bills correctly (granted we didn't split them evenly).","alt=""3.0 star rating""",3,tonys-houston-2,tonys-houston-2https://www.yelp.com/biz/tonys-houston-2?start=140,Rick K.,"New York, NY",52,75,9,,9/24/13,"My review is purely for lunch. Great place to have a business lunch or a casual celebration. The prices are definitely not for your average work lunch. The decor is plain to me but the abundance of natural light is great. To start, I think any place that serves bread to start should also serve soft butter that is easily spreadable. Tony's delivered and off I went on the assortment of carbs. We ended up ordering both the Seafood Gumbo and Tomato Basil, the soup of the day. Both were fine but neither stood out. The entrees are what has me giving this place such good ratings. If you're thinking about a salad, don't hesitate and go with the Wyatt Salad. I know it's expensive but it's worth the price! There was more fresh seafood on the plate than there were greens. The mangos in the salad were extremely fresh and ripe. The dish was delicious, fresh, big, and full of seafood. You will understand why it's $29 when you start eating it. I didn't get to try the other entree, but my colleague ordered Three Graces with 3 pieces of well prepared fish that he enjoyed very much.I live nowhere close to Houston or Texas so the likelihood of me coming back is slim. However, if I ever came again for lunch, it would be very hard for me to order anything but the Wyatt salad.","alt=""5.0 star rating""",5,tonys-houston-2,tonys-houston-2https://www.yelp.com/biz/tonys-houston-2?start=140,Iana I.,"Houston, TX",179,181,27,,5/19/12,"Their valet listened to music in our car. Normally I couldn't care less, but it was changed to a different station which made it super obvious. You know when you were a kid and randomly decided to walk into your mom's bathroom and play with her makeup you'd be super careful to leave it the way it was before so she wouldn't notice and you wouldn't get in trouble? I feel like if you're going to listen to music in my car as a valet, then please just pretend to try to cover it up and change it back to the original station when you bring the car back to me.I probably wouldn't have even mentioned this if I had enjoyed my experience here, but considering the service and food, I will be as picky and judgmental of every fault at this establishment.At the beginning, this place had set itself up for a 4 star review. I had made a reservation and mentioned that we had a symphony concert to attend at 7pm, so we needed to be out by 6:30pm. When we walked in, they seated us quickly and when I gave them my last name they immediately realized I was the one that had a time constraint and had to be out within 1.5 hours (which shouldn't be terribly hard to do, i would think -- and neither did they at the time of booking).This is where the up and down (mostly down) of the dining experience started.We came in with a coupon I got on Google Offers. I guess I didn't read carefully and thought the $40 for $80 tasting menu was for two people, not one. I take full responsibility for that. I will NOT take responsibility for the fact that the rest of the time we felt like we were being a little bit judged / ignored after I pulled out the coupon. Minus 1 stars.The portions were European sized. I actually usually like it when a restaurant gives normal-sized portions like that. But if you're going to bunch three 1-inch diameter, 1/4-inch thick medallions in the middle of a 12-inch diameter plate and charge $18 for it... then at least do a little dance for us or have a live quartet playing in the background. I don't understand how restaurants can get away with that. Minus 1 star.Later through our dinner, our waiter asked my boyfriend and me if it's prom time. And, since I graduated high school 7 years ago, I said I wasn't sure. In part, this is a compliment that we both look so young (boyfriend's been out of school for 9 years). On the other hand, I was slightly offended because of the insinuation that it must be because of our age that we came in with a coupon. Meh. Minus 0.5 stars.I decided to get the flounder. I had never had flounder before but I thought my first experience would probably go best if I got it at a $$$$ place. And I have to say I was not disappointed at all. I now have a top two types of fish: sea bass and flounder. Plus 0.5 stars for giving me that good first flounder experience.The dessert was the one part of dinner that was American sized. For the amounts they charge and the overall snootiness of this place, I would have expected much better dessert. Don't get me wrong, it was good. But I think I prefer La Madeleine's tuxedo cake over Tony's. No points lost, just disappointing.Now it was already 6:23pm by the time they had brought us the dessert. They were cutting it a bit close to getting us out by 6:30pm, but I still had faith in them. But when we finally got someone's attention again, they said our assigned waiter (who we had given our coupon to) had an emergency and had left abruptly so they couldn't ring us up. Well, I'm sorry for your incompetency, but you knew full well we had to be out by 6:30 and now it is 6:42 already. Get with it. (I didn't say this out loud to them; just mumbled it to my boyfriend, instead.) Anyhow, after them alternately coming over to ask us if we'd found the coupon in our emails using our phones and ignoring us to serve the very, very rich people around us, we finally walked out at 6:58pm. Minus 2 stars.Thank you, Tony's, for allowing us to miss the first half of Carl Orff's ""Carmina Burana."" Without you, I may have actually enjoyed my night out.(And yes, that was sarcasm.)","alt=""1.0 star rating""",1,tonys-houston-2,tonys-houston-2https://www.yelp.com/biz/tonys-houston-2?start=140,Molly S.,"Houston, TX",218,81,10,,8/18/12,"Came here for lunch for two on a Tuesday, and it was crowded! We arrived around 11:30 (restaurant opens at 11), and there were not that many people. But when it was around noon, the restaurant was completely full. Say what? It'll probably be best to make reservations. :)ENVIRONMENT:Omygoodness...this place is so, so, so elegant. The bread is set up like little flower pots. When I first saw it, I thought it was a decorating piece. Then I realized you can actually eat it...Haha. Even the butter was pretty....Most ""upscale"" restaurants have dim lighting. TBH, I'm not a big fan because what's so romantic about not even seeing the face of the person you are eating with? Well, Tony's has a really bright and colorful interior. Plenty sunlight gets in through the large windows, so you can see your friends' face bright and clear. :)SERVICE:Sooooo there are about 50 waiters here? No joke. Someone came to my side before I even opened my mouth asking for something. Tony's, why is your service so good? The manager even came and personally served us like we were Royal guests. Best service I've ever had in a restaurant, hands down. So attentive to every customer. Filled my water cup after each sip...Haha, just joking. But seriously, phenomenal service.FOOD:We got the business express lunch ($21/person) with 3-course meal! You get the option of two soups, 3 entrees, and 2 desserts. I had the tomato basil soup, and it was alright. My entree was steak, and it was pretty good. Not the best, but hey, what can you expect with a $21 3-course meal? My dessert, however, was SO good. We both got the cheesecake, and wow...so, so rich. BUT this is just the business express lunch. We peeked at the OTHER side of the menu with REGULAR food prices...and the price/dish is around $40/each. Tony's is known for its steak, and one of its steak dish was $97. =O I'll come back if I'm a millionaire. Haha. So if you want to come here for regular meal, be prepared to send some $$$$.PARKING:Valet only. Because remember that you are Royalty. I first thought I arrived at the wrong restaurant because everyone walking into Tony's were successful businessmen in well-tailored suits, so I stupidly asked the valet guy, ""Is this Tony's?"" when he was clearly wearing a Tony's shirt. Haha...doh!Hooray to cheap(er) business express lunches! =D","alt=""4.0 star rating""",4,tonys-houston-2,tonys-houston-2https://www.yelp.com/biz/tonys-houston-2?start=140,Adam M.,"Houston, TX",4,16,,,7/5/15,"I want to start off by saying that Tonys used to be one of the best restaurants in Houston; last week our office went as far as renting out the wine room for a private dinner. Big mistake choosing Tonys. There is a big reason this restaurant in the past few years is becoming regulated to an after thought of the greenway plaza area. Under seasoned, over priced and under proportioned with a wait staff that just really doesn't know what their serving you or anything more than saying a soufflé will take forty five minutes to prepare. I had hopes that Chef Kate would have elevated this restaurant to more than the sad state it currently resides. The 55 day aged strip taste like failure.","alt=""1.0 star rating""",1,tonys-houston-2,tonys-houston-2https://www.yelp.com/biz/tonys-houston-2?start=140,Bo Y.,"Houston, TX",996,446,259,,5/9/12,"Talk about fine dining, this is probably the best I've ever had. The food is phenomenal. I got the duck here once and I didn't expect much more than just well cooked duck, but I could've never imagined how delicious that duck was. It was beyond delicious. Entrees are about $60-$90. Appetizers are $15-19.They also have over 1100 wines in stock including a 1700's French wine for $13000. They are also one of the few restaurants in Houston who carries Louis XIII Cognac.Service 100+, Decor 95. Come here for the experience!","alt=""5.0 star rating""",5,tonys-houston-2,tonys-houston-2https://www.yelp.com/biz/tonys-houston-2?start=140,Celeste F.,"Houston, TX",70,30,2,,9/16/12,"This place is gorgeous, amazing food, couldn't ask for better service.... But DAMN it's expensive.Plan on spending $200 per person if you drink wine and order apps, steak, sides, and desert.","alt=""4.0 star rating""",4,tonys-houston-2,tonys-houston-2