URL,User Name,User Location,Friend Count,Review Count,Photo Count,Elite 17,Review Date,Review,Rating,Rating Extracted,Restaurant Extracted,Restaurant Extractedhttps://www.yelp.com/biz/tonys-houston-2?start=160,Dominique C.,"Washington, DC",0,2,,,11/30/14,"I dined here for my mother's birthday and experienced very poor service. Our table was positioned way too close to the adjacent table, and the servers continually insisted on squeezing between my chair and the chair behind me to serve the other table, with the result that during my meal, servers were reaching over my head to pour water and wine for the table behind me, and putting their hands on the back of my chair to squeeze themselves through a tiny space, thereby moving my chair over and over and over again as I tried to eat. Even after we complained to management, the problem persisted, because the servers still kept putting their hands all over my chair (and even touching my hair) instead of walking around the tables in a way that made sense and would have avoided any disruption. The diners at the other table were so appalled that they even apologized to us! Then, our tone deaf server brought out my mother's birthday cake when one of our family members was in the bathroom, so he missed the sparklers and getting to see my mother's reaction. And when my mother ordered a glass of champagne and it never arrived, we were duly unimpressed. The brussel sprouts were excellent, but good food that is very expensive, when combined with poor service, cannot redeem an otherwise frustrating dining experience. I do not recommend this restaurant. For the price paid, I expected higher caliber service.","alt=""1.0 star rating""",1,tonys-houston-2,tonys-houston-2https://www.yelp.com/biz/tonys-houston-2?start=160,Destinee W.,"Denton, TX",99,163,20,,6/21/12,"As I started to write this review, my coworker who went with me to Tony's for lunch today called and said...""is it wrong that I am thinking about those rolls?"" Seriously! .......Those rosemary, olive rolls, were delicious, so was the perfectly cooked prime for the salad, as was the sea bass in all its crispy/ juicy goodness. The butter could be better, but really I am commenting on the butter.","alt=""4.0 star rating""",4,tonys-houston-2,tonys-houston-2https://www.yelp.com/biz/tonys-houston-2?start=160,Albert N.,"The Woodlands, TX",218,293,118,,2/2/09,"Truffles. That elusive ingredient that can transform an already excellent dish to another plane. Rich, earthy, musky, rare and delicious. We were having a craving for truffles, so we went to the place we knew would be offering them: Tony's.Tony's is the iconic Houston fine dining restaurant. It has been the preferred destination for the city's glitterati for many years, but some foodies grumbled that the cuisine was too staid, too traditional, too boring.In our experience, nothing could be farther from the truth. My guess is that these foodies have never dined at Tony's, and that is their loss.Tony Vallone is a master restaurateur, and he periodically reinvents the restaurant, making it fresh and new, but never gets caught up in the fly-by-night trends that tempt the less savvy host. And the Vallone touch is evident on every plate that exits the kitchen... this attention to detail is a key that separates Tony's from Houston's other fine dining establishments. The latest incarnation of Tony's resides at the beautiful Richmond and Timmons location that Tony's occupied after decades on Post Oak. Built from the ground up to Tony Vallone's exacting specifications, this dramatic setting was the backdrop for our truffle degustation.Executive Chef Francesco Casetta's kitchen is firing on all cylinders, and created a variety of dishes that flowed together like movements in a symphony. Several featured the ethereal truffle as an ingredient.We started with a simple Tortelloni Bolognese - housemade pasta stuffed with three cheeses and draped in Tony's superb bolognese meat sauce. The flavors are bold yet smooth, and this dish warmed up our senses for the upcoming courses.Next was my favorite appetizer - Paglia e Fieno. A deceptively simple dish featuring fresh ribbons of green and white tagliatelle, drizzled with a light cream sauce and accented with thin slices of fresh black truffles. Simple and superlative.We then tried something more exotic - Tagliarini with Sicilian Sea Urchin. Smooth strands of tagliarini were tossed in a light creamy sauce of pinot grigio and alba mushrooms, and mixed with chunks of sea urchin. The dish was surprisingly spicy; the heat was balanced by the creamy pasta. It was something we'd never experienced before, but would gladly order again.Our final appetizer is one we can rarely pass up at Tony's - the Japanese-influenced Ribbons and Squares. Fresh, sushi-grade blue fin tuna prepared two ways: perfect thumb-sized cubes, and thin, pasta-like ribbons formed into a cylindrical shape. The tuna is accented with fresh avocado puree and a tangy soy-lime vinaigrette. We love sushi, and the balance of this dish speaks to a bright future if the Vallones ever decide to open a sushi bar.After these delicious entrees, it was time for the main course. More truffles were called for, so we ordered the rich Stuffed Truffled Filet of Beef. This may be the best steak in the city - a large, thick filet of USDA Prime beef, naturally aged for 40 days, and stuffed with black truffle butter. The truffle flavor infuses the beef, and the combination is greater than the sum of the parts.On the side we asked for the oven-roasted truffled potatoes and the decadent truffled macaroni & cheese. These side dishes accented the steak very nicely, and we were awash in the aroma and flavor of truffles.We barely had room for dessert, but missing the souffle at Tony's seems like a crime. This time we selected the rich bananas foster souffle, which was a delightful finish to an unforgettable meal.Sadly, my waistline won't tolerate a meal like this every day, but I'll be looking forward to the next gastronomical adventure at Tony's. The restaurant never disappoints.","alt=""5.0 star rating""",5,tonys-houston-2,tonys-houston-2https://www.yelp.com/biz/tonys-houston-2?start=160,Alan J.,"Austin, TX",0,121,12,,1/13/15,"Ridiculously overpriced. Simply not worth it, from the food to the decor/ambiance to the service. My $74 steak lacked any distinction and the crab topping was way too salty. The plates were thick and worn, and more suited to a gritty diner than one of the most expensive restaurants in Houston. The plate left an ashy dark 'skid mark' ring on the white table cloth. Some cheese from the macaroni and cheese splashed on one of the chairs as it was cleared from the table. What an embarrassment. Having said that, not as pathetic as Cafe Annie was. The plentiful money there buys very expensive wines but not much class.","alt=""1.0 star rating""",1,tonys-houston-2,tonys-houston-2https://www.yelp.com/biz/tonys-houston-2?start=160,Carrie B.,"Houston, TX",16,7,7,,8/31/12,"We started out with the truffles and fresh mozzerrella, which were amazing! They prepared the cheese tableside so it was fun!The rest of the food was from the HRW dinner menu:Ravolini: Very fresh tasting pasta and yummy corn sauce.Snapper: A little overcooked on the edges, but good nonetheless.Cheescake: Good hint of lemon flavor.The staff was very friendly. The wine list was a bit expensive, we had a good $90 bottle","alt=""4.0 star rating""",4,tonys-houston-2,tonys-houston-2https://www.yelp.com/biz/tonys-houston-2?start=160,jessy A.,"Chicago, IL",0,10,,,2/6/15,"Food was good but service was terrible. I went here with a group of girlfriends and the hostess and server made us feel like were 16 year olds on prom night! Extremely pretentious. We were given a hard time for not ordering an entree although we ordered multiple appetizers and pasta dishes to share. We were pressured to order the soufflé because ""we would likely still be hungry."" The soufflé was tasty but enormous! Beware of server ""Eric"" - very pretentious. As a visitor from NYC with every amazing option for food at any price point, I was disappointed at this Houston fine dining establishment.","alt=""2.0 star rating""",2,tonys-houston-2,tonys-houston-2https://www.yelp.com/biz/tonys-houston-2?start=160,Meg L.,"San Antonio, TX",72,54,1,,8/15/10,"Just because I dined during Restaurant Week doesn't mean I deserve second-rate service. Tony's' approach to Restaurant Week is the opposite of what I have experienced at other Houston restaurants. Every other place I have dined has been excellent in quality and service - in hopes that you will come back later and pay full price. Tony's seems to have the attitude that Restaurant Weekers don't have the $ to come back without the discount. Bad assumption. I have been to Tony's several times (not during Restaurant Week) and really enjoyed it, especially the soufflé. However, my Restaurant Week experience changed my mind and ensured that I will not be back. We had to flag down a waiter to give us menus (it seemed they forgot about us). We had to ask again for Restaurant Week menus even though we noted this with our reservation. The food was mediocre at best, and undercooked at worst. Three people at the table had the veal; the flavor was overpowered by the capers. I was the unlucky one that had the chicken that was underdone and made me ill. The bright spot in the whole experience was the praline cheesecake. It was fantastic. After dessert, we were ignored for another 30-40 minutes and had to flag down someone for the check.Tony's is a place to see and be seen. If you're looking for an overall great dining experience, take your money elsewhere.","alt=""2.0 star rating""",2,tonys-houston-2,tonys-houston-2https://www.yelp.com/biz/tonys-houston-2?start=160,Allie N.,"Houston, TX",217,161,9,,8/25/10,"This was one of the most anticipated spots for me to try out during Restaurant Week and I was really disappointed. Like another reviewer said, just because I'm dining off the Restaurant Week menu doesn't mean you should give me mediocre service. Every time I have dined at a 4 or 5 star hotel, I notice that the service is always a cut above a typical casual restaurant. The waitstaff go above and beyond and add in those special touches to show their exceptional service and training. Not the case here. I felt like the waiter just brought my my food and picked up my plates. That's it. There was no custom or personal service. I really expected a lot more from Tony's. As for the food, it was just okay. Portions are a generous size for a fine dining establishment. I probably wouldn't recommend getting anything I got (if you're curious, I had the mussels, red snapper, and cheesecake. Well, the cheesecake was good). If you are looking for a fine dining experience in Houston, there are dozens of other restaurants you can pick from.","alt=""3.0 star rating""",3,tonys-houston-2,tonys-houston-2https://www.yelp.com/biz/tonys-houston-2?start=160,Drew N.,"Houston, TX",15,12,2,,8/29/11,"One of the best dinners I've had in a long time. Service was great, food was amazing, ambiance was perfect. What else could you ask for?!My dinner started with a lobster appetizer: amazing, main course was Lamb Filet Mignon: AMAZING, desert was Nutella beignets: amazing. Some of my friends got the HRW items and they were great as well. Nothing bad i can say about Tony's. Just wish i would have just tried it out earlier because I always pass by the place!","alt=""5.0 star rating""",5,tonys-houston-2,tonys-houston-2https://www.yelp.com/biz/tonys-houston-2?start=160,Peter T.,"Oslo, Norway",96,250,65,,6/7/10,"Food: 3.5/5Ambiance: 3.5/5Services: 4/5Prices: $$$$ (avg 50/person)Finally, I thought I have kept the best for last, but alas, its much-ado-about-nothing... I reserved a table here a month in advance for our 1st Anniversary, I requested for a quiet table and informed them of our ""Special Occassion"".We arrived just on time at 7.30pm. Pulling into their main entrance to valet we already felt a little intimidated with all the expensive cars parked around the vicinity... As we walked in, we were the only 2 that were wearing ""business casual"", at least 90% of the patrons have suits or some kind. I'm aware of the dresscode here but just testing the water and was surprised that they let us in... hehehehe, maybe coz they know we are celebrating...Anyway, we were seated in the middle of the restaurant, not so quiet after all with all the action going around us and servers walking behind me. Nonetheless, we felt quite welcomed! Here's the order of our evening:-- Cocktail --Ginger Blossom $12.50: Way too much Vodka Citron and not much of the ginger & citrus mixtures! I didnt finish it...Prosecco Royal $9: with Hibiscus Flower. Very refreshing and a great aperitif. Highly recommended!-- Appetizer --Hudson Valley Foie Gras $22: Recommended by the head-waiter. Chilled, its rich and soft but just cant beat the seared version where the taste and flavor comes out.Soft Shell Crab $15: Also a Recommended dish, claimed to be flown in fresh today. Its deep fried with thick breadcrumb coating... really, didnt do the crab justice. The coating tasted so greasy and heavy that I could not even taste the crab. Huge dissapointment!-- Entree --Veal Medallions $29: Two reasonable size, thick center cut beautifully seared medium rare medallions, still juicy and tender. Unfortunately, the accompaniment sauce was way too sour and just didnt work with the meat. What a let down...Roasted Duckling $32: THE BEST DUCK dish EVER! That says it all... This is a 2-serving order but they accommodated us due to the ""special occasion"". Just amazingly roasted crispy skin, tender not chewy nor tough, still slightly gamey but not overpowering yet very flavorful. Tony's really nailed this duck perfectly... A MUST HAVE!-- Dessert --Souffle $12/person: We saw too many tables ordering the souffle, so we were duped! We had the chocolate flavor with Grand Marnier. Honestly, I'm not a big fan of souffle, so, it was A-okay! We both didnt finish our dessert, instead we had quite a few of the steroid-induced (or apple-size according to my partner) strawberry... Surprisingly, they were quite sweet too. Each table gets a ""tree"" of strawberry with meringue and blob of cotton candy, I dont know why???So, whats our conclusion? Well, we came, we seen, we ate, we are DONE! Thanks Tony's for letting us in and served us like any other suits wearing millionaires. We are just a middle working class adventurous couple that couldnt and wouldnt fit into the stuffy over pretentious kinda place... However, if you want to see and be seen among the River Oaks folks and maybe some Houston's Forbes Millionaires, then this is the place to be! My final 2cents - Though Mark's of America is not as refined as Tony's, I will choose the former in a heart beat! Meantime, Masraff will be the next destination...","alt=""3.0 star rating""",3,tonys-houston-2,tonys-houston-2https://www.yelp.com/biz/tonys-houston-2?start=160,Mary S.,"The Woodlands, TX",4,16,,,12/31/11,"Absolutely amazing. No complaints. Tony's is wonderful from the word go.I have never had anything bad come from this restaurant.Dessert is AMAZING! Always make sure to order the chocolate souffle. Also, ask for some cotton candy whilst you're at it.They all bend over backwards to make sure every guest has exactly what they want, when they want it.This place has a dress code. So don't go dressed as a slob. They will not let you in.I can honestly say this is one of my favorite restaurants I have ever been to.","alt=""5.0 star rating""",5,tonys-houston-2,tonys-houston-2https://www.yelp.com/biz/tonys-houston-2?start=160,Chris R.,"Houston, TX",245,16,28,,6/15/13,"The atmosphere is one of the best in Houston, as is the service. The food is actually pretty good too. My reason for the lower rating is because the portions are tiny and over-priced. I spent almost $400 on two of us for my boyfriend's birthday dinner and we both left there hungry after trying the tasting menu. Also, there's an up-charge on almost everything. I don't mind spending money, I've spent far more on other restaurants, but I don't like feeling taken advantage of.","alt=""3.0 star rating""",3,tonys-houston-2,tonys-houston-2https://www.yelp.com/biz/tonys-houston-2?start=160,Victor S.,"Houston, TX",22,12,,,9/1/11,"Amazing food, excellent service, and nice ambience. Had the duckling (4 stars) and for desert some cheesecake which was fucking ridiculously good. Can we cuss on here? had to get my point across.Well worth the money.","alt=""5.0 star rating""",5,tonys-houston-2,tonys-houston-2https://www.yelp.com/biz/tonys-houston-2?start=160,Mary N.,"Pearland, TX",0,16,1,,5/12/12,"I made reservations tonight for my anniversary. My husband iscurrently handicap due to a recent surgery and unable to get pants on overhis cast. We spoke to the owner (Mr. Vallone) about an exception to thedress code and he told my husband that he is NOT handicap and we were askedto leave. I have never been so insulted and embarrassed in my life! Hesaid we were lying about being handicap and that our business is notwelcome there.","alt=""1.0 star rating""",1,tonys-houston-2,tonys-houston-2https://www.yelp.com/biz/tonys-houston-2?start=160,O B.,"Houston, TX",35,109,27,,9/15/13,"Upscale decor, lovely attentive staff.......other than that, I go every Friday for the ""girls"" lunch out (and that's only bc I am invited ;-).)","alt=""3.0 star rating""",3,tonys-houston-2,tonys-houston-2https://www.yelp.com/biz/tonys-houston-2?start=160,Gina W.,"Houston, TX",1,27,,,7/20/12,"Today is my husband's 50th birthday. He wanted to celebrate, so he made a reservation for Tony's. We arrived for our 7pm reservation and were seated immediately. My husband ordered a scotch and savored it as we visited. Then he asked for the menus and we got down to business. We each ordered the Burrata appetizer which is Pugliese Cheese, Texas Heirloom Tomatoes, Tomato Quiche, and Balsamic. It came with toast triangles that were the best part. It was FABULOUS! I ordered the Snapper Sheridan and my husband ordered the veal chop. We had sauteed spinach and mac and cheese as our side dishes. All was very delicious. You HAVE to get the mac and cheese. I could have just eaten that and the appetizer and been tickled pink! We had individual souffles for dessert. Mine was raspberry and my husband had the chocolate one. Both were very good, but I was stuffed by the time the desserts came. They bring a cute little plate of miniature cookie type desserts complimentary as well. Everything was outstanding. I would definitely recommend Tony's to my friends.The service was excellent. There were a ton of men filling water, offering bread, taking plates. They were very attentive. Our water glasses and coffee cups were never empty.I was less than impressed with the decor, but that is the least important part of the meal to me, so it was hardly worth mentioning. Ladies, it is very chilly in there. Be sure to take a wrap or a jacket/cardigan.","alt=""5.0 star rating""",5,tonys-houston-2,tonys-houston-2https://www.yelp.com/biz/tonys-houston-2?start=160,Katie W.,"Houston, TX",84,314,1,Elite ’17,4/10/08,"We were by far the youngest folks in the room, but that is fine by me. We were seated promptly and given the option of a banquette or a table, the banquette was just straight across, so you were sitting right next to each other, quite an odd set up and definitely not for me. Love that they give you time to settle in before handing you a menu and that the specials are printed out daily on their own separate menu. The wines by the glass selection was wonderful, they even had a great Brunello as an option.I opted to start with the lobster bisque and try the flounder special. Hubby had the short ribs ravioli and the Osso Bucco. The bisque was overwhelmingly rich and I shouldn't have eaten the whole bowl, but I did, making me too full to finish my flounder. They gave us the option of preordering a souffle for dessert, which we did because we had seen them go by earlier and they looked amazing. I think everyone in the place had the souffle. The Osso Bucco was perfectly done and the presentation of the huge steak knife was wasted, it didn't need one at all. I was too full of the bisque to try the truffle mac n' cheese, but I have some to try in my take out container.The ginormous souffle arrived with fresh berries on this metal tree sculpture, with sugar, whipped cream and chocolate sauce. They plated us each a piece of the souffle and took the other half away. I wonder what happens to all the half eaten souffles? Does the staff get to enjoy them? They cannot possibly be thrown out, can they? There was a whole lot of wasted souffle going around.I nearly forgot my to go of my flounder because they leave it at the front desk for you, right as we got into the car my husband remembered and retrieved it for me. So now I have flounder and crabmeat for lunch today...yum!Only one odd thing from the evening, the first person who placed my napkin on my lap came uncomfortably close to groping me. It was the strangest thing.","alt=""5.0 star rating""",5,tonys-houston-2,tonys-houston-2https://www.yelp.com/biz/tonys-houston-2?start=160,Liz H.,"Houston, TX",3,15,,,9/7/11,"Came here with a group of friends for Houston Restaurant Week. Tony's is an old restaurant in Houston, they have colorful lit orbs outdoors that are hard to miss, yet none of us had ever been there. There was enough of us to try everything on the HRW menu as well as a couple a la carte items. Pretty much EVERYTHING we had was delicious - and that includes the complimentary bread. I rarely go to a restaurant that I feel hits the mark on everything, but they truly did. Service was phenomenal. The duck breast was cooked perfectly, the skin was crispy and the meat was moist. Off the menu, we ordered the lobster as well as lamb filet mignon. The lobster was good, but not the best I've ever had. However, I had never heard of lamb filet mignon before in my life, and it was AMAZING. One of the best cuts of meat I've ever had.We also sprung for the individual souffle with peach topping, and I am NOT a big dessert fan, but I made sure to lick that plate clean. This easily became one of my favorite restaurants in Houston overnight.","alt=""5.0 star rating""",5,tonys-houston-2,tonys-houston-2https://www.yelp.com/biz/tonys-houston-2?start=160,Eric C.,"Houston, TX",42,45,,,2/17/10,"Like the movie ""Speed II"", this restaurant has been a victim of hype. The food is decent, but does not live up to public consensus or the price. We ordered the duck dumplings, pan seared scallops, ribeye and some unmemorable desert. The duck dumplings tasted like it was out of a 'Hungry Man' TV dinner platter, over-sauced and grimy texture. The scallops were tender and flavorful with a nice caramelized coat. The ~$50 steak was not cooked to order. Here's my logic: If you pay more, you should get more. So, if an average restaurant charges above average prices, it warrants a below average ranking. Conclusion: Come here only if you want to impress your high school prom date or your bourgeois wife. Just because a restaurant decides to dim its' lights and is liberal with butter, it doesn't make it 'nice' or 'fancy'. See below for supplemental info: - Price: Not worth it (~$15 and ~$40 per starter and entree, respectively) - Atmosphere: Not my cup of tea, 2/5 (Old Houston blood peppered with 'special occasion' diners) - Service: Great, 5/5 - Sanitation: Great , 5/5 Big turnoff: - Cheesy atmosphere. Is the metal contraption that they skewer strawberries suppose to be chichi? Seriously, it could hurt someone (visually or physically)!","alt=""2.0 star rating""",2,tonys-houston-2,tonys-houston-2https://www.yelp.com/biz/tonys-houston-2?start=180,HART G.,"Houston, TX",1,53,,,9/5/15,"Since we moved back to Houston eight years ago Tony's has become a family tradition. The food and service was always top notch. It was always the perfect place to go for a special occasion. The situation changed about two years ago. My family dresses very nicely when we go to Tony's. Over the last few years we have felt like the service had gone way down. The food is still quite good. The last time we were at Tony's waiter's English was not very good and he completely screwed up our order. The food was excellent but it wasn't what we ordered. The time before that there was a new waiter who took our order. We listen to her recite the off menu specials. I asked her to repeat the lobster special. She literally wrinkled her nose at me and repeated the lobster special. She kept looking over her shoulder as we were trying to place our order. Even my normally sweet wife started giving me the look. After we placed our order she asked me ""What is WRONG with that waitress?"". Her words not mine. Normally Tony's serves each course simultaneously. A flurry of waiters serve each guest their course at exactly the same time. One half of the other couple at our table had to reorder his appetizer. I can handle that kind of service of the corner diner.","alt=""3.0 star rating""",3,tonys-houston-2,tonys-houston-2https://www.yelp.com/biz/tonys-houston-2?start=180,Baja B.,"Houston, TX",0,11,,,10/28/14,"Possibly the best place in town for entertaining business clients as well as a high end romantic evening. Pretty much everything on the menu is incredible and the wine options as well as the service, are always second to none. My best advice, wear pants that have some room in the waist because rest assured you're going to get full. Uber also a good idea if you're an oenophile.","alt=""5.0 star rating""",5,tonys-houston-2,tonys-houston-2